data,player,language,publishedAt
trainer alonso mitgereisten fans monaco glucksmoment hebt tor euro highlight geht bundesliga sonntag uhr freiburg weiter,exequiel palacios,de,2023-02-24T09:33:31Z
sechser droht viereinhalb monaten pause bitterer abschied bayerleverkusen dafur erscheint verletzungspause lang zudem konkurrenzsituation doppelsechs seit woche voll saft stehenden amiri demirbay andrich voraussetzungen extrem schwierige fur aranguiz zuletzt aufgrund personellen engpasse innenverteidigung zentral abwehrkette eingesetzte andrich kunftig mittelfeld auflaufen durfte alonso vorrucken jahrigen sechs sonntag hertha bsc nicht sicher einstufen mochte,exequiel palacios,de,2023-03-03T21:35:13Z
bayerleverkusen sechser erklart budapest spiel jungsten fortschritt bayerleverkusen donnerstag achtelfinal hinspiel europaleague ferencvaros budapest empfangt andrich fehlen sah defensive mittelfeldspieler erfolg elfmeterschiessen monaco dritte gelbe karte gesperrt massive schwachung fur werkself doppelsechs andrich zuletzt erfolgsfaktor andrich ausgerechnet kurzen phase saison bayerleverkusen gleichzeitig spielerisch uberzeugt erfolgreichen fussball spielt zwangspause einlegen muss wurmt bedingt das argerlich irgendwann ware sperre wahrscheinlich gekommen daher lieber jetzt eventuell viertel halbfinale keine sorgen erklart jahrige lacheln,exequiel palacios,de,2023-03-07T11:34:39Z
bakker mittwoch abschluss training bayerleverkusen nicht ausgeschlossen jedoch bakker ungarn startelf steht option erklart alonso mittelfeld doppel sechs verzichten muss andrich gesperrt fur stehen demirbay amiri bereit frimpong budapest einsatzbereit hertha wegen muskularer probleme bereits minuten platz verlassen mussen gut trainiert fuhlt besser dabei erklart alonso grossen respekt ungarn hat das sehr guter gegner sehe niveau monaco,exequiel palacios,de,2023-03-08T14:25:18Z
aktuelle nachrichten politik wirtschaft sport kultur allerdings andrich argentinischen weltmeister beide eigentlich gesetzten sechser gesperrt charles aranguiz zudem verletzt donnerstag machten sache zumindest ordentlich mehr thema,exequiel palacios,de,2023-03-09T19:53:46Z
spaten tor joker sven michel union berlin mitreissenden achtelfinal hinspiel europaleague unentschieden gerettet chancen weiterkommen deutlich verbessert berliner taten royale union saint gilloise heimischen stadion alten forsterei erneut schwer kamen zuschauern schossen victor boniface minute yorbe vertessen gaste dreimal fuhrung josip juranovic robin knoche michel erzielten jeweiligen ausgleichstore fussball bundesligisten comeback qualitaten bewies,exequiel palacios,de,2023-03-09T20:01:53Z
gut sein fehlentscheidung sascha stegemann borussia dortmund meisterschaft kostet entscheidenden momente gab bundesliga historie mehrfach sportschau blickt zuruck,exequiel palacios,de,2023-03-09T20:18:19Z
spielen nicht mit gucken weit geht auf platz gefuhl spiel gut kontrollieren sagte amiri rtl durchhanger zweiten halfte als bisschen gefahrlich geworden sind brachte bayerleverkusen diesmal nicht wanken grossen ganzen sehr gutes spiel gemacht erwachsen konzentriert durchgezogen lobte amiri demirbay mittelfeldzentrum anstelle gelbgesperrten andrich fur gewisse stabilitat balance gesorgt hatte gerade erwachsene spielweise brauche auch denn man weiss uns vogelwild wird geht her tut nicht gut anfallig fur gegentore,exequiel palacios,de,2023-03-09T22:03:00Z
bayerleverkusen trainer stellt nahende wiedersehen klub bayern munchen rotationsproblem fur erste spiel bremen gestaltet zumindest einfacher februar hinspiel monaco niederlage mainz startelf funf positionen anderte stehen stamm sechser andrich donnerstag gesperrt waren frisch fur einsatz beginn verfugung disziplinproblemen hertha bsc nicht berucksichtigte budapest nicht eingesetzte bakker links anfangsformation rutschen konnte mittelsturmer patrik schick sieht trainer braucht vielleicht mehr zeit hingegen offenbar nicht bereit fur erste elf adam hlozek adli bieten zwei alternativen fur dreieroffensive,exequiel palacios,de,2023-03-10T17:47:41Z
heisse begegnung bremen trotz fruhen fuhrungstreffers marvin duksch gibt werder bundesliga spiel bayerleverkusen hand niclas fullkrug verkurzt kurz schluss per elfmeter tor kommt spat spiel nachlesen,exequiel palacios,de,2023-03-12T11:30:02Z
torschutzen sich diaby adli feiern adlis treffer fur bayerleverkusen argentinische weltmeister katar nachsten starken spiel standig ball hinkam note bakker minute grossen torchancen niederlander liess nichts anbrennen flanken fehlte bisweilen prazision note,exequiel palacios,de,2023-03-17T07:01:04Z
munchner gehen verfolger liga gipfel borussia dortmund joshua kimmich brachte munchner fuhrung argentinische weltmeister drehte spiel zwei verwandelten foulelfmetern schiedsrichter tobias stieler gefoulten adli wegen vermeintlicher schwalben jeweils zunachst gelb gegeben beide male nahm karte videostudium zuruck bayerleverkusen dicht europacup platzen dran zuvor union berlin duell woche internationalen geschaft gescheiterten mannschaften anspruch champions league platze untermauert oberosterreicher oliver glasner trainierte frankfurter eintracht kletterten berliner nunmehr punkten dritten platz distanzierten sechsten platz liegenden hessen zahlern halten,exequiel palacios,de,2023-03-19T18:22:00Z
bayern nicht mehr tabellenfuhrer fussball bundesliga bayerleverkusen liegt schiedsrichter tobias stieler zweimal komplett daneben zweimal videoassistenten korrigiert zweimal jubelt bayerleverkusen kurz darauf fur munchner dritte pleite saison bayerleverkusen drehte spiel minute foulelfmeter verwandelte schiedsrichter tobias stieler benotigte beiden strafstossen kraftige unterstutzung video assistenten stieler gab beiden fallen adli zunachst gelb wegen vermeintlichen schwalbe nahm karten jeweils zuruck gravierende fehleinschatzungen bayerleverkusen var korrektur wohl sieg gebracht hatten bayerleverkusen begann stark schwungvoll fcb keeper yann sommer aufmerksam direkt aufs tor gezogenen ecke demirbay parierte frimpong unmittelbar davor verfehlte diaby distanz knapp besser geht zeigten bayern flanke joao cancelo legte leon goretzka kimmich elf metern muhelos verwandelte gegentreffer nahm bayerleverkusen schwung uberzeugung anfangsphase beide teams neutralisierten weitgehend,exequiel palacios,de,2023-03-19T18:28:09Z
riesenfreude bayerleverkusen bayerleverkusen schlug bayern argentinier einziger aktueller weltmeister bundesliga drehte spiel zwei foulelfmetern kurios schiedsrichter tobias stieler beiden aktionen benjamin pavard dayot upamecano gefoulten adli wegen vermeintlicher schwalben zunachst gelb xagegeben bayerleverkusen drucker bevor munchner erste chance hatten gab weitere chancen diaby frimpong uberraschender jeweils ecken torschusse minuten uber prozent ballbesitz gastgeber dann nichts schlug serienmeister eiskalt leon goretzka legte fur kimmich schuss odilon kossounou unhaltbar latte xaabfalschte bereits kimmichs vierter saisontreffer mehr lediglich saison sechs standige gesang fans ein schuss tor bayern somit absolut passend standen bayern kompakter bekamen mehr spielkontrolle nahmen leverkusenern wind segeln allerdings pause weitere gelegenheit erarbeiten nagelsmann trotzdem nicht wirklich zufrieden war signalisierte dreifach wechsel pause neben musiala gnabry kam kinsgley coman thomas muller sadio mane joao cancelo blieben der xakabine,exequiel palacios,de,2023-03-19T18:28:23Z
sonntagspartien fussball bundesliga spieltags uberblick joshua kimmich nationalmannschaft abwesenheit manuel neuer kommenden woche kapitan anfuhren wird munchner fuhrung gebracht argentinier einziger aktueller weltmeister bundesliga drehte spiel zwei foulelfmetern kurios schiedsrichter tobias stieler beiden aktionen benjamin pavard dayot upamecano gefoulten adli wegen vermeintlicher schwalben zunachst gelb gegeben beide male nahm karte videostudium zuruck beide male entschuldigte adli beide male zeigte verspatung punkt bayerleverkusen europaleague einziger bundesligist neben munchnern viertelfinale europacup wettbewerbs steht baute verdienten sieg serie sieben pflichtspiele niederlage dicht dran europacup platzen trainer alonso team hervorragend eingestellt hatte setzte zeichen bayern bosse ehemalige mittelfeld stratege fur bayern spielte munchen moglicher trainer zukunft beobachtet bayerleverkusen drucker bevor munchner erste chance hatten gab weitere chancen diaby frimpong uberraschender jeweils ecken torschusse minuten uber prozent ballbesitz gastgeber dann nichts schlug serienmeister eiskalt leon goretzka legte fur kimmich schuss odilon kossounou unhaltbar latte abfalschte bereits kimmichs vierter saisontreffer mehr lediglich saison sechs nagelsmann nicht wirklich zufrieden war signalisierte dreifach wechsel pause neben musiala gnabry kam kinsgley coman thomas muller sadio mane joao cancelo blieben kabine tor fiel seite verstarkten bayern offensiv bemuhungen musiala verzog tollem solo doppelpass gnabry knapp folgte nachste elfmeter ruckstand druckten gaste ausgleich bayerleverkusen keeper hradecky lief hochstform auf,exequiel palacios,de,2023-03-19T18:35:00Z
ausgerechnet topspiel bvb patzt munchen zwei skurrile elfmeter situationen sorgen fur entscheidung kimmich nationalmannschaft abwesenheit manuel neuer kommenden woche kapitan anfuhren wird munchner fuhrung gebracht argentinier einziger aktueller weltmeister bundesliga drehte spiel zwei foulelfmetern bayerleverkusen hradecky kossounou andrich tapsoba frimpong fosu mensah demirbay hincapie diaby tah wirtz hlozek adli bakker munchen sommer pavard stanisic upamecano ligt joao cancelo gnabry kimmich davies sane goretzka tel muller musiala mane coman schiedsrichter stieler zuschauer ausverkauft tore kimmich foulelfmeter foulelfmeter bayerleverkusen europaleague einziger bundesligist neben munchnern viertelfinale europacup wettbewerbs steht baute verdienten sieg serie sieben pflichtspiele niederlage dicht dran europacup platzen wir aggressiv viele zweikampfe gewonnen lobte defensivspieler andrich trainer alonso team hervorragend eingestellt hatte setzte zeichen bayern bosse ehemalige mittelfeld stratege fur bayern spielte munchen moglicher trainer zukunft beobachtet wir top energie gespielt lobte alonso kurioserweise bayern keine englische woche knochen hatten nagelsmann wechselte trotzdem zweimal thomas muller leon goretzka ersetzten beginn serge gnabry jamal musiala,exequiel palacios,de,2023-03-19T18:38:59Z
aktuelle nachrichten politik wirtschaft sport kultur nicht ergebnis beobachter uberrascht mag seltenheitswert beiden treffer werkself zweimal zeigte schiedsrichter tobias stieler adli gelbe karten glaubte franzose mittels schwalben fouls strafraum vorgetauscht zweimal griff videoassistent korrigierend ein gab jeweils elfmeter ezequiel verwandelte erstaunlichen sieg moglich machten borussia dortmund erstmals seit spieltages tabellenspitze steht gluck spiel ergebnis unverdient sieg fur werkself keinesfalls mannschaft alonso insgesamt niveauvoll fussball gespielt wahrend bayern vielen phasen matt wirkten stunde rheinlander meist ball agierten mutig chancen zweikampf traf benjamin pavard fuss adli verursachte strafstoss fuhrte bevor dayot upamecano gleiche missgeschick passierte zweiten elfmetertreffer schiessen konnte schlussphase uberlegenheit munchner erdruckend bayerleverkusen torhuter lukas hradecky abwehr hielten tatsachlich stand mehr thema,exequiel palacios,de,2023-03-19T18:39:29Z
bayern geht zwei kuriosen elfmeter entscheidungen tabellenzweiter bundesliga hit borussia dortmund april munchner verloren halbzeit fuhrung verdient bayerleverkusen punkt ruckstand bvb tag zuvor koln gewonnen hatte joshua kimmich nationalmannschaft abwesenheit manuel neuer kommenden woche kapitan anfuhren wird munchner fuhrung gebracht argentinier einziger aktueller weltmeister bundesliga drehte spiel zwei foulelfmetern kurios schiedsrichter tobias stieler beiden aktionen benjamin pavard dayot upamecano gefoulten adli wegen vermeintlicher schwalben zunachst gelb gegeben beide male nahm karte videostudium zuruck beide male entschuldigte adli beide male zeigte verspatung punkt bayerleverkusen europaleague einziger bundesligist neben munchnern viertelfinale europacup wettbewerbs steht baute verdienten sieg serie sieben pflichtspiele niederlage dicht dran europacup platzen trainer alonso team hervorragend eingestellt hatte setzte zeichen bayern bosse ehemalige mittelfeld stratege fur bayern spielte munchen moglicher trainer zukunft beobachtet bayerleverkusen drucker bevor munchner erste chance hatten gab weitere chancen diaby frimpong uberraschender jeweils ecken torschusse minuten uber prozent ballbesitz gastgeber dann nichts schlug serienmeister eiskalt leon goretzka legte fur kimmich schuss odilon kossounou unhaltbar latte abfalschte bereits kimmichs vierter saisontreffer mehr lediglich saison sechs standige gesang fans ein schuss tor bayern somit absolut passend standen bayern kompakter bekamen mehr spielkontrolle nahmen leverkusenern wind segeln allerdings pause weitere gelegenheit erarbeiten,exequiel palacios,de,2023-03-19T19:02:39Z
bayern munchen tabellenfuhrung deutschen bundesliga borussia dortmund verloren rekordmeister verlor sonntag zwei kuriose elfmeter videobeweis bayerleverkusen team trainer julian nagelsmann dritten saisonniederlage punkt ruckstand dortmund samstag koln gewonnen hatte gehen bayern verfolger duell borussia april joshua kimmich brachte munchner fuhrung argentinische weltmeister drehte spiel zwei verwandelten foulelfmetern schiedsrichter tobias stieler gefoulten adli wegen vermeintlicher schwalben jeweils zunachst gelbe karte gegeben beide male nahm karte videostudium zuruck bayerleverkusen dicht europacup platzen dran tabellendritter union berlin heimsieg eintracht frankfurt leipzig vorbei rang vier schob freiburg mainz tore elfmeter elfmeter bzw kimmich bayerleverkusen pentz ersatzbayern wanner,exequiel palacios,de,2023-03-19T19:14:59Z
adli verspricht schiedsrichter trikot duplizitat ereignisse bayerleverkusen bayern zweiten halfte bot zweimal drang adli munchner strafraum ein kam fall sah zweimal gelbe karte leverkusener offensivspieler nicht gelb rot platz flog lag var team soren storks meldete namlich feld schiedsrichter tobias stieler chance bekam ursprungliche entscheidung korrigieren gab jeweils elfmeter fur werkself beide sicher endstand verwandelte beide entscheidungen standen zwei extremen sagte stieler partie dazn ein weiterspielen kam fur nie betracht begrundete referee entscheidung adli wegen vermeintlichen schwalben verwarnen bei situation sehe kontakt nicht sehe fallen total atypisch war deshalb schwalbe entschieden review area erkannte stieler benjamin pavard adli hacke getreten atypische fallen ausgelost hatte,exequiel palacios,de,2023-03-19T20:00:00Z
nix stieler lag zwei entscheidenden situationen maximal daneben zweimal referee hamburg liga sonntagsspiel bayerleverkusen bayern munchen machtig geirrt zweimal bezichtigte leverkusener adli schwalbe bayern strafraum zweimal verhangte fur vermeintlichen tauschungsversuch voller uberzeugung gelbe karte und zweimal kleinlaut zurucknehmen entschuldigung bitten foulelfmeter fur bayerleverkusen geben zweimal verwandelte wurde uberraschender sieg leverkusener adli nicht nachtragend ganz gegenteil wir geherzt wahrend spiel verriet stieler trikot versprochen sehen ankommt,exequiel palacios,de,2023-03-19T20:01:45Z
verwenden cookies angebot fur verbessern mehr informationen finden unserer datenschutzerklarung lag einfach uberaus kuriosen art weise bayerleverkusen spiel ruckstand sieg gedreht hatte xadenn zweimal quasi identische szene ereignet hauptbeteiligten bayerleverkusen offensivmann adli schiedsrichter tobias stieler video assistant referee var xaund hauptdarsteller var festspiele bayerleverkusen amin adli schiedsrichter tobias stieler,exequiel palacios,de,2023-03-19T20:12:00Z
alonso alonsos kniff andrich zuvor werkself guten beginn hingelegt liess ruckstand nicht hangen gegenteil wiederbeginn bayerleverkusen aktiver gaste munchen drehte zwei verwandelte var elfmeter partie mit zuschauern hexenkessel selten erlebt habe schwarmte hradecky unterstutzung rangen naturlich geholfen auch die bayern nicht besten tag erwischt hatten unser tag umso besser freute keeper verteilte ausdrucklich lob alle jeder verdient teil sieg mittagsschlaf handy nachricht trainer heute spielst libero,exequiel palacios,de,2023-03-19T22:08:00Z
dass videobeweis beitragen wurde jahrelang scheintote spannung bundesliga wiederzubeleben wer hatt gedacht genau sonntag bayarena bestaunen schreiben die spielminute xatopspiel werkself xaund rekordmeister xaleverkusens xaamine adli fallt xaim strafraum xader munchner xaschiedsrichter tobias stieler wittert allerdings oscarreife schauspieleinlage zeigt fachgerecht gelb xaausgerechnet kolner keller beweist jedoch unschuld jahrigen xastieler nimmt entscheidung samt verwarnung zuruck spricht leverkusener strafstoss der xaargentinische weltmeister lasst nicht nehmen trifft schreiben spielminute xatopspiel werkself xaund rekordmeister xaleverkusens xaamine adli fallt xaim strafraum munchner xaschiedsrichter tobias stieler wittert allerdings oscarreife schauspieleinlage zeigt fachgerecht gelb xaausgerechnet kolner keller beweist jedoch unschuld jahrigen xastieler nimmt entscheidung samt verwarnung zuruck spricht leverkusener strafstoss der xaargentinische weltmeister lasst nicht nehmen trifft keine sorge werter leser sehen nicht doppelt genauso tatsachlich passiert zweimal vermeintliche schwalbe zweimal videobeweis zweimal elfmeter xadas vielleicht nicht gerade wunder bern zumindest kurios genug fur den xastern xades spieltags xain dortmund durften beommeln bvb startet neue woche spitzenreiter sollten ergebnisse platzen xanoch nachlesen wollen geht entlang auch kolner diesmal davon abraten kann,exequiel palacios,de,2023-03-20T05:11:00Z
borussia dortmund sagt schiri boss gluck entscheidung all schelte video assistenten immer langst nicht immer recht einstecken mussen bot sonntagliche spiel bayerleverkusen bayern munchen deutlichen kuriosen kontrast zweimal nahm schiedsrichter tobias stieler schwalbe adli strafraum bayern wahr verwarnte deshalb jeweils beide male intervenierte var soren storks jedoch vollig recht adli klar gefoult worden war stieler nahm folgerichtig beiden fallen gelbe karte zuruck bat adli per handschlag entschuldigung sprach leverkusenern strafstoss sicher verwandelte var hausherren partie womoglich verloren adli gelb rot feld verlassen mussen unparteiischen ware welle kritik entgegengeschlagen einverstanden leverkusener ohnehin referee ebenfalls lebensretter nannte kollegen erkennbar erleichtert interview senders dazn sogar bayern trainer julian nagelsmann hielt fest ich generell freund var sagte coach heute zwei elfmeter demnach sinne gerechtigkeit daher bitter fair,exequiel palacios,de,2023-03-20T05:39:04Z
bayern argert uber selbst beiden elfmeterszenen spiel rechnerisch ungunsten bayern drehte kommentierte unisono fair ich beide male gute sicht daher fur relativ schnell ersichtlich beides elfmeter waren sagte nagelsmann beim gleich gedacht adli ferse getroffen wurde zweiten wusste ich schwalbe fall nicht war schiedsrichter stieler beiden fallen bayerleverkusen adli zunachst gelb gegeben beide male nahm zuruck entschuldigte gab elfmeter bayerleverkusen sieg sicherte wenn uber videobeweis gecheckt wird denke ich zweimal klar wird sagte torschutze joshua kimmich nagelsmann zog versohnlich strich thematik ich generell freund var sagte coach heute zwei elfmeter demnach sinne gerechtigkeit daher bitter fair,exequiel palacios,de,2023-03-20T05:55:43Z
wurde video assistenten nicht geben bayern sonntag wohl bayerleverkusen gewonnen bayerleverkusen adli gelb rot gesehen endet spiel fur bayerleverkusen stieler beiden fallen bayerleverkusen adli zunachst gelb gegeben beide male nahm zuruck entschuldigte gab elfmeter bayerleverkusen sieg sicherte unparteiische nachher erleichtert ich wurde gerettet spiel wurde gerettet sagte denn zwei fehlentscheidungen stehen geblieben daher nehme heute humor ebenso sah adli stieler trikot versprach heute froh var eingegriffen hat sagte franzose wahrend entscheidungs findung sei naturlich angespannt nervos gewesen aber einfach glucklich entscheidung adli ausgetretenen schuh gezeigt anschliessend vehement rasen gepfeffert gluck hatte nicht voreilig gelb rot sehen,exequiel palacios,de,2023-03-20T07:29:11Z
aktuelle nachrichten politik wirtschaft sport kultur stieler beiden fallen bayerleverkusen adli zunachst gelb gegeben beide male nahm zuruck bat entschuldigung gab elfmeter bayerleverkusen sieg sicherte unparteiische nachher erleichtert der var immer kritisiert gut quasi lebensretter fur spiel lebensretter sagte denn zwei fehlentscheidungen stehen geblieben daher nehme heute humor ebenso sah adli stieler trikot versprach heute froh var eingegriffen hat sagte franzose wahrend entscheidungs findung sei naturlich angespannt nervos gewesen aber einfach glucklich entscheidung adli ausgetretenen schuh gezeigt anschliessend vehement rasen gepfeffert gluck hatte nicht voreilig gelb rot sehen,exequiel palacios,de,2023-03-20T07:48:37Z
protest schlechter nicht altern konnen ausgerechnet leverkusener fans wahrend partie bayern grosses banner aufschrift videobeweis abschaffen gezeigt grossen profiteure technischen hilfsmittel zweimal regelhuter kolner keller verantwortender position soren storks gemeldet zweimal korrigierte schiedsrichter tobias stieler entscheidung zurecht zugunsten bayerleverkusen,exequiel palacios,de,2023-03-20T09:29:34Z
dazn experte michael ballack gesprach julian nagelsmann moderatorin laura wontorra trainer alonso weltmeister sieht man jungs fit sind marschieren drei tage spielen konnen spricht fur trainings belastung trainings steuerung gerade schweren internationalen gang draufzusetzen spricht fur leverkusener naturlich fur trainer schwarmte dazn experte michael ballack alonsos team,exequiel palacios,de,2023-03-20T13:16:11Z
trifft fur bayerleverkusen bayern einzige aktuelle weltmeister bundesliga verdammt eilig bayern wurde uberraschenden elfer helden ich glucklich beide tore schiessen konnte wichtiger sieg fur fans genauso mussen weitermachen trainer gesagt schiessen woche viele elfmeter trainiert freue mich verwandelt habe wusste ruhig bleiben muss wichtige momente druck nerven behalten kuhlen kopf bewahrt gluck gutgegangen alonso gibt elfmeter schutzen anweisungen warum fiel wahl plotzlich trainer alonso wir fur europaleague spielern elfmeter geubt vertrauen pala training gut gemacht hat letzten zwei monaten gut gespielt selbstvertrauen manchmal wichtigste elfer doppel stellte klub rekord ein zuvor sturm idolen ulf kirsten stuttgart dimitar berbatov lautern gelungen zwei strafstosse bundesliga spiel fur bayerleverkusen verwandeln gewinn erhofften schub gegeben seit wochen uberragenden form wir viele spiele beinen bundesliga europaleague gluck konnten viele siege einfahren blickt mittelfeld abraumer letzten wochen zuruck jetzt geht argentinien zeit freunden familie verbringen freue nationalelf bayerleverkusen uber bayern alonso alonsos meisterstuck trainer,exequiel palacios,de,2023-03-20T13:56:19Z
schalke reis nimmt spieler ausdrucklich schutz rollenverteilung klar tom krauss pflicht alleiniger sechser wirtz beschatten wahrend alex kral andrich drexler kummern sollten pause wurde drexler ausgewechselt wochenlangen ausfall nicht ungewohnlich war klar tank nicht komplett voll ist sagte drexler anschliessend fur kam eder balanta spiel trainer thomas reis hielt ursprunglichen rollenverteilung fest heisst krauss blieb alleinunterhalter sechserposition neben kral fungierte balanta achter weiterhin passe leverkusener schnellen aussenbahnspieler unterbinden,exequiel palacios,de,2023-04-03T08:12:20Z
funf scorerpunkte marz folgerichtig guerreiro wahl spieler monats potm marz bundesliga frimpong beide bayerleverkusen omar marmoush vfl wolfsburg marius bulter schalke erhan masovic vfl bochum durchgesetzt viele fans aufgrund ausblicks enormes tempo eher frimpong gewunscht guerreiros potm karte ebenfalls starken grundattributen stechen dribbling pass hervor einzig physis verhindert aufnahme sogenannte gullit gang gruppe spielern deren sechs hauptwerte fut allesamt mindestens punkte betragen genaueren spezialkarte wissen vornehmlich beweglichkeit balance kurzpasse uberzeugen,exequiel palacios,de,2023-04-07T13:44:53Z
lasst gegner schlecht aussehen macht mitspieler besser bayerleverkusen teenager wirtz zweiter rechts danach wirtz mehrfach knapp dran lupenreinen assist hattrick entweder verdaddelten mitspieler gute ideen kevin trapp lenkte kaum haltbaren ball adli neben pfosten wirtz gerne ubersehen wird schafft spiel kollegen sicherheit geben frankfurt fielen verteidiger edmond tapsoba tah auf erfolgreich frankfurter sturmer randal kolo muani konzentrierten torschutze adli sturmer zeigten inspiriert wirtz wirbel ihr xakonnen nicht mehr nennenswerte aspekte wirtz darbietung gab lag selbst darum ging treffen wirkte weniger zielstrebig trapp minute weitere parade ermoglichte dennoch sah lange osterspaziergang fur werksklub frankfurter kraft vermissen liessen vergangenen saison international furchteinflossend gemacht xahatte,exequiel palacios,de,2023-04-08T19:43:08Z
