data,player,language,publishedAt
"leverkusens edmond tapsoba berlins sheraldo becker kampfen ball dabei schaut schweizer nicht moussa diaby bereits funf tore bisherigen sieben bundesligaduellen union bejubeln durfte jeremie frimpong amine adli gehoren schnellsten spielern bundesliga ,,es braucht kurze abstande bereit unterstutzen nicht drauf leverkusen hohe geschwindigkeit schwierig verteidigen"" sagte fischer team spaniers xabi alonso derzeit ,,formstarkste mannschaft"" adelte seit pflichtspielen nicht mehr verloren angesichts tabellenkonstellation seit heimspielen ungeschlagenen tabellendritten sechstplatzierten gast leverkusen konnten gaste mehr spielanteile fur behaupten spielweise unioner zugutekame frage geduld beantwortet wobei fischer geduld nicht abwarten verwechseln mochte ,,wenn abwartend beginnen spielen nie geholfen zweite halfte bochum abwartend"" sagt trainer ruckblickend vorherige heimspiel beim abstiegskandidaten ,,wir tun gut daran ersten minute aktiv schluss heimspiel gewinnen",moussa diaby,de,2023-04-27T12:25:55Z
content hinrunde bekam rani khedira mittelfeldspieler union berlin kerem demirbay bayer leverkusen tun,moussa diaby,de,2023-04-28T14:19:00Z
fur jordan siebatcheu sturmer union berlin leverkusens torwart lukas hradecky endstation leverkusen erstaunlich abwartend wenngleich fussballerisch klar uberlegen florian wirtz mitchel bakker naturlich moussa diaby dahinter unioner robert andrich aggressive leader wussten wirbeln kamen chancen diaby witz szene gesetzt haberer ball zuvor andrich verloren bakker jerome roussillon konnte klaren seitenwechsel erhohte union schlagzahl aissa laidouni becker siebatcheu gelbgesperrten kevin behrens ersetzte kamen chancen tor jedoch nicht gelingen,moussa diaby,de,2023-04-29T15:22:00Z
union berlin bayer leverkusen serien ausgebaut nullnummer alten forsterei hilft beiden internationalen ligen bedingt bayers gefahrlichste szene leitete bemerkenswerterweise ehemalige unioner robert andrich balleroberung berliner halfte schuss moussa diaby ging druber zweidrittel ballbesitz nutzten leverkusenern ersten halbzeit nichts blieben harmlos bisschen verzogerung initiierten gastgeber jahr schon schalke koln vfl bochum daheim gespielt zumindest kurzzeitige ahnliche drangphase pause spielbeginn aissa laidouni becker trafen nicht zwischendurch frederik ronnow unioner tor diaby retten mussen dichte verteidigung berliner kam bayer elf trotz passquote phasenweise prozent einfach kaum alonso reagierte brachte beiden frischen sturmer amine adli sardar azmoun fischer reagierte wechselte mittelfeldmann laidouni verhalf andras schafer comeback drei monaten zwangspause wegen fussverletzung spates tor fur sieger sorgen fischer schickte weitere neue krafte mittelfeld angriff aufs feld vergeblich blieb beim torlosen treffen,moussa diaby,de,2023-04-29T15:30:03Z
"union spitzenspiel besseren chancen jedoch weiteren grossen schritt richtung champions league union ronnow doekhi knoche leite laidouni schafer haberer thorsby juranovic khedira roussillon giesselmann siebatcheu michel beckerleverkusen hradecky kossounou tah hincapie frimpong andrich tapsoba bakker hlozek azmoun diaby adli wirtz schiedsrichter fritz zuschauer ausverkauft wirtz erste vielversprechende vorwartsbewegung gaste einleitete zuspiel minute verzog moussa diaby dahin union gespielt sturmischen anfangsphase mehrere gute gelegenheiten gehabt bayers abwehrspieler odilon kossounou klarte zweimal letzter sekunde kopfball jordan fand nicht ziel mitte ersten halfte verlor begegnung deutlich tempo union stand hinten sicher bayer kam vorn weiterhin gut gar nicht zuge sorgte kontern mitunter fur gefahr besten chance traf diaby zuspiel mitchel bakker ball nicht richtig kurz pause rutschte frimpong aussichtsreicher position beim versuch ball anzunehmen erste begann zweite halfte recht flott diesmal allerdings eher halbchancen beiden seiten minute gastgeber erneut zielstrebigere mannschaft kamen meist uber linke seite nachsten dran fuhrungstreffer becker schlenzer rechten pfosten vorbei flog danach tat nahe beider tore ausserst wenig erst schlussphase drehte bayer ausser beim kopfball bakker torwart ronnow nicht eingreifen fand nicht leverkusens trainer xabi alonso ,,das unentschieden faires ergebnis",moussa diaby,de,2023-04-29T15:32:17Z
sepp van berg feiert zwischenzeitlichen ausgleich beiden respekt gegner anzumerken uberraschend hochstens union beginn offensivere mannschaft leverkusen konterte etwa minute uber florian wirtz moussa diaby zweiten halbzeit fuhlte unweigerlich parallel stattfindende schach erinnert zwei strategische grossmeister namens xabi alonso urs fischer grossem kampf remis haar suppe suchen kleiner nachteil fur union kopenicker tatsachlich champions league spielen beiden konkurrenten leipzig freiburg spiele xagewonnen koln freiburg tor ritsu doan,moussa diaby,de,2023-04-29T15:37:30Z
warum sehe faz net nicht gegensatz leverkusenern daran vermochte ruckkehr nationalspieler super talent florian wirtz nichts jahrige magen darm probleme uberwunden robuste korperliche union defensive tat zunachst schwer bayers gefahrlichste szene leitete bemerkenswerterweise ehemalige unioner robert andrich balleroberung berliner halfte schuss moussa diaby ging druber zweidrittel ballbesitz nutzten leverkusenern ersten halbzeit nichts blieben harmlos bisschen verzogerung initiierten gastgeber jahr schon schalke koln vfl bochum daheim gespielt zumindest kurzzeitige ahnliche drangphase pause spielbeginn aissa laidouni becker trafen nicht zwischendurch frederik ronnow unioner tor diaby retten mussen dichte verteidigung berliner kam bayer elf trotz passquote phasenweise prozent einfach kaum mehr thema,moussa diaby,de,2023-04-29T15:37:38Z
ende applaus nullnummer alten forsterei,moussa diaby,de,2023-04-29T15:59:43Z
kaum durchkommen leverkusens florian wirtz links verzweifelt samstag defensive union berlin wissen meter richtig einzuschatzen erforderlich wurden interventionen unioner partie entzundeten kaum begonnen funf minuten hielt sheraldo becker metern drauf lukas hradecky grosseren muhen hernach verteidiger kouakou kossonou zwei mal grosserer not stelle erst vereitelte chance beckers minute jordan siebatcheu extremis parat fruchteten justierungen alonsos ubernahm leverkusen grossere kontrolle uber partie fand ausdruck blitzkonter florian wirtz ball moussa diaby ablegte franzose verfehlte xaziel rest partie grosserem ballbesitz leverkusener taktik gepragt zahen verteidigungshaltung unioner leverkusener versuchten unentwegt gegner zurechtzulegen immer verlagerten spiel geriet ums mal steril einfach schwer stadion durchzukombinieren wissen meter richtig einzuschatzen klagte deutsche nationalspieler florian wirtz immer versuchte individuelle kreativitat loch defensive sieb kopenicker reissen durchschlagenden xaerfolg,moussa diaby,de,2023-04-29T18:35:16Z
ganz entspannt beim fruhstuck amsterdam leverkusens trainer xabi alonso zuletzt berlin gelb gesperrte nadiem amiri dabei amiri held hinspiel beim sieg mungersdorf kurz einwechselung traf per freistoss bayer drehte partie anschliessend moussa diaby komplett,moussa diaby,de,2023-05-01T16:20:02Z
doppelpacker matchwinner leverkusen davie selke,moussa diaby,de,2023-05-05T20:28:33Z
content zukunft paris neymar messi heisse psg kandidaten fur sommer neapels super sturmer victor osimhen leverkusen star moussa diaby,moussa diaby,de,2023-05-05T10:22:34Z
warum sehe faz net nicht,moussa diaby,de,2023-05-27T16:30:22Z
inmitten tausender gluckseliger fans bochumer stadion konnten trainer thomas letsch helden kaum umarmungen retten klassenerhalt vfl bochum fussball bundesliga europacup aspiranten bayer leverkusen sorgte ruhrgebietsstadt fur grosse emotionen,moussa diaby,de,2023-05-27T16:03:12Z
inmitten tausender gluckseliger fans bochumer stadion konnten trainer thomas letsch helden kaum umarmungen retten klassenerhalt vfl bochum fussball bundesliga europacup aspiranten bayer leverkusen sorgte ruhrgebietsstadt fur grosse emotionen mannschaft verein stadt ausgezeichnet immer aufgestanden dran geglaubt spieltag heimspiel volle hutte sagte thomas letsch kleine ewigkeit nachdem trubel entronnen,moussa diaby,de,2023-05-27T16:03:12Z
kampf platz vfl fernduell leverkusen konnte ende saison tatsachlich eigentor fur klarheit sorgen beim wolfsburger leverkusen moussa diaby bayer fuhrung gebracht robert andrich traf schliesslich wolfsburger ausgleich eigene netz maximilian arnold liess per strafstoss folgen jeremie frimpong sorgte oktober fur endstand samstag mal rolle spielen konnte ... hie,moussa diaby,de,2023-05-22T12:15:46Z
daniel farke fuhlte ende unruhigen woche hektischen sonntags moralischer sieger chapeau total zufrieden leistung verdienter punktgewinn sagte trainer borussia monchengladbach dazn bayer leverkusen,moussa diaby,de,2023-05-21T19:53:27Z
mittag geruchte uber beschlossenes trainer daniel farke abend erfolgreiche aufholjagd dank zweier skurriler tor geschenke borussia monchengladbach unruhige woche nicht mehr fur moglichen gehaltenen punkt rheinischen duell bayer leverkusen beendet zunachst entwischte adli schonem pass piero hincapie marvin friedrich tunnelte links torhuter jan olschowsky verletzten jonas omlin vertrat beim zweiten treffer machte jahrige zumindest ungluckliche figur demirbay flanke jeremie frimpong kurzester distanz einkopfte dritten chance gastgeber insgesamt unspektakularen ersten halbzeit olschowsky stelle parierte schuss adli spitzem winkel zweiten versuch setzte moussa diaby weit druber gladbach kam dank gegnerischer hilfe uberhaupt chance bayer keeper lukas hradecky schuss hofmann zweimal nachfassen,moussa diaby,de,2023-05-21T19:46:28Z
warum sehe faz net nicht einsetzendem platzregen versuchte dreierkette agierende borussia farke weltmeister christoph kramer genesenen topsturmer marcus thuram vertraute folge mehr spielanteile ubernehmen einzig nationalspieler hofmann stellte bayer torwart lukas hradecky ernsthafte probleme gegenseite vergab moussa diaby vorentscheidung klaglich abpraller schoss franzose uber leere tor wenig spater kassierte demirbay funfte gelbe karte mehr thema beide teams drangten nachste tor besten moglichkeiten vergaben hincapie diaby postwendend seite stindl ausgleich fuss traf nachdem amiri ball hradecky spielen thuram eigenen tor fuss gespielt konnen rechte artikel erwerben,moussa diaby,de,2023-05-21T19:39:14Z
daniel farke fuhlte ende unruhigen woche hektischen sonntags moralischer sieger chapeau total zufrieden leistung verdienter punktgewinn sagte trainer borussia monchengladbach dazn bayer leverkusen,moussa diaby,de,2023-05-21T19:28:06Z
leverkusens frimpong gladbachs netz schenkten nichts gegenseite vergab moussa diaby vorentscheidung klaglich abpraller schoss franzose uber leere tor wenig spater kassierte demirbay funfte gelbe karte unverandert kamen beide mannschaften kabine unverandert blieb zunachst partie leverkusen stand defensiv kompakt gladbach blieb ideenlos machte bayer mal spannend mitchel bakker brachte hradecky ruckpass bedrangnis hofmann luchste ball schob aufs freie tor beide teams drangten nachste tor besten moglichkeiten vergaben hincapie diaby postwendend seite stindl ausgleich fuss traf amiri letzten minute ball unbedrangt fusse thuram spielte ausgleichstorschutzen ablegte,moussa diaby,de,2023-05-21T19:26:11Z
lars stindl letzten partien fur gladbach jubeln kerim demirbay neun spielen gladbach sechs treffern beteiligt drei tore dei assists fohlen schoss bundesliga schon drei tore nadiem amiri traf borussia funf mal oft verein moussa diaby gewann sechs bundesliga spiele fohlen dabei funf toren beteiligt treffer vier torvorlagen,moussa diaby,de,2023-05-20T05:00:50Z
leverkusens kader stosst destruktive romer grenzen erfahrung werkself vergangenen wochen schon haufig gemacht verteidigt gegner kompakt stellt gar massiert hinten rein fehlen werkzeuge bollwerk nachhaltig auseinanderzuschrauben herausragende hochstgeschwindigkeitsfussballer moussa diaby jeremie frimpong gegner leicht ausgebremst offensivspiel entscheidende facette fehlt phase saison viele mannschaften leverkusens exzellentes konterspiel taktische disziplin konsequentes defensivdenken mehr weniger eliminieren fehlt durchschlagskraft prasenz strafraum schon wolfsburg union berlin pause koln hinspiel rom bayer ernuchternde erfahrung,moussa diaby,de,2023-05-19T10:35:21Z
florian wirtz mitte bringt stimmungslage leverkusens roma perfekt ausdruck defensiv orientierten gegner bayer erwartet schon beim hinspiel roma offensiv aufs kontern beschrankt ersten halbzeit bearbeiteten leverkusener geduldigem passspiel gegnerischen stellungen angeordnet eisernen funfer abwehrkette plus vorgelagerter dreier reihe schufen passable gelegenheiten fur schusse strafraumgrenze kerem demirbay versuchte immer kontersituationen leverkusens spezialitat liessen romer nicht nahezu einzigen ausnahmefall traf moussa diaby latte minute konzentration gespielt gut vorbereitet kompetitiv lobte alonso xaspater bayer wenig geboten letzte bisschen vermissen lassen sagte rolfes durchsetzungskraft mourinhos eiserne festung sprengen konnen sardar azmoun alonso notgedrungen fachfremden angreifer strafraumzentrum platziert nie wurde seit monaten verletzte torjager patrik schick vermisst diesmal bayer elf stuck brav konnte fur abgezockte roma annahme beiden spielen bestatigt zumal schlusselspielern florian wirtz diaby jeremie frimpong geistige frische fehlte uberraschendes xazaubern mourinho blieb dennoch hut sorge bayer womoglich lucke fur schusse halbdistanz finden konnte knupfte coach zweiten halfte abwehrreihen dichter brachte mittelfeldspieler wijnaldum fur angreifer belotti erteilte schliesslich vermuten order offenen nervenkrieg gegnerischen rhythmus brechen negative emotionen wecken schauspieleinlagen zeit zerrinnen lassen all stand mutmasslich xataktiktafel leverkusen trainer xabi alonso versucht spieler anzutreiben kontrahent jose mourinho beobachtet ruhe mannes sechstes europacup finale,moussa diaby,de,2023-05-19T09:15:11Z
star trainer jose mourinho ruhrte roma halbfinal ruckspiel zement leverkusen biss daran zahne endspiel europa league wartet sevilla juventus verlangerung besiegte uber zuschauern ausverkauften bayarena dominierte werkself patrick pentz bank sass uber gesamte erste halfte hinweg spiel beste gelegenheit fand moussa diaby ball spitzem winkel rechte lattenkreuz knallte roma setzte offensiv gar akzente beschrankte ausschliesslich verteidigen konnte vorsprung hinspiel pause retten zweite spielabschnitt gestaltete zunachst ahnlich erste leverkusen verpasste weiterhin klare uberlegenheit tore umzumunzen demirbay scheiterte distanzschuss roma tormann rui patricio sardar azmoun verfehlte hereingabe diaby hauchzart ende brachte roma unentschieden kompakten defensivleistung uber zeit sevilla verbuchten beide teams ersten spielabschnitt vielzahl chancen lucas ocampos per kopf marcos acuna vergaben fur uberlegende heimteam aussichtsreiche gelegenheiten juventus wurde fast ausschliesslich umschaltspiel gefahrlich angel maria verfehlte gehause leichtfertig per lupfer moise keane scheiterte aluminium kurz pausenpfiff sorgte nicht gegebener elfmeter fur aufregung juan cuadrado gegenspieler oliver torres linie strafraums falle brachte seitenwechsel dominierte sevilla intensiv gefuhrte partie erste treffer fiel gegenseite dusan vlahovic chippte ball kurz einwechslung uber schlussmann yassine bounou tor fuhrung gaste wahrte nicht lange ebenfalls eingewechselte suso brachte rekordsieger sehenswerten distanzschuss zuruck spiel schlussphase rettete juve tormann wojciech szczesny team starken paraden verlangerung,moussa diaby,de,2023-05-19T07:28:00Z
bayer leverkusen muht ausschliesslich verteidigende romer vergeblich verpasst finale europa league danach frust gross team bemuht erhoffte fruhe tor vorzulegen ersten versuche kerem demirbay moussa diaby eher harmlos traf diaby schonem pass florian wirtz spitzem winkel latte spielfeld rand durchlebte alonso spiel intensiv lief dirigierte wild lautstark dagegen verspruhte mourinho wenige meter links demonstrativ gelassenheit meist handen taschen bewegte wenige meter links rechts pause torschusse prozent ballbesitz statistische zeugen leverkusener dominanz ausser diabys lattenkracher meisten torchancen schusse distanz mal mehr mal weniger gefahr verspruhten fur grosste aufregung sorgte szene minute romas abwehrspieler bryan cristante letzter mann sardar azmoun arm zog leverkusener forderten rote karte schiedsrichter slavko vincic slowenien liess weiterspielen direkt pause sorgten bayer fans pyro show wegen rauchentwicklung erst mal fur knapp zweiminutige spielunterbrechung mourinho halbzeit derweil nochmal defensiv gewechselt gelang gasten immer erfolgreicher kleinen nickligkeiten spielfluss unterbrechen leverkusener wurden angesichts davonlaufenden zeit immer hektischer azmoun vergab grosse chance dpa,moussa diaby,de,2023-05-19T07:07:49Z
jose mourinhos erster fuhrte xabi alonso startrainer rom trostete herzlichen umarmung ehemaligen spieler rannte erhobener siegerfaust kurve ruttelte ausgelassen fangzaun romischen abwehr bollwerk meister taktiker mourinho bayer leverkusens traum europa league triumph zerplatzt halbfinal ruckspiel rannte fussball bundesligist leidenschaftlich beherzt erfolglos schied hinspiel leverkusen vorwoche verloren team bemuht erhoffte fruhe tor vorzulegen ersten versuche kerem demirbay moussa diaby eher harmlos traf diaby schonem pass florian wirtz spitzem winkel latte spielfeld rand durchlebte alonso spiel intensiv lief dirigierte wild lautstark dagegen verspruhte mourinho wenige meter links demonstrativ gelassenheit meist handen taschen bewegte wenige meter links rechts pause torschusse prozent ballbesitz statistische zeugen leverkusener dominanz ausser diabys lattenkracher meisten torchancen schusse distanz mal mehr mal weniger gefahr verspruhten fur grosste aufregung sorgte szene minute romas abwehrspieler bryan cristante letzter mann sardar azmoun arm zog leverkusener forderten rote karte schiedsrichter slavko vincic slowenien liess weiterspielen direkt pause sorgten bayer fans pyro show wegen rauchentwicklung erst mal fur knapp zweiminutige spielunterbrechung mourinho halbzeit derweil nochmal defensiv gewechselt gelang gasten immer erfolgreicher kleinen nickligkeiten spielfluss unterbrechen leverkusener wurden angesichts davonlaufenden zeit immer hektischer azmoun vergab grosse chance informationen spiel uefa com deutsch,moussa diaby,de,2023-05-19T03:41:21Z
werfen schon blick beta version kunftigen seiten meinung konnen helfen com verbessern zunachst fuhlten demirbay moussa diaby links ehe wirtz franzosen steilpass szene setzte diabys beherzter abschluss spitzem winkel knallte ans lattenkreuz gaste denen star trainer mourinho elf stadio olimpico vertraute schienen beeindruckt offensiv kamen tief stehende romer xakaum entfaltung wahrend gastgeber weitere wenngleich nicht wirklich zwingende torabschlusse herausspielten,moussa diaby,de,2023-05-18T22:05:00Z
sevilla roma bestreiten heuer finale uefa europa league romern reichte donnerstag halbfinal ruckspiel torloses remis bayer leverkusen erfolg vorwoche endspiel einzuziehen wartet mai budapest rekordsieger sevilla hinspiel juventus turin verlangerung durchsetzte uber fans ausverkauften bayarena dominierte werkself osterreichische goalie patrick pentz bank sass uber gesamte erste halfte hinweg spiel beste gelegenheit fand moussa diaby ball spitzem winkel rechte lattenkreuz knallte roma setzte offensiv gar akzente beschrankte ausschliesslich verteidigen konnte vorsprung hinspiel pause retten ruckspiel bayer leverkusen steht roma dank hinspieltreffers bove konsequenter defensivarbeit finale europa league zweite halbzeit gestaltete ahnlich erste leverkusen verpasste weiterhin uberlegenheit tore umzumunzen kerem demirbay scheiterte distanzschuss roma tormann rui patricio sardar azmoun verfehlte hereingabe diaby hauchdunn ende brachten italiener unentschieden kompakten defensivleistung uber zeit red orf agenturen,moussa diaby,de,2023-05-18T22:00:06Z
warum sehe faz net nicht chancen blieben zunachst selten brillante florian wirtz gute ideen passe tiefe fuhrte gefahrlichsten situation ersten spielhalfte moussa diaby gelang starker abschluss recht spitzem winkel latte uber kurzen ecke krachte rom hingegen verteidigte arbeitete ganz geist trainers xajose mourinho fernschuss konnten italiener nicht verhindern echte druckphase serie leverkusener chancen stadion endgultig entzunden konnen verhinderten strategie erfolgreich vielversprechend fur leverkusen pause kopfball sardar azmoun iraner jedoch nicht entschlossen genug ausfuhrte,moussa diaby,de,2023-05-18T21:16:32Z
leverkusener abwehrmann jonathan tah kummert rom nicht ums verteidigen tammy abraham schiesst fast tor team bemuht erhoffte fruhe tor vorzulegen ersten versuche kerem demirbay moussa diaby eher harmlos traf diaby schonem pass florian wirtz spitzem winkel latte spielfeld rand durchlebte alonso spiel intensiv lief dirigierte wild lautstark dagegen verspruhte mourinho wenige meter links demonstrativ gelassenheit meist handen taschen bewegte wenige meter links xarechts pause torschusse prozent ballbesitz statistische zeugen leverkusener dominanz ausser diabys lattenkracher meisten torchancen schusse distanz mal mehr mal weniger gefahr verspruhten fur grosste aufregung sorgte szene minute romas abwehrspieler bryan cristante letzter mann sardar azmoun arm zog leverkusener forderten rote karte schiedsrichter slavko vincic slowenien liess recht xaweiterspielen direkt pause sorgten bayer fans pyro show wegen rauchentwicklung erst mal fur knapp zweiminutige spielunterbrechung mourinho halbzeit derweil mal defensiv gewechselt gelang gasten immer erfolgreicher kleinen nickligkeiten spielfluss unterbrechen leverkusener wurden angesichts davonlaufenden zeit immer hektischer azmoun vergab grosse xachance,moussa diaby,de,2023-05-18T21:12:59Z
jose mourinhos erster fuhrte xabi alonso startrainer rom trostete herzlichen umarmung ehemaligen spieler rannte erhobener siegerfaust kurve ruttelte ausgelassen fangzaun team bemuht erhoffte fruhe tor vorzulegen ersten versuche kerem demirbay moussa diaby eher harmlos traf diaby schonem pass florian wirtz spitzem winkel latte spielfeld rand durchlebte alonso spiel intensiv lief dirigierte wild lautstark dagegen verspruhte mourinho wenige meter links demonstrativ gelassenheit meist handen taschen bewegte wenige meter links rechts pause torschusse prozent ballbesitz statistische zeugen leverkusener dominanz ausser diabys lattenkracher meisten torchancen schusse distanz mal mehr mal weniger gefahr verspruhten fur grosste aufregung sorgte szene minute romas abwehrspieler bryan cristante letzter mann sardar azmoun arm zog leverkusener forderten rote karte schiedsrichter slavko vincic slowenien liess weiterspielen direkt pause sorgten bayer fans pyro show wegen rauchentwicklung erst mal fur knapp zweiminutige spielunterbrechung mourinho halbzeit derweil nochmal defensiv gewechselt gelang gasten immer erfolgreicher kleinen nickligkeiten spielfluss unterbrechen leverkusener wurden angesichts davonlaufenden zeit immer hektischer azmoun vergab grosse chance,moussa diaby,de,2023-05-18T21:03:28Z
immer unterbrechungen vermeintliche verletzungen diskussionen bereits halben stunde rom halbfinal ruckspiel euopa league bayer leverkusen begonnen spielfluss mitteln zerstoren ende erfolg team bemuht erhoffte fruhe tor vorzulegen ersten versuche kerem demirbay moussa diaby eher harmlos traf diaby schonem pass florian wirtz spitzem winkel latte spielfeld rand durchlebte alonso spiel intensiv lief dirigierte wild lautstark dagegen verspruhte mourinho wenige meter links demonstrativ gelassenheit meist handen taschen bewegte wenige meter links rechts pause torschusse prozent ballbesitz statistische zeugen leverkusener dominanz ausser diabys lattenkracher meisten torchancen schusse distanz mal mehr mal weniger gefahr verspruhten fur grosste aufregung sorgte szene minute romas abwehrspieler bryan cristante letzter mann sardar azmoun arm zog leverkusener forderten rote karte schiedsrichter slavko vincic slowenien liess weiterspielen direkt pause sorgten bayer fans pyro show wegen rauchentwicklung erst mal fur knapp zweiminutige spielunterbrechung mourinho halbzeit derweil mal defensiv gewechselt gelang gasten immer erfolgreicher kleinen nickligkeiten spielfluss unterbrechen leverkusener wurden angesichts davonlaufenden zeit immer hektischer azmoun vergab grosse chance gegner roms endspiel mai budapest sevilla juventus turin verlangerung bezwang partie minuten hinspiel geendet,moussa diaby,de,2023-05-18T21:00:51Z
einbahnstrassenfussball chance jagt chance bayer leverkusen defensives bollwerk namens rom einziges tor erzielt verpasst werkself finale europa league final experte defensiv meister jose mourinho zieht dagegen romern mal endspiel zunachst fuhlten kerem demirbay moussa diaby links ehe wirtz franzosen steilpass szene setzte diabys beherzter abschluss spitzem winkel knallte ans lattenkreuz gaste denen star trainer mourinho elf stadio olimpico vertraute schienen beeindruckt offensiv kam tief stehende roma kaum entfaltung wahrend gastgeber weitere wenngleich nicht wirklich zwingende torabschlusse herausspielten folge konzentrierte spielgeschehen fast ganzlich romische halfte bayer presste hoch wusste wirtz spielwitz gefallen halbzeit fur aufwand toren belohnen wechsel aufseiten werkself rollte ball sekunden pause spiel direkt unterbrochen bengalos erleuchteten leverkusener fan block rauchschwaden zogen uber spielfeld etwa zwei minuten spater setzte schiedsrichter slavko vincic partie fort,moussa diaby,de,2023-05-18T21:00:20Z
