data,player,language,publishedAt
"es kann gut sein, dass die fehlentscheidung von sascha stegemann borussia dortmund die meisterschaft kostet. solche entscheidenden momente gab es in der bundesliga-historie mehrfach - die sportschau blickt zuruck.\n sportschau\n ein sieg gegen st. pauli, ein patzer der konkurrenz: darmstadt steht kurz davor, sich den grossen traum vom bundesliga-aufstieg zu erfullen. damit konnte sich am wochenende fussball-geschichte wiederholen.\n sportschau\n sportschau\n beim torrekord von erling haaland hat manchester city in der premier league die tabellenfuhrung vom fc arsenal ubernommen. auch der fc liverpool feierte.\n sportschau\n eine umstrittene spielverlegung, viele gaste-fans und der kampf um wichtige punkte: leverkusen gegen koln bietet alles, was ein derby braucht.\n sportschau\n eintracht frankfurt zieht nach einem sieg beim vfb stuttgart ins finale des dfb-pokals ein. um einen videobeweis in der nachspielzeit gab es noch viele diskussionen.\n sportschau\n die new york knicks spielen erstmals seit zehn jahren wieder in den nba-playoffs um den halbfinaleinzug. eine wichtige rolle kommt auf isaiah hartenstein zu - einem , meter-wandersmann aus niedersachsen.\n sportschau\n die boston celtics haben in den nba-playoffs gegen die philadelphia ers zum : ausgeglichen.\n sportschau\n die edmonton oilers haben in der nhl den auftakt in die zweite playoff-runde gegen die vegas golden knights verloren. \n sportschau\n im vorjahr ging lennard kamna beim giro d'italia erfolgreich auf etappenjagd. ab samstag kampft er in neuer rolle um eine gute platzierung in der gesamtwertung. die favoriten auf einem schweren kurs sind aber andere.\n sportschau\n das konnte die vorentscheidung im titelkampf der handball-bundesliga sein: spitzenreiter thw kiel hat am . spieltag bei den rhein-neckar lowen gewonnen, konkurrent fuchse berlin patzte.\n sportschau\n analyse\n analyse\n es wird gepobelt, beleidigt und immer ofter auch zugeschlagen: gewalttaten gegen schiedsrichter im deutschen amateurfussball sind auf einem rekordniveau. immer weniger haben daher lust auf den job.\n mehr\n fortuna dusseldorf will bei drei heimspielen allen zuschauern freien eintritt gewahren. das soll durch sponsoren gewahrleistet werden. weitere details zum pilotprojekt in der kommenden saison sind noch nicht bekannt.\n mehr\n mehr\n der fc bayern munchen hat die trennung von trainer julian nagelsmann offiziell bestatigt. sein nachfolger wird thomas tuchel, der einen vertrag bis sommer erhalt. am montag soll er erstmals das training leiten.\n mehr\n der fc barcelona steht unter korruptionsverdacht. zwischen den jahren und soll der club rund , millionen euro fur angebliche beraterdienste an den damaligen vize des schiedsrichterausschusses gezahlt haben. von r. spiegelhauer.\n mehr\n die deutschen hockey-herren sind zum dritten mal weltmeister. das team von bundestrainer andre henning setzte sich im finale im indischen bhubaneswar gegen titelverteidiger belgien mit : im penaltyschiessen durch.\n mehr\n aus der traum fur eine wm-medaille: deutschlands handballer sind im viertelfinale gegen frankreich ausgeschieden. jetzt spielt die mannschaft um die range funf bis acht.\n mehr\n argentinien hat den titel bei der fifa wm in katar geholt. das team um superstar messi siegte in einem hart umkampften endspiel im elfmeterschiessen mit : gegen titelverteidiger frankreich. fur messi wurde damit ein traum wahr.\n mehr\n nach einem krisentreffen des deutschen fussball-bundes ist klar: bundestrainer flick soll die nationalmannschaft zur em fuhren, die in deutschland stattfinden wird.\n mehr\n eintracht frankfurt hat jahre nach dem gewinn des uefa-pokals den zweiten internationalen titel der vereinsgeschichte geholt. die hessen triumphierten im finale der europa league mit : im\xaelfmeterschiessen gegen die glasgow rangers.\n mehr'}\n ",jeremie frimpong,de,2023-04-20T21:08:51Z
) sowie jeremie frimpong (,jeremie frimpong,de,2023-04-20T21:11:48Z
"), jeremie frimpong (",jeremie frimpong,de,2023-04-20T21:15:24Z
"), jeremie frimpong (",jeremie frimpong,de,2023-04-20T21:20:28Z
) sowie jeremie frimpong (,jeremie frimpong,de,2023-04-21T04:27:00Z
"\n \n vortanzer: torschutze jeremie frimpong und seine kollegen feiern den halbfinal-einzug\n jeremie frimpong: ob vorne oder hinten - frimpong war uberall gleichzeitig, reagierte cool und nutzte seine chance zum :",jeremie frimpong,de,2023-04-21T07:56:02Z
"leverkusens metamorphose vom abstiegs- zum titelkandidaten\n trainer xabi alonso hat bayer vom abstiegs- zum titelkandidaten geformt.\r\n \r\n imago/crystal pix\n als der triumph perfekt war und der komplette lotto park in anderlecht seine helden feierte, stand xabi alonso unweit der mittelinie mit verschrankten armen und beobachtete mit zufriedenheit wie sich seine profis fur den :-erfolg bei union saint-gilloise genauso von ihren fans feiern liessen wie die aufopferungsvoll kampfenden und fein spielenden gastgeber, die sich selbst nach einem :-ruckstand nicht aufgegeben hatten.\n in dem stadion, in dem union berlin im achtelfinale noch mit : vom belgischen tabellenzweiten abgefertigt worden war, dokumentierte die werkself mit ihrem uber weite strecken reifen auftritt ihren nachsten schritt bei der metamorphose vom abstiegskandidaten zu einem titelaspiranten. seitdem xabi alonso bayer anfang oktober auf dem . tabellenplatz ubernommen hat, hat der spanier die mannschaft in einem schmerzhaften und nicht an ruckschlagen armen umerziehungsprozess von einem wilden haufen hochbegabter, aber genauso taktisch undisziplinierter kunstler zu einem kollektiv geformt, das immer mehr die konturen einer echten spitzenmannschaft annimmt.\n ""es sind nur sechs, sieben monate, aber es ist viel passiert. am anfang war es nicht einfach, aber es ist immer eine entwicklung. wir sind zufrieden, dass wir diese stimmung verandern konnten und jetzt in dieser position sind in der bundesliga und in europa"", resumierte leverkusens trainer spater in den katakomben der altehrwurdigen arena.\n wobei er den grossten fortschritt der kicker des tabellensechsten zwischen den ohren bewirkt hat. ""wir haben geholfen, aber am meisten liegt es an den spielern. der kopf muss stimmen. ich habe immer gesagt, wir haben die qualitat, aber der kopf ist wichtiger. im moment haben wir ein gutes zusammenspiel zwischen qualitat und der mentalitat. dadurch haben wir es bis hierher geschafft"", erklarte der spanier, um direkt deutlich zu machen, dass anderlecht nur eine zwischenstation gewesen sein soll, mit den worten ""und wir wollen mehr!"".\n nicht nur fur einen titelsammler wie xabi alonso kann dies einzig bedeuten, die europa league zu gewinnen. ""jetzt haben wir noch eine reise. wir werden sehen, wohin sie geht"", philosophierte der -jahrige und meinte damit sicher nicht nur den nachsten gegner, der zu diesem zeitpunkt noch in rom in der verlangerung zwischen der as und feyenoord rotterdam\xa(: fur rom n.v.) ermittelt wurde. der insgesamt erwachsene auftritt in belgien, bei dem bayer einzig in der viertelstunde nach dem : der gastgeber ins wanken geriet, deklariert den bundesligisten als titelanwarter.\n der wandel der werkself unter xabi alonso ist mittlerweile unverkennbar. und der reifegrad dieser mannschaft wurde in den minuten in anderlecht gerade darin offenkundig, dass es eine leistung der leverkusener war, die uber jahre als vollig untypisch eingeordnet worden ware. so prasentierte sich das team in der defensive mit einem uberragenden abwehrchef jonathan tah uber eine stunde lang so stabil, dass die keineswegs enttauschenden belgier bis dahin zu keiner ernsthaften chance kamen. erst als xabi alonso den starken edmond tapsoba aufgrund muskularer probleme in der dreierkette durch odilon kossounou ersetzen musste, geriet der bundesligist zwischenzeitlich in bedrangnis.\n umgekehrt zeigte sich bayer, uber jahre der inbegriff fur chancenwucher, bis auf die endphase in der offensive brutal effizient. wobei man bei aller euphorie im leverkusener lager anmerken muss, dass saint-gilles mit groben aussetzern beim ersten und dritten treffer der werkself extrem in die karten spielte.\n nicht umsonst stellte kapitan lukas hradecky auf das ganze team und speziell auf bakker, der vor wenigen wochen noch aus dem spieltagsaufgebot gegen hertha bsc gestrichen worden war, weil er das abschusstraining verpennt hatte, fest: ""alle kleinen dinge kommen zusammen. er hat richtig reagiert auf seine suspendierung. heute hatte er drei oder vier lungen. wie viel er lauft und was er momentan fur die mannschaft tut, ist grossartig. heute war das nicht europa-league-niveau, sondern champions-league-niveau von ihm.""\n komplettiert wurde die these, dass bayer eine spitzenmannschaft wird, von der bedeutung von florian wirtz in dieser partie. lautete die gleichung bislang: nur wenn wirtz stark ist, ist auch bayer stark, so wurde auch dieses scheinbare naturgesetz am donnerstag ausser kraft gesetzt. so war leverkusens genie mal eben nicht die spielentscheidende figur, erlaubte sich bei aller spielerischer klasse auf engstem raum und wichtigen passen, um dem belgischen pressing zu entgehen, auch ungewohnte ballverluste, wie den vor dem :. dass der werksklub trotzdem so uberzeugend auftrat, ist das letzte, aber vielleicht auch klarste indiz dafur, dass xabi alonsos arbeit zu etwas grossem fuhren kann.\n der trainer jedenfalls mochte in dem bisher geleisteten trotz eines positiven zwischenfazits nur einen anfang sehen. ""ich habe vom ersten tag an gesagt, wenn wir fragil sind, wenn wir nicht wie eine mannschaft zusammen verteidigen, dann ist das nicht moglich. jetzt verteidigen wir gut, spielen kompakt und haben immer die qualitat, chancen zu erspielen. jetzt haben wir diese entwicklung"", konstatierte xabi alonso, ""aber es ist zu fruh, eine saisonanalyse zu machen. wir haben noch funf, sechs wochen, danach kann man noch besser analysieren."" und noch viel mehr erreicht haben.\n ",jeremie frimpong,de,2023-04-21T08:50:46Z
"), jeremie frimpong (",jeremie frimpong,de,2023-04-21T09:05:10Z
"diaby, florian wirtz, adam hlozek und jeremie frimpong teilten sich die raume nach bedarf und belieben",jeremie frimpong,de,2023-04-21T10:02:05Z
"torschutzen unter sich: mitchel bakker feiert mit moussa diaby\n auf der linken defensiv-seite sucht bayer leverkusen seit jahren nach einer top-verstarkung. im sommer sollte robin gosens von inter mailand kommen. zuletzt im winter borna sosa vom vfb stuttgart.\n \n volley ins tor: mitchel bakker trifft zum wichtigen : fur leverkusen\n hier hat offenbar jemand seine lektion verstanden: aus dem problem-spieler wurde ein held im europa-cup. so schnell kann's im fussball gehen!\n ruckblick: bakker war furs heimspiel gegen hertha bsc (:) aus dem kader geflogen, weil er zu spat zum abschluss-training erschienen war. alonso begnadigte bakker gegen budapest (:), liess ihn da aber auf der bank. drei tage spater beim : in bremen stand bakker in der startelf und erzielte das wichtige :.\n ,,er hat richtig darauf reagiert, dass er damals nicht im kader war. der mann hat heute drei oder vier lungen gehabt, so wie er gerannt ist. was der momentan fur die mannschaft tut, ist grossartig. das war nicht europa-league-niveau, das war champions league"", verteilte kapitan lukas hradecky () ein sonderlob an den kapitan der hollandischen u-auswahl.\n ohne frage: bakker bringt eine enorme physis und auch eine gute technik mit. dazu unbandigen willen. ab und an ist auch ein stuck wahnsinn in seinem spiel dabei. aber - wenn er sich konzentriert, hat er im verein keine konkurrenz.\n \n bayer leverkusen trifft im halbfinale der europa league auf die as rom - keiner freut sich so daruber wie rudi voller.\n ",jeremie frimpong,de,2023-04-21T13:21:07Z
szoboszlai brachte bei einem solchen leverkusener angriff jeremie frimpong zu fall und musste vom feld,jeremie frimpong,de,2023-04-23T17:26:22Z
"bayer-trainer xabi alonso versank in einer jubeltraube vor der leverkusener bank.\n die werkself, beim amtsantritt des spaniers im oktober noch vorletzter, besiegte rb leipzig am sonntag etwas glucklich mit : (:) und ruckte nach dem . pflichtspiel ohne niederlage als sechster bis auf vier zahler an die sachsen heran. drei tage nach dem halbfinal-einzug in der europa league nahm bayer in der fussball-bundesliga tuchfuhlung zu den champions-league-platzen auf.\n ""es lauft uberragend gerade bei uns, ich bin sehr, sehr stolz auf die mannschaft"", sagte bayers starker innenverteidiger jonathan tah im streamingdienst dazn und lobte die kollegen: ""wie lowen als mannschaft verteidigt."" tah kundigte fur den saison-endspurt an: ""wir machen weiter, wir sind nicht zufrieden."" rb-trainer marco rose argerte sich dagegen: ""das war das x-te spiel diese saison, was wir einfach nicht verlieren durfen.""\n der bisherige tabellen-vierte leipzig rutschte durch die schon achte saison-niederlage aus den champions-league-rangen und belegt nun direkt vor bayer platz funf. adam hlozek (. minute) und nadiem amiri per foulelfmeter (.) erzielten leverkusens tore. die sachsen belohnten sich fur ihre klare uberlegenheit in der zweiten halbzeit nicht und verloren dominik szoboszlai vor dem elfmeter durch eine gelb-rote karte.\n leipzig zielstrebig, aber ""nicht konsequent genug""\n ""in den entscheidenden momenten waren wir nicht konsequent genug, sowohl offensiv als auch defensiv"", sagte rb-profi benjamin henrichs und sprach von einem ruckschlag. ""das ist so ein muster, was uns punkte kostet. wir sind nicht effektiv genug.""\n bei bayer standen gleich drei der wichtigsten leistungstrager der vergangenen wochen gar nicht im kader. nationalspieler florian wirtz fehlte nach vereinsangaben wegen magen-darm-problemen und sass mit blau-weisser basecap auf der tribune. abwehrspieler edmond tapsoba wurde wegen muskularer probleme als vorsichtsmassnahme geschont, der argentinische weltmeister exquiel palacios wurde nicht rechtzeitig fit.\n die leipziger, denen nationalspieler david raum wegen einer gelbsperre fehlte, waren zunachst die frischere und aktivere mannschaft. timo werner hatte in der sechsten minute aus spitzem winkel schon die fuhrung auf dem fuss, schoss bayer-keeper lukas hradecky aber gegen den brustkorb.\n die leverkusener, die in den vergangenen wochen ihr offensivspiel mehr aus einer kompakten defensive aufzogen, standen diesmal noch tiefer. doch dann bekamen sie plotzlich die konterchance schlechthin, als mitchel bakker, kerem demirbay und moussa diaby nach einem leipziger eckball zu dritt gegen einen aufs tor zuliefen und den ball vertandelten (.). piero hincapies fernschuss aus metern unterschatzte torwart janis blaswich, sodass der ball gegen die latte klatschte (.).\n leverkusen lauert und entscheidet spat\n leipzig hatte im ersten durchgang uber prozent ballbesitz und nominell deutlich mehr torschusse. doch die besseren chancen hatte leverkusen und die vierte nutzten die rheinlander dann, als hlozek eine scharfe hereingabe von diaby aus zehn metern zu seinem funften saisontor einschob.\n leipzigs trainer marco rose brachte zur pause christopher nkunku. deutschlands fussballer des jahres hatte nach einem aussenbandriss in der vorwoche ein -minutiges comeback gegeben. leipzigs spiel wurde zwar nur etwas zielstrebiger, doch nun gab es wenigstens chancen. vor allem eben durch nkunku, dem tah nach einer parade von hradecky den ball in letzter sekunde vor den fussen wegschlug (.). kurz darauf parierte hradecky den kopfball von willi orban nach einem eckball (.). frimpong verpasste bei einem leverkusener konter noch die entscheidung (.), fur die dann amiri vom elfmeterpunkt sorgte. nach dem abpfiff schlug amiri uberschwanglich mit der hand auf den rasen.\n \n \n ",jeremie frimpong,de,2023-04-23T17:26:57Z
\n \n leverkusens torschutze nadiem amiri (rechts) und jeremie frimpong jubeln nach dem treffer zum :,jeremie frimpong,de,2023-04-23T17:33:57Z
jeremie frimpong bekommt gluckwunsche seines trainers xabi alonso - in leverkusen haben sie derzeit gute laune,jeremie frimpong,de,2023-04-23T18:00:31Z
"du kannst netzwelt werbefrei nutzen. details zum abo findest du hier.\n du kannst netzwelt werbefrei nutzen. details zum abo findest du hier.\n spielt ihr fifa fut, wollt ihr bestimmt eure stimme fur das bundesliga-team of the season abgeben. diese spieler sind nominiert und es gibt etwas zu gewinnen.\n die bundesliga neigt sich dem ende zu und auch in fifa ultimate team laufen die letzten grossen events. ea hat nun die wahlen zu den teams of the season gestartet und ab sofort konnt ihr fur die besten bundesliga-spieler abstimmen.\n die wahl lauft nur noch bis zum . april , ihr habt also nicht mehr viel zeit. hier konnt ihr abstimmen und folgende spieler sind nominiert:\n ihr konnt uber die abstimmung aber auch eines von unterschriebenen bundesliga-trikots oder eines von fanpaketen gewinnen, schreibt die webseite der bundesliga.\n ea sports fc erscheint anstelle eines fifa , wie ea bestatigt hat. lest hier alle wichtigen news zum release, gameplay, zu modi und lizenzen.\n alle weiteren aktionen zu ultimate team seht ihr in unserem event-kalender zu fifa .\n jeden freitag: die informativste und kurzweiligste zusammenfassung aus der welt der technik!\n seit ist netzwelt.de ein fuhrendes online-magazin im deutschsprachigen raum. wir berichten taglich uber neuigkeiten rund um consumer electronics und streaming. unser unabhangiges angebot mit fokus auf kaufberatung, testberichte und vergleiche ist erste anlaufstelle fur interessierte leser und ein haufig zitiertes experten-team. dabei haben wir bewusst kein ingenieur-labor - wir testen produkte im alltag und konnen daher genau sagen, ob es ein lohnender deal ist oder nicht. als besonderen service bieten wir ein kuratiertes download-archiv, zeigen alle storungen und welche dsl speed nutzer haben.'}\n ",jeremie frimpong,de,2023-04-26T14:06:21Z
auch jeremie frimpong oder amine adli gehoren zu den schnellsten spielern in der bundesliga,jeremie frimpong,de,2023-04-27T12:25:55Z
", :\xauhr\n die ecke hatte jeremie frimpong hereingeschlagen, den kopfball brachte mitchel bakker aufs tor",jeremie frimpong,de,2023-04-29T15:32:17Z
ein einziges mal nur musste sich unions torwart frederik ronnow auszeichnen: bei einem wuchtigen kopfstoss von leverkusens verteidiger bakker auf flanke von jeremie frimpong (,jeremie frimpong,de,2023-04-29T18:35:16Z
") umarmt team-kollege jeremie frimpong\n bayers klub-macher und auch trainer alonso schatzen an amiri vor allem seine einstellung, seinen willen und seine vielseitigkeit",jeremie frimpong,de,2023-05-01T16:20:02Z
jeremie frimpong scheiterte aus wenigen metern am rechten innenpfosten (,jeremie frimpong,de,2023-05-27T15:42:10Z
"selbst als stammkraft jeremie frimpong in den vergangenen wochen physisch rapide abbaute, bekam fosu-mensah keine chance",jeremie frimpong,de,2023-05-23T10:24:42Z
"maximilian arnold liess per strafstoss das : folgen, jeremie frimpong sorgte an diesem",jeremie frimpong,de,2023-05-22T12:15:46Z
ordentliche partie: luca netz klart vor jeremie frimpong\n weil ramy bensebaini () beim : in dortmund seine,jeremie frimpong,de,2023-05-22T05:56:47Z
"auch beim zweiten treffer machte der -jahrige zumindest eine ungluckliche figur, als demirbay nach flanke von jeremie frimpong aus kurzester distanz einkopfte",jeremie frimpong,de,2023-05-21T19:53:27Z
"auch beim zweiten treffer machte der -jahrige zumindest eine ungluckliche figur, als demirbay nach flanke von jeremie frimpong aus kurzester distanz einkopfte",jeremie frimpong,de,2023-05-21T19:46:28Z
"auch beim zweiten treffer machte der -jahrige zumindest eine ungluckliche figur, als demirbay nach flanke von jeremie frimpong aus kurzester distanz einkopfte",jeremie frimpong,de,2023-05-21T19:28:06Z
"er habe ""aber keinen gelesen oder gehort, der mal gesagt hat, dass jeremie frimpong keine einzige offensivaktion in dem spiel hatte""",jeremie frimpong,de,2023-05-21T06:04:37Z
dann werden so herausragende hochstgeschwindigkeitsfussballer wie moussa diaby und jeremie frimpong vom gegner zu leicht ausgebremst,jeremie frimpong,de,2023-05-19T10:35:21Z
"zumal da den schlusselspielern florian wirtz, diaby und jeremie frimpong die geistige frische fehlte, um uberraschendes zu\xazaubern",jeremie frimpong,de,2023-05-19T09:15:11Z
"die transferplanungen laufen beim fc bayern auf hochtouren. langsam zeichnet sich ab, auf welchen positionen sich der klub verstarken mochte. und vor allem: mit wem.\n bereits zuvor machten meldungen die runde, wonach tuchel vor allem einen sechser aus der premier league verpflichten mochte. jedoch liegt der marktwert des englischen nationalspielers bei stolzen millionen euro und bei den hammers steht rice noch bis unter vertrag (inklusive option auf ein weiteres jahr). gut moglich also, dass der -jahrige den munchnern zu teuer sein wird. dem bericht zufolge soll den bayern-verantwortlichen bewusst sein, dass es sehr schwer scheint, einen premier-league-stammspieler zu verpflichten.\n dem vernehmen nach ist ajax-star edson alvarez ebenfalls auf der liste des deutschen rekordmeisters und eine mogliche alternative zu declan rice. der mexikaner ist offenbar allerdings auch im bvb-visier. mateo kovacic soll mit einem chelsea-abgang liebaugeln, bei den bayern scheint er nicht zuletzt aufgrund seiner offensiven spielweise eher kein thema zu sein.\n und damit kommen wir zur zweiten position, auf der die bayern verstarkung suchen. im sturmzentrum soll tuchel von victor osimhen begeistert sein, aufgrund der kolportierten ablosesumme von millionen euro hat der fcb-coach laut dem bericht aber verstandnis dafur, dass man bei dem nigerianer nicht ernst machen wird.\n von alex frieling\n nyck de vries steht bei alphatauri nach nur wenigen rennen vor dem aus. dem -jahrigen, der seine erste formel--saison bestreitet, soll ein ultimatum gestellt worden sein. als ersatz steht wohl daniel ricciardo bereit, der in dieser saison ersatzfahrer bei red bull ist.\n alexander zverev ist nach seinem achtelfinal-aus in rom machtig angefressen - und sieht sich vor den french open meilenweit von der weltspitze entfernt.\n das original zu diesem beitrag ""diese topspieler hat der fc bayern im visier"" stammt von fcbinside.de.\n ",jeremie frimpong,de,2023-05-19T07:57:11Z
"malen setzte sich im voting gegen moussa diaby und jeremie frimpong von bayer leverkusen, benjamin pavard vom fc bayern munchen, timo werner von rb leipzig sowie josha vagnoman vom vfb stuttgart durch",jeremie frimpong,de,2023-05-18T15:14:06Z
"und wir mussen ein aussergewohnliches spiel abliefern, um ins endspiel zu kommen""\n der portugiese weiss, dass die werkself seine mannschaft mit den schnellen offensivstars wie florian wirtz (), jeremie frimpong () und moussa diaby () uberrennen kann",jeremie frimpong,de,2023-05-18T10:01:41Z
"willkommen, kollege: das wiedersehen von xabi alsono (links) und jose mourinho, die sich aus gemeinsamen zeiten bei real madrid gut kennen, fiel in rom auffallend herzlich aus.\n trainer xabi alonso will mit leverkusen die europa league gewinnen. fur das halbfinal-ruckspiel hat er als grosser wettkampfer eine andere herangehensweise gewahlt als der zyniker jose mourinho bei as rom.\n kommentar von philipp selldorf\n quizfrage: als bayer leverkusen das letzte und zugegebenermassen einzige mal einen europacup gewann, schickte trainer erich ribbeck in der zweiten halbzeit des finales gegen espanyol barcelona einen angreifer aufs feld, der seine schaferhunde nach zwei typischen action-kino-helden jenes jahrzehnts benannt hatte, der selbst den spitznamen ""boxer"" trug, von den bundesliga-kollegen zum ""klopper des jahres"" gewahlt wurde und dem besagten trainer ribbeck zuvor mitgeteilt hatte, er wolle trotz einer muskelverletzung unbedingt am spiel teilnehmen, notfalls mit gebrochenem bein. dass er dies ernst meinte, brauchte der coach nicht zu\xabezweifeln.'}\n ",jeremie frimpong,de,2023-05-16T16:39:24Z
"wie in jedem jahr hat ea sports im kontext seines aktuellen fussball-titels fifa das team of the year in der bundesliga kuren lassen. wir verraten euch hier, wer den sprung geschafft hat!\n jahr fur jahr lasst ea sports die spieler der fifa-reihe daruber abstimmen, welche fussballer es in des team of the season schaffen sollen. auch in ultimate team von fifa war es nun wieder soweit - und fans sowie experten haben ihre stimmen nun abgegeben. aus einem pool von vorausgewahlten bundesliga-spielern haben es folgende in das team des jahres geschafft:\n angreifer\n mittelfeld\n abwehr\n torhuter\n parallel zum team of the season wurden auch die tots moments gekurt, wobei spieler zur wahl standen, die in besonderen momenten geglanzt haben. dementsprechend erhalten zusatzliche auch sadio mane und leon goretzka vom fc bayern munchen sowie maxence lacroix vom vfl wolfsburg ein entsprechendes fut-item.\n unsere fussball-experten sascha und pirmin haben ein paar matches im neuen fifa gespielt. was halten sie vom letzten fifa aus dem hause ea sports?\n fifa wird der letzte teil der langjahrigen fussball-reihe von ea sports, der unter der fifa-marke erscheint. ab dem jahr startet ea dann mit der eigenen marke ea sports fc durch - und bekommt wohl hauseigene fifa-konkurrenz.\n copyright by entertainment media group ag.\n alle rechte vorbehalten.\n dein magazin rund um games...'}\n ",jeremie frimpong,de,2023-05-15T15:36:00Z
das team wird zudem von den beiden leverkusen-profis jeremie frimpong und moussa diaby sowie von niclas fullkrug und randal kolo muani erganzt,jeremie frimpong,de,2023-05-13T10:26:28Z
\n schneller als jungst gegen koln und nun in rom muss es in den nachsten zwei wochen dagegen in bayers offensive zugehen: hochgeschwindigkeitsfussballer wie moussa diaby oder jeremie frimpong wirkten zuletzt uberspielt,jeremie frimpong,de,2023-05-13T10:16:48Z
die rechte seite mit moussa diaby und jeremie frimpong hat dabei schon treffer verbuchen konnen,jeremie frimpong,de,2023-05-13T05:11:59Z
