data,player,language,publishedAt
"bremen kassierte die meisten gegentore hinter bochum\n drei gegentore gegen leverkusen, zwei in augsburg: vor allem aber hat der sv werder bremen zuletzt die konsequenz im eigenen strafraum vermissen lassen. wie andert man das wieder?\n milos veljkovic nimmt vor dem duell mit borussia monchengladbach alle bremer mannschaftsteile in die pflicht.\r\n \r\n imago/nordphoto\n fur diese frage ist milos veljkovic sicherlich ein aussagekraftiger adressat. bei der :-niederlage am vergangenen sonntag gegen bayer leverkusen war der -malige serbische nationalverteidiger, der auch fur die bevorstehende landerspiele in der nachsten woche eingeladen wurde, zentraler bestandteil der bremer abwehr-dreierkette. ""weniger fehler machen"", sagt der -jahrige, mit pragmatischem lacheln.\n es ist ein vorschlag, den er jedoch nicht nur fur die werder-defensivabteilung gelten lassen will: ""man sieht meistens nur den letzten fehler, aber es gibt auch den ersten und den zweiten."" veljkovic findet, dass ""die ganze mannschaft"" wieder mehr gefordert sei, schleunigst etwas an ihrer anfalligkeit fur gegentore zu andern: ""jeder ist verantwortlich"", unabhangig von der jeweiligen position.\n in der bundesliga hat aktuell nur der vfl bochum () in den bisherigen spielen mehr treffer kassiert als werder (). allerdings fallen dabei vor allem die beiden noch der hinrunde zuzuschreibenden klatschen gegen den fc bayern (:) und den . fc koln (:) ins gewicht. in den vergangenen beiden spielen gegen leverkusen und auch in augsburg (:) stimmte der bremer spielvortrag zwar, doch in den entscheidenden situationen ""haben wir diese nicht zu ende gebracht"", so veljkovic. stattdessen: ""sind wir in viele konter gelaufen.""\n gefragt sein durften dann wohl auch wieder die prazisen lange balle des serben, die den bremern auch gegen leverkusen einige spieleroffnende (offensiv-)szenen ermoglichten. ""der trainer gibt mir die freiheit, die balle zu spielen, die ich sehe"", sagt veljkovic. und wenn zugleich jeder werder-profi ""noch mal einen schritt mehr macht und ein paar prozent mehr gibt, konnen wir die spiele auch fur uns entscheiden."" was nach den beiden jungsten niederlagen, die eigentlich nicht hatten sein mussen, nun wieder umso wichtiger ware.\n tim luddecke\n ",mitchel bakker,de,2023-03-15T14:09:00Z
"wurde immer ofter und harter gepruft - aber juve-torwart wojciech szczesny wuchs in freiburg mit jeder gemeisterten aufgabe .\n wahrend union berlin in belgien mude wirkt und der sc freiburg gegen die ausgebufften routiniers von juventus turin zu viele chancen liegen lasst, zieht bayer leverkusen als einziger deutscher klub souveran ins viertelfinale der europa league ein.\n nachdem das aus des sc freiburg in der europa league besiegelt war, standen die fans der breisgauer geschlossen auf und feierten den unterlegenen fussball-bundesligisten. minutenlang verliessen die spieler nicht den rasen, und ebenso lange sangen die anhanger und druckten so ihren stolz aus, obwohl die reise durch europa im achtelfinale am donnerstagabend ein ende fand. ein umstrittenes handspiel hatte freiburg beim : (:) gegen juventus turin zuvor durchgeschuttelt. der italienische rekordmeister profitierte kurz vor der halbzeit von einem viel diskutierten handelfmeter. diesen verwandelte dusan vlahovic (. minute), nachdem freiburgs manuel gulde den ball an den unterarm bekommen hatte. zu allem uberfluss sah gulde die gelb-rote karte und musste vom\xafeld.\n in der zweiten halbzeit zeigte sich der bundesligist verbessert, leistete sich aber den luxus, viele chancen zu vergeben und an torwart wojciech szczesny zu scheitern. fast folgerichtig traf federico chiesa (.+) spat zum finalen :. ""wir haben im entscheidenden moment pech gehabt. leider hat es nicht gereicht und wir scheiden aus, aber so wie wir es gemacht haben, war es in ordnung"", sagte freiburgs michael gregoritsch bei rtl stolz: ""das ist ein absolutes top-spiel gewesen von uns. was gefehlt hat, ist das\xator.""\n die freiburger, die lange in unterzahl spielten und trotzdem alles versuchten, hatten sich nach dem : im hinspiel fur das bedeutendste spiel ihrer vereinsgeschichte eine menge vorgenommen. mehr als die doppelte anzahl an karten hatten die freiburger verkaufen konnen, doch auch so sorgte die mehrheit der \xa zuschauer im europa-park stadion fur ein stimmungsvolles fussballfest. und die freiburger spieler trugen ihren teil dazu bei, dass es in der arena nach dem anpfiff noch lauter wurde. sie waren von der ersten minute an aggressiv und prasentierten sich anders als im hinspiel deutlich mutiger. auch der erste abschluss gehorte den hausherren. aus der distanz brachte ritsu doan aber keinen druck hinter den ball\xa(.).\n sc-trainer christian streich uberraschte mit seiner startelf, weil er den italienischen nationalspieler vincenzo grifo zunachst auf die bank setzte. ""es steckt nichts dahinter. ich habe mich ganz, ganz schweren herzens dazu entschlossen. es tut mir wahnsinnig leid fur vincenzo, aber ich musste so entscheiden"", sagte der coach bei rtl+. in den anfangsminuten durfte er sich bestatigt fuhlen. nur dank wojciech szczesny, der einen kopfball von matthias ginter glanzend parierte, wahrten die turiner ihren vorsprung\xa(.).\n gaste-trainer massimiliano allegri hatte bei der pressekonferenz angekundigt, sich nicht auf dem polster ausruhen zu wollen. ""wir wollen hier ein tor erzielen, denn nur zu versuchen, ein torloses unentschieden zu verteidigen, ist wirklich keine gute idee"", hatte er gesagt. seine mannschaft investierte jedoch uber weite strecken kaum etwas in die offensive - bis zur . minute. nach einem freistoss des fruheren frankfurters filip kostic schoss vlahovic den ball uber die linie. der videoschiedsrichter schaltete sich aber wegen einer abseitsposition ein, der treffer fand keine\xaanerkennung.\n es war der auftakt einer besseren phase der turiner, die sich kurz vor der pause belohnten. gulde, der fur den weiterhin verletzten philipp lienhart ran durfte, sprang der ball unglucklich an den unterarm. fur das vergehen sah er seine zweite gelbe karte. beim schwach geschossenen strafstoss war flekken dran, doch vlahovic hatte gluck. nach dem platzverweis starkte streich die\xadefensive.\n gefahr strahlten seine spieler aber auch weiterhin aus. nach einer undurchsichtigen situation entschied schiedsrichter serdar gozubuyuk erneut gegen den sc und zog damit den unmut der heim-fans auf sich. die routinierten turiner liessen sich von der hitzigen stimmung nicht verunsichern und taten nach dem seitenwechsel nicht mehr als notig, den rest erledigte ihr\xatorwart.\n noch was fur die b-note getan: lazare amani hat seinen teil dazu beigetragen, dass die belgische union (von saint-gilloise) besser abschnitt als die deutsche union aus berlin.\n das europa-league-marchen ist zu ende: union berlin hat den nachsten historischen triumph verpasst und ist im achtelfinale gescheitert. die mannschaft von trainer urs fischer unterlag im ruckspiel bei union saint-gilloise verdient mit : (:) und versaumte somit den erstmaligen einzug in ein europaisches viertelfinale. teddy teuma (.), lazare amani (.) und loic lapoussin (.+) trafen fur die belgier und zerstorten nach dem : im hinspiel alle berliner hoffnungen auf den einzug in die runde der besten acht. janik haberer sah in der schlussphase noch die gelb-rote karte\xa(.).\n mit blick auf das wilde hinspiel gegen saint-gilloise im stadion an der alten forsterei, in dem die kopenicker dreimal nach einem ruckstand zuruckgekommen waren, hatte fischer betont, dass union ""den ein oder anderen fehler"" vermeiden musse: ""wir wollen in die nachste runde einziehen und mussen dafur ans limit gehen."" union begann mutig, der erste abschluss von sven michel war jedoch kein problem fur keeper anthony moris (.). die gastgeber hingegen lauerten auf konter und sorgten damit auf berliner seite gleich zu beginn fur eine schrecksekunde: diogo leite verlor den ball bei einer klarungsaktion, den anschliessenden abschluss von simon adingra blockte robin knoche auf der linie, den zweiten versuch setzte victor boniface an den pfosten\xa(.).\n wenig spater hatte union bei einem weiteren patzer weniger gluck. kurz vor dem eigenen tor brachte knoche den portugiesen leite mit einem schlechten pass in bedrangnis, adingra war einen schritt schneller, teuma schob zur fuhrung ein. die belgier, die bereits gruppengegner der kopenicker gewesen waren, ubten weiter druck aus. von den berlinern, die von rund mitgereisten fans unterstutzt wurden, war offensiv wenig zu sehen. auch nach der pause tat sich union schwer, fischer reagierte und wechselte doppelt. haberer und jordan siebatcheu kamen fur aissa laidouni und michel (.). doch es folgte der nachste dampfer. boniface fand nach ein paar ubersteigern im unioner strafraum amani, der fur die gastgeber erhohte. die kopenicker hingegen hatten weiterhin ihre probleme und blieben bei ihren vorstossversuchen meist in den gegnerischen reihen\xahangen.\n fruh ubt sich: schon in der dritten minute markiert leverkusens flugelflitzer moussa diaby (rechts) das fuhrungstor in budapest.\n ende mai will leverkusen nach budapest zuruckkehren, dort findet im stadion von ferencvaros das finale statt. zunachst aber steht das viertelfinale an, und bei der auslosung am freitag ( uhr) in der zentrale der europaischen fussball-union kann sich bayer auf einen attraktiven gegner freuen. unter anderem manchester united, europa-league-rekordsieger fc sevilla und juventus turin haben es ebenfalls in die nachste runde\xageschafft.\n zum start der zweiten halbzeit forderte alonso von seinem team nochmals volle konzentration - und wieder war der bundesligist von beginn an hellwach. bakker (.) vergab die grosse moglichkeit aufs :, sein schuss wurde im letzten moment geblockt. ein treffer von jeremie frimpong (.) zahlte wegen abseits nicht, sardar azmoun (.) und diaby (.) mit einem schuss an den pfosten liessen weitere chancen liegen. obwohl es bereits am sonntag (. uhr/dazn) in der bundesliga gegen rekordmeister bayern munchen geht, wollte leverkusen unbedingt den zweiten treffer nachlegen. adli belohnte die bemuhungen in der\xaschlussphase.\n kostenlos anmelden.\n ",mitchel bakker,de,2023-03-16T20:14:34Z
"\n kurz darauf hatte mitchel bakker fur gefahr sorgen konnen, die hereingabe des aussenverteidigers aber war viel zu harmlos",mitchel bakker,de,2023-03-16T21:49:55Z
"diesmal war es die vierte minute der zweiten halbzeit, als tapsoba einen langen ball auf diaby spielte, der gab diesmal auf mitchel bakker ablegte - doch der niederlander wurde im letzten moment gebremst",mitchel bakker,de,2023-03-16T22:02:42Z
"\n kurz darauf hatte mitchel bakker fur gefahr sorgen konnen, die hereingabe des aussenverteidigers aber war viel zu harmlos",mitchel bakker,de,2023-03-16T22:08:33Z
"diesmal war es die vierte minute der zweiten halbzeit, als tapsoba einen langen ball auf diaby spielte, der gab diesmal auf mitchel bakker ablegte - doch der niederlander wurde im letzten moment gebremst",mitchel bakker,de,2023-03-16T22:14:32Z
"\n jeremie frimpong: der niederlander wahnte sich kurz nach der pause als torschutze, passgeber mitchel bakker stand davor aber deutlich im abseits",mitchel bakker,de,2023-03-17T07:01:04Z
"da jeremie frimpong zu einem der starksten flugelspieler der liga avanciert, da sardar azmoun genau wie mitchel bakker in fahrt kommt und auch torhuter lukas hradecky immer weniger fehler macht",mitchel bakker,de,2023-03-19T13:48:37Z
"es kann gut sein, dass die fehlentscheidung von sascha stegemann borussia dortmund die meisterschaft kostet. solche entscheidenden momente gab es in der bundesliga-historie mehrfach - die sportschau blickt zuruck.\n sportschau\n ein sieg gegen st. pauli, ein patzer der konkurrenz: darmstadt steht kurz davor, sich den grossen traum vom bundesliga-aufstieg zu erfullen. damit konnte sich am wochenende fussball-geschichte wiederholen.\n sportschau\n sportschau\n beim torrekord von erling haaland hat manchester city in der premier league die tabellenfuhrung vom fc arsenal ubernommen. auch der fc liverpool feierte.\n sportschau\n eine umstrittene spielverlegung, viele gaste-fans und der kampf um wichtige punkte: leverkusen gegen koln bietet alles, was ein derby braucht.\n sportschau\n eintracht frankfurt zieht nach einem sieg beim vfb stuttgart ins finale des dfb-pokals ein. um einen videobeweis in der nachspielzeit gab es noch viele diskussionen.\n sportschau\n die new york knicks spielen erstmals seit zehn jahren wieder in den nba-playoffs um den halbfinaleinzug. eine wichtige rolle kommt auf isaiah hartenstein zu - einem , meter-wandersmann aus niedersachsen.\n sportschau\n die boston celtics haben in den nba-playoffs gegen die philadelphia ers zum : ausgeglichen.\n sportschau\n die edmonton oilers haben in der nhl den auftakt in die zweite playoff-runde gegen die vegas golden knights verloren. \n sportschau\n im vorjahr ging lennard kamna beim giro d'italia erfolgreich auf etappenjagd. ab samstag kampft er in neuer rolle um eine gute platzierung in der gesamtwertung. die favoriten auf einem schweren kurs sind aber andere.\n sportschau\n das konnte die vorentscheidung im titelkampf der handball-bundesliga sein: spitzenreiter thw kiel hat am . spieltag bei den rhein-neckar lowen gewonnen, konkurrent fuchse berlin patzte.\n sportschau\n analyse\n analyse\n es wird gepobelt, beleidigt und immer ofter auch zugeschlagen: gewalttaten gegen schiedsrichter im deutschen amateurfussball sind auf einem rekordniveau. immer weniger haben daher lust auf den job.\n mehr\n fortuna dusseldorf will bei drei heimspielen allen zuschauern freien eintritt gewahren. das soll durch sponsoren gewahrleistet werden. weitere details zum pilotprojekt in der kommenden saison sind noch nicht bekannt.\n mehr\n mehr\n der fc bayern munchen hat die trennung von trainer julian nagelsmann offiziell bestatigt. sein nachfolger wird thomas tuchel, der einen vertrag bis sommer erhalt. am montag soll er erstmals das training leiten.\n mehr\n der fc barcelona steht unter korruptionsverdacht. zwischen den jahren und soll der club rund , millionen euro fur angebliche beraterdienste an den damaligen vize des schiedsrichterausschusses gezahlt haben. von r. spiegelhauer.\n mehr\n die deutschen hockey-herren sind zum dritten mal weltmeister. das team von bundestrainer andre henning setzte sich im finale im indischen bhubaneswar gegen titelverteidiger belgien mit : im penaltyschiessen durch.\n mehr\n aus der traum fur eine wm-medaille: deutschlands handballer sind im viertelfinale gegen frankreich ausgeschieden. jetzt spielt die mannschaft um die range funf bis acht.\n mehr\n argentinien hat den titel bei der fifa wm in katar geholt. das team um superstar messi siegte in einem hart umkampften endspiel im elfmeterschiessen mit : gegen titelverteidiger frankreich. fur messi wurde damit ein traum wahr.\n mehr\n nach einem krisentreffen des deutschen fussball-bundes ist klar: bundestrainer flick soll die nationalmannschaft zur em fuhren, die in deutschland stattfinden wird.\n mehr\n eintracht frankfurt hat jahre nach dem gewinn des uefa-pokals den zweiten internationalen titel der vereinsgeschichte geholt. die hessen triumphierten im finale der europa league mit : im\xaelfmeterschiessen gegen die glasgow rangers.\n mehr'}\n ",mitchel bakker,de,2023-03-19T20:35:24Z
"\n wirtz ist jedoch nicht der einzige spieler im bayer-kader, dem eine sperre auf der internationalen buhne droht: auch mitchel bakker (), odilon kossounou () und kerem demirbay () sind mit je zwei gelben karten vorbelastet, hatten schon verwarnungen aus der champions league auf dem konto",mitchel bakker,de,2023-04-13T07:31:14Z
"das kleine happy end nach einem grossen abnutzungskampf hat bei bayer leverkusen fur optimismus gesorgt. ""das ticket fur ein halbfinale gibt es nicht for free"", sagte trainer xabi alonso nach dem : im viertelfinal-hinspiel der europa league gegen union saint-gilloise: ""aber wir haben noch alle chancen. mein kopf will mehr. wir haben diesen grossen wunsch fur das ruckspiel. und wir bleiben optimistisch.""\n der belgische aussenseiter, der im achtelfinale den bundesliga-dritten union berlin rausgeworfen hatte, untermauerte am donnerstag in leverkusen seinen ruf als unbequemer, ekliger und schwer zu schlagender gegner. nachdem nationalspieler florian wirtz (.) nach dem ruckstand durch victor boniface (.) das remis gerettet hatte, konnte alonso das ganze aber positiv betrachten: ""das war eine gute vorbereitung auf nachste woche.""\n freilich musste alonso zugeben, dass sich die ausgangslage nicht verbessert hat. ""gestern standen die chancen :. jetzt haben wir unentschieden gespielt und sie haben das zweite spiel daheim. daher haben sie vielleicht einen kleinen vorteil"", sagte der zweimalige champions-league-sieger als spieler und dachte wohl an die berliner, die nach einem : zu hause in belgien mit : verloren. ""aber es sind noch mindestens minuten zu spielen"", sagte alonso: ""es wird wie ein finale. make or break. und wir sind bereit dafur.""\n ahnlich sah es torschutze wirtz. ""wir hatten uns eine bessere ausgangslage gewunscht"", sagte der -jahrige: ""aber ich bin sicher, dass wir im ruckspiel gewinnen werden. wir haben eine richtig geile mannschaft. jeder will das schaffen. und durch qualitat plus kampfgeist werden wir uns belohnen.""\n fakt ist: nach der teilweise miserablen hinrunde ist die stimmung rund um den club so euphorisch wie seit jahren nicht. einige tausend fans hatten zwei stunden vor dem spiel den mannschaftsbus empfangen. dieser konnte sich nur mit muhe den weg durch die fans bahnen, eingehullt in eine nebelwolke von zahlreichen pyros. club-chef fernando carro fand die gesamte atmosphare rund um das spiel ""sensationell. wir alle haben lust auf mehr. mannschaft, trainer, fans.""\n fur bayer, das letzter bundesligist in der europa league ist und nach dem : des fc bayern in der champions league bei manchester city wohl die letzte realistische deutsche titelhoffnung im europacup, ware es das vierte europaische halbfinale nach , und . zweimal erreichten die leverkusener danach das finale, im uefa-cup holten sie dann auch den pokal. der letzte titel uberhaupt fur bayer liegt unglaubliche jahre zuruck: gewann leverkusen den dfb-pokal.\n pressemappe auf deutsch\n \n \n video zum bus-empfang der fans\n ",mitchel bakker,de,2023-04-13T18:25:08Z
"das morgenpost sportstubchen\n inga boddeling und michael farber sprechen im morgenpost sportstubchen uber aktuelle berliner sport-themen.\n bayer leverkusen hat dank florian wirtz chancen auf das halbfinale in der europa league. gegen union saint-gilloise gab es ein :.\n leverkusen.\xadank florian wirtz hat bayer leverkusen noch alle chancen auf den einzug ins halbfinale der europa league. beim : (:) im viertelfinal-hinspiel gegen union saint-gilloise rettete der nationalspieler mit seinem treffer acht minuten vor schluss zumindest das remis. dennoch steht bayer im ruckspiel in einer woche in anderlecht vor einer menge arbeit, denn am donnerstag biss sich die werkself am belgischen aussenseiter wie schon union berlin im achtelfinale uber weite strecken die zahne aus.\n gegner im vierten halbfinale eines europacups fur leverkusen nach , und ware entweder der souverane niederlandische tabellenfuhrer feyenoord rotterdam oder der letztjahrige conference-league-sieger as rom mit trainer jose mourinho. das hinspiel gewann rotterdam zu hause mit :. den fuhrungstreffer fur die belgier hatte der nigerianer victor boniface erzielt (.), der schon in der runde zuvor gegen den bundesliga-dritten aus berlin zwei treffer erzielt und einen vorbereitet hatte.\n wie gross die euphorie in leverkusen rund um dieses spiel war, zeigte sich zwei stunden vor dem anpfiff. einige tausend fans hatten den mannschaftsbus empfangen. nur mit muhe konnte sich der bus den weg durch die fans bahnen, eingehullt in eine nebelwolke von zahlreichen pyros. doch die nur auf einer position veranderte bayer-elf wirkte zunachst eher nervos und fahrig, fabrizierte gegen die robusten belgier in der anfangsphase ungewohnlich viele abspielfehler. als erster kleiner brustloser diente ein konter in der . minute, bei dem amine adli seinen kollegen wirtz schnell bediente und der aus metern knapp verzog.\n einen kurzen schockmoment erlebten die gastgeber in der siebten minute, als torhuter lukas hradecky sich entweder verschatzte oder ein extrem gutes auge hatte. einen harmlosen aufsetzer von lazare amani wollte er uber das tor springen lassen, doch der ball landete auf der latte (.). eine viertelstunde spater musste hradecky bei einem schragschuss von boniface dann richtig eingreifen.\n und dann fiel das tor tatsachlich auf der gegenseite, als der starke boniface den ball aus zehn metern ins lange eck schlenzte. bayer rannte nun an, aber zunehmend wild und hektisch, was die disziplinierten gaste selten vor grosse probleme stellte. in der schlussphase gelang dann aber doch der erlosende ausgleichstreffer, als wirtz mit einem distanzschuss genau zielte.'}\n ",mitchel bakker,de,2023-04-13T18:33:39Z
\n mitchel bakker: einziger neuer spieler in der startelf,mitchel bakker,de,2023-04-14T08:16:22Z
schliesslich ist die position links hinten im team xabi alonsos mit mitchel bakker und daley sinkgraven derzeit nicht herausragend besetzt,mitchel bakker,de,2023-04-15T16:09:00Z
"dort sassen mit jonathan tah, amine adli, mitchel bakker und vor allem florian wirtz vier spieler auf der bank, die in den wirklich wichtigen partien meist zur startelf zahlen",mitchel bakker,de,2023-04-20T15:41:59Z
"), leverkusens :-schutze, und mitchel bakker, der das : besorgt, feiern zusammen\n sie sind fussball-deutschlands letztes europa-eisen im feuer!\n bayer leverkusen schlagt im viertelfinale der europa league union saint-gilloise : (hinspiel :)",mitchel bakker,de,2023-04-20T20:50:39Z
"moussa diaby brachte die mannschaft von trainer xabi alonso in brussel nach sekunden in fuhrung, mitchel bakker (",mitchel bakker,de,2023-04-20T20:51:25Z
"die leverkusener profis tanzten vor ihren fans, aus rund metern schaute trainer xabi alonso voller stolz zu. deutschlands letzte titel-hoffnung in europa heisst bayer statt bayern. die werkself erreichte nach einer uber weite strecken schon titelreifen leistung als einziger fussball-bundesligist das halbfinale eines europacup-wettbewerbs und darf vom ersten titel seit jahren traumen. ""auf jeden fall"" sei das ein ganz grosser tag, sagte robert andrich bei rtl und lobte die anhanger: ""ich bin sehr, sehr happy, dass wir das ding heute gezogen haben.""\n umarmungen fur die bayern-profis\n erst im vorjahr hatte eintracht frankfurt die deutsche wartezeit auf einen titel im zweitwichtigsten europacup nach jahren beendet. leverkusen hatte den vorganger-wettbewerb uefa-cup gewonnen, der letzte bayer-titel uberhaupt war der gewinn des dfb-pokals im jahr . zuletzt hatte bayer vor jahren das halbfinale eines europacups erreicht. damals stiessen die rheinlander sogar ins endspiel der champions league vor, verloren dieses aber mit : gegen real madrid.\n mehr arbeit in der defensive\n im lotto-park, in dem normalerweise der rsc anderlecht seine heimspiele bestreitet, erwischte bayer einen traumstart. senne lynen fing den doppelpass zwischen florian wirtz und diaby eigentlich ab, spitzelte den ball aber dadurch diaby in den fuss. der franzosische nationalspieler dribbelte torhuter anthony moris aus und schob ein.\n das schnelle tor sorgte aber auch dafur, dass bayer ohne den im hinspiel verletzten weltmeister exequiel palacios ab der zweiten minute defensiv noch mehr arbeit verrichten mussten. die belgier rannten mit all ihrer korperlichkeit an, die werkself stemmte sich dagegen und hoffte auf konter. die kamen durchaus und nach minuten hatte diaby nach schonem pass von wirtz erhohen konnen, verzog aber knapp. sechs minuten spater trat hlozek nach hereingabe von bakker am ball vorbei.\n acht minuten vor der pause spielte bayer einen uberragenden angriff sehenswert zu ende. doppelpass von diaby und wirtz diesmal schon im mittelfeld, diaby zog auf, bediente hlozek, dessen flanke bakker am langen eck volley verwertete. saint-gilles kam bis zur pause bestenfalls zu ein paar halbchancen.\n treffer ins leere tor\n nach der pause verstarkten die gastgeber den druck weiter, doch die leverkusener abwehr um den seit wochen starken jonathan tah verteidigte leidenschaftlich und gewissenhaft. bayer legte sogar wieder nach, als bakker moris erfolgreich bedrangte, der torhuter den ball in die fusse von frimpong spielte und der ins leere tor traf. doch die belgier gaben immer noch nicht auf und kamen zum anschlusstreffer und trafen durch simon adingra die latte (.). fur klarheit sorgte bayers viertes tor, per abstauber traf hlozek nach einem schuss von diaby.\n \n \n ",mitchel bakker,de,2023-04-20T20:54:03Z
