data,player,language,publishedAt
"florian wirtz machte nicht eindruck hadern wurde ,,naturlich"" ,,eine bessere ausgangslage gewunscht"" sagte ausnahmetalent bayer leverkusen sei sicher reise werkself europa nicht ende sei ,,ich sicher ruckspiel gewinnen werden"" erklarte jahrige hinspiel viertelfinals europa league union saint gilloise donnerstagabend zuversichtlich mache wurde wirtz gefragt antwort sprach gebundeltes selbstvertrauen ,,weil richtig geile mannschaft qualitat kampfgeist belohnt schaffen stattdessen zeigten profis qualitaten schnellen flugelspieler jeremie frimpong moussa diaby rechts amine adli links wurden bayers scharfsten waffen franzose adli erzielte funf pflichtspieltreffer sechs tore bereitete niederlander frimpong kommt acht treffer neun vorbereitungen fur diaby sogar frankreichs kader schaffte stehen sogar treffer neun vorbereitungen buche jahrige begehrtesten transferobjekte europas entwickelt manchester united bereits interesse signalisiert alonso zunachst oberbegriff ,,schadensbegrenzung"" eingeleitet langst unterhaltsamer offensiver fussball geworden vergangenen wochen machte mannschaft mal sprung wirtz pause wegen kreuzbandrisses ausser gefecht kommt immer besser form dank passe bayer fur gegner schwerer auszurechnen saint gilles rettete techniker zumindest punkt hoffnung halbfinale",jeremie frimpong,de,2023-04-16T07:30:18Z
wenig berauschend leverkusen wolfsburg lieferten spiel ergebnis passt allerdings merkte zuletzt besten bundesliga mannschaft hohe belastung internationalen spiele merklich langen balle vfl trainer niko kovac flinken jungs bezeichneten offensiv stars moussa diaby kamen selten spielfreude vergangenen wochen kaum sehen beste gelegenheit ersten halben stunde besass adam hlozek tscheche traf latte passgeber jeremie frimpong stand jedoch zuvor abseits nicht besser machten wolfsburger vorherigen funf heimspiele nicht gewinnen konnten erkrankten kapitan maximilian arnold fehlte zuschauern power mittelfeld beste einzige vfl chance pause yannick gerhardt kopfball knapp uber tor bayer torhuter lukas hradecky ging,jeremie frimpong,de,2023-04-16T19:29:40Z
siegesserie bayer leverkusen gerissen fur team trainer xabi alonso reichte auswartsspiel beim vfl wolfsburg zuvor bayer funfmal folge fussball bundesliga gewonnen allerdings merkte zuletzt besten bundesliga mannschaft hohe belastung internationalen spiele merklich langen balle vfl trainer niko kovac flinken jungs bezeichneten offensiv stars moussa diaby kamen selten spielfreude vergangenen wochen kaum sehen beste gelegenheit ersten halben stunde besass adam hlozek tscheche traf latte passgeber jeremie frimpong stand jedoch zuvor abseits wolfsburg erkrankten kapitan arnold,jeremie frimpong,de,2023-04-16T19:31:10Z
"warum sehe faz net nicht allerdings merkte zuletzt besten bundesligamannschaft hohe belastung internationalen spiele merklich langen balle vfl trainer niko kovac ,,flinken jungs"" bezeichneten offensiv stars moussa diaby kamen selten spielfreude vergangenen wochen kaum sehen beste gelegenheit ersten halben stunde besass adam hlozek tscheche traf latte passgeber jeremie frimpong stand jedoch zuvor abseits nicht besser machten wolfsburger vorherigen funf heimspiele nicht gewinnen konnten erkrankten kapitan maximilian arnold fehlte zuschauern power mittelfeld beste einzige vfl chance pause yannick gerhardt kopfball knapp uber tor bayer torhuter lukas hradecky ging",jeremie frimpong,de,2023-04-16T19:34:14Z
leverkusens edmond tapsoba robert andrich odilon kossounou kerem demirbay schlusspfiff allerdings merkte zuletzt besten bundesliga mannschaft hohe belastung internationalen spiele merklich langen balle vfl trainer niko kovac flinke jungs bezeichneten offensiv stars moussa diaby kamen selten spielfreude vergangenen wochen kaum sehen beste gelegenheit ersten halben stunde besass adam hlozek tscheche traf latte passgeber jeremie frimpong stand jedoch zuvor abseits nicht besser machten wolfsburger vorherigen funf heimspiele nicht gewinnen konnten erkrankten kapitan maximilian arnold fehlte zuschauern power mittelfeld beste einzige vfl chance pause yannick gerhardt kopfball knapp uber tor bayer torhuter lukas hradecky ging,jeremie frimpong,de,2023-04-16T19:39:52Z
hinspiel leverkusen klasse aussenseiters belgien gezeigt spatestens wissen fur gute jungs sagte bayer torhuter lukas hradecky schwer knacken,jeremie frimpong,de,2023-04-16T19:41:56Z
siegesserie bayer leverkusen gerissen fur team trainer xabi alonso reichte auswartsspiel sonntag beim vfl wolfsburg zuvor bayer funfmal folge fussball bundesliga gewonnen torlose remis taugt bedingt mutmacher fur viertelfinal ruckspiel europa league kommenden donnerstag union saint gilloise hinspiel bundesliga tabelle bleibt leverkusen sechster vfl belegt vier punkten ruckstand neunten platz allerdings merkte zuletzt besten bundesliga mannschaft hohe belastung internationalen spiele merklich langen balle vfl trainer niko kovac flinken jungs bezeichneten offensiv stars moussa diaby kamen selten spielfreude vergangenen wochen kaum sehen beste gelegenheit ersten halben stunde besass adam hlozek tscheche traf latte passgeber jeremie frimpong stand jedoch zuvor abseits nicht besser machten wolfsburger vorherigen funf heimspiele nicht gewinnen konnten erkrankten kapitan maximilian arnold fehlte zuschauern power mittelfeld beste einzige vfl chance pause yannick gerhardt kopfball knapp uber tor bayer torhuter hradecky ging,jeremie frimpong,de,2023-04-16T20:05:00Z
trainer kovac schwarmt verteidiger viele millionen bringen geld derjenige mitbringen abwehrmann verpflichten mochte boss schafer beschreibt vorzuge spielers linksfuss extremes tempo spielt sekunde micky bringt uber ganze saison konstant gute leistungen manager coach kovac betonen trotzdem reichlich entwicklungspotenzial gleichwohl ragt meter mann schon heraus geschwindigkeit schnellste innenverteidiger liga sonntag leverkusen nahm probleme bayers topsprintern moussa diaby xabi alonso zweiten halfte lieber linke seite verschob jeremie frimpong bonne heure schwarmt kovac moment zeigt schon ausserordentlich europaweit registriert interesse van ven gibt wolfsburger entscheidern bekannt offizielle anfragen gebe interessierte klubs england konnen schon mal daran orientieren insel zuletzt fur innenverteidiger uber tisch ging chelsea zahlte fur wesley fofana stolze millionen euro leicester city van vens landsmann sven botman wolfsburger linksfuss newcastle united beim wechsel lille premier league millionen euro wert kurzum millionen entsprechender entwicklung kicker informationen kaum gehen,jeremie frimpong,de,2023-04-18T16:13:08Z
moussa diaby leverkusens schutze mitchel bakker besorgt feiern zusammen jeremie frimpong macht deckel drauf bakker setzt zuvor torwart moris sensationell druck frimpong fehlpass keepers einschieben belgier terho ergebnis kosmetik union nochmal druckt bayer zwischenzeitlich hinten schwimmt,jeremie frimpong,de,2023-04-20T20:50:39Z
besser fur bayer leverkusen kaum laufen ruckspiel union saint gilloise geht werkself schon sekunden fuhrung lasst danach nichts anbrennen steht erstmals seit europapokal halbfinale hinspiel tabellenzweiten belgien runde zuvor union berlin ausgeschaltet ausgegangen moussa diaby brachte mannschaft trainer xabi alonso brussel sekunden fuhrung mitchel bakker jeremie frimpong adam hlozek legten tor belgier erzielte casper terho erst vorjahr eintracht frankfurt deutsche wartezeit titel zweitwichtigsten europacup jahren beendet leverkusen vorganger wettbewerb uefa cup gewonnen letzte bayer titel uberhaupt gewinn dfb pokals jahr zuletzt bayer jahren halbfinale europacups erreicht damals stiessen rheinlander sogar endspiel champions league verloren real madrid pause verstarkten gastgeber druck leverkusener abwehr seit wochen starken jonathan tah verteidigte leidenschaftlich gewissenhaft bayer legte sogar bakker moris erfolgreich bedrangte torhuter ball fusse frimpong spielte leere tor traf belgier gaben immer nicht kamen anschlusstreffer trafen simon adingra latte fur klarheit sorgte bayers viertes tor per abstauber traf hlozek schuss diaby,jeremie frimpong,de,2023-04-20T20:51:25Z
leverkusener profis tanzten fans rund metern schaute trainer xabi alonso voller stolz deutschlands letzte titel hoffnung europa heisst bayer statt bayern werkself erreichte uber weite strecken schon titelreifen leistung einziger fussball bundesligist halbfinale europacup wettbewerbs darf ersten titel seit jahren traumen fall sei ganz grosser tag sagte robert andrich rtl lobte anhanger happy ding heute gezogen pause verstarkten gastgeber druck leverkusener abwehr seit wochen starken jonathan tah verteidigte leidenschaftlich gewissenhaft bayer legte sogar bakker moris erfolgreich bedrangte torhuter ball fusse frimpong spielte leere tor traf belgier gaben immer nicht kamen anschlusstreffer trafen simon adingra latte fur klarheit sorgte bayers viertes tor per abstauber traf hlozek schuss diaby,jeremie frimpong,de,2023-04-20T20:54:03Z
kapitan lukas hradecky stand mehr halbe stunde schlusspfiff journalisten dachte frohlockend daruber viele bier gleich dreistundigen busfahrt hause erlaubt wurden plotzlich rief club chef fernando carro rasen musst rauskommen wahnsinn sagte carro rund fans bayer leverkusen sangen immer dauerschleife forderten feierten halbfinal einzug europa league spieler einzeln,jeremie frimpong,de,2023-04-20T20:54:23Z
letzte deutsche titel hoffnung europa heisst bayer statt bayern bayer leverkusen uber weite strecken titelreifen leistung einziger bundesligist halbfinale europacup wettbewerbs erreicht darf ersten titel seit jahren traumen zwei tage bayern munchen champions league erreichte werkself viertelfinal ruckspiel union saint gilloise vorschlussrunde europa league hinspiel tabellenzweiten belgien runde zuvor union berlin ausgeschaltet ausgegangen moussa diaby brachte mannschaft trainer xabi alonso donnerstag brussel sekunden fuhrung mitchel bakker jeremie frimpong adam hlozek legten tor belgier erzielte casper terho erst vorjahr eintracht frankfurt deutsche wartezeit titel zweitwichtigsten europacup jahren beendet leverkusen vorganger wettbewerb uefa cup gewonnen letzte bayer titel uberhaupt gewinn dfb pokals jahr zuletzt bayer jahren halbfinale europacups erreicht damals stiessen rheinlander sogar endspiel champions league verloren real madrid pause verstarkten gastgeber druck leverkusener abwehr seit wochen starken jonathan tah verteidigte leidenschaftlich gewissenhaft bayer legte sogar bakker moris erfolgreich bedrangte torhuter ball fusse frimpong spielte leere tor traf belgier gaben immer nicht kamen anschlusstreffer trafen simon adingra latte fur klarheit sorgte bayers viertes tor per abstauber traf hlozek schuss diaby,jeremie frimpong,de,2023-04-20T20:55:54Z
warum sehe faz net nicht leverkusens vortanzer jeremie frimpong jubelt uber tor vorjahr gewann eintracht frankfurt europa league konnte leverkusen titel holen union saint gilloise zieht bayer halbfinale hinspiel tabellenzweiten belgien runde zuvor union berlin ausgeschaltet ausgegangen moussa diaby brachte mannschaft trainer xabi alonso donnerstag brussel sekunden fuhrung mitchel bakker jeremie frimpong adam hlozek legten tor belgier erzielte casper terho erst vorjahr eintracht frankfurt deutsche wartezeit titel zweitwichtigsten europacup jahren beendet leverkusen vorganger wettbewerb uefa cup gewonnen letzte bayer titel uberhaupt gewinn dfb pokals jahr zuletzt bayer jahren halbfinale europacups erreicht damals stiessen rheinlander sogar endspiel champions league verloren real madrid pause verstarkten gastgeber druck leverkusener abwehr seit wochen starken jonathan tah verteidigte leidenschaftlich gewissenhaft bayer legte sogar bakker moris erfolgreich bedrangte torhuter ball fusse frimpong spielte leere tor traf belgier gaben immer nicht kamen anschlusstreffer trafen simon adingra latte fur klarheit sorgte bayers viertes tor per abstauber traf hlozek schuss diaby konnen rechte artikel erwerben,jeremie frimpong,de,2023-04-20T21:02:06Z
bayer xaleverkusen xahat uber weite strecken titelreifen leistung einziger bundesligist halbfinale europacup wettbewerbs erreicht darf ersten titel seit jahren traumen tag bayern munchen champions league erreichte werkself viertelfinal ruckspiel union saint gilloise brussel vorschlussrunde europa league hinspiel tabellenzweiten belgiens runde zuvor union berlin ausgeschaltet ausgegangen moussa diaby brachte mannschaft trainer xabi alonso brussel schon sekunden fuhrung mitchel bakker jeremie frimpong adam hlozek legten tor belgier erzielte casper terho erst vorjahr eintracht frankfurt deutsche wartezeit titel zweitwichtigsten europacup jahren beendet xaleverkusen xahatte vorganger wettbewerb uefa cup gewonnen letzte bayer titel uberhaupt gewinn dfb pokals jahr zuletzt bayer jahren halbfinale europacups erreicht damals stiessen rheinlander sogar endspiel champions league verloren real madrid pause verstarkten gastgeber druck leverkusener abwehr seit wochen starken jonathan tah verteidigte leidenschaftlich gewissenhaft bayer legte sogar bakker moris erfolgreich bedrangte torhuter ball fusse frimpong spielte leere tor traf belgier gaben immer nicht kamen anschlusstreffer trafen simon adingra latte fur klarheit sorgte bayers viertes tor per abstauber traf hlozek schuss diaby,jeremie frimpong,de,2023-04-20T21:03:29Z
gut fehlentscheidung sascha stegemann borussia dortmund meisterschaft kostet entscheidenden momente gab bundesliga historie mehrfach sportschau blickt zuruck,jeremie frimpong,de,2023-04-20T21:08:51Z
sevilla brachte spanische manunited tormann david gea harry maguire bedrangnis abwehrchef verlor druck dreier sevilla spieler ball ende vollendete youssef nesyri fruhen fuhrung kurz pause erhohte loic bade neysri traf patzer gea leverkusen fuhrte brussel dank traumstarts moussa diaby spater mitchel bakker sowie jeremie frimpong liess aufstieg nicht mehr nehmen zudem traf adam hlozek fur deutschen casper terho erzielte ehrentor red orf agenturen,jeremie frimpong,de,2023-04-20T21:11:48Z
torschutzen moussa diaby links treffer fur leverkusen gratuliert mitchel bakker treffer bayer leverkusen darf gala vorstellung dritten titel vereinsgeschichte traumen team trainer xabi alonso gewann viertelfinal ruckspiel europa league union saint gilloise belgien sturmte hinspiel erstmals seit europaisches halbfinale moussa diaby sekunden mitchel bakker jeremie frimpong adam hlozek munzten uberlegenheit leverkusener treffer casper terho traf fur gastgeber bayer danach wackeln xabrachten ausscheiden bayern champions league bayer letzte deutsche hoffnung europapokal mussen hochstem level performen halbfinale minuten erreichen alonso partie angekundigt hinspiel angeschlagene argentinische weltmeister exequiel palacios verlor wettlauf zeit stand nicht kader sturmer amine adli nahm zunachst bank xaplatz zuvor harmlosen gastgeber kamen schwungvoller kabine mitten besten phase saint gilloise nutzte frimpong schweren torwart patzer moris belgier gaben nicht durften treffer terho hoffen toptorjager victor boniface simon adingra senne lynen exzellente gelegenheiten anschluss hlozek beseitigte letzten zweifel triumph xabundesliga sechsten vermeintlichen aussenseiter union saint gilloise prazisionsschuss teenagers prekares remis retten erst schlussphase sieht bayer elf favorit fur einzug halbfinale,jeremie frimpong,de,2023-04-20T21:15:24Z
vorjahr gewann frankfurt europa league konnte leverkusen titel deutschland holen saint gilles zieht werkself halbfinale hinspiel tabellenzweiten belgien runde zuvor union berlin ausgeschaltet ausgegangen moussa diaby brachte mannschaft trainer xabi alonso donnerstag brussel sekunden fuhrung mitchel bakker jeremie frimpong adam hlozek legten tor belgier erzielte casper terho sportchef simon rolfes geschaftsfuhrer fernando carro rannten schlusspfiff umarmten bayern profi einzeln erst vorjahr eintracht frankfurt deutsche wartezeit titel zweitwichtigsten europacup jahren beendet leverkusen vorganger wettbewerb uefa cup gewonnen letzte bayer titel uberhaupt gewinn dfb pokals jahr zuletzt bayer jahren halbfinale europacups erreicht damals stiessen rheinlander sogar endspiel champions league verloren real madrid pause verstarkten gastgeber druck leverkusener abwehr seit wochen starken jonathan tah verteidigte leidenschaftlich gewissenhaft bayer legte sogar bakker moris erfolgreich bedrangte torhuter ball fusse frimpong spielte leere tor traf belgier gaben immer nicht kamen anschlusstreffer trafen simon adingra latte fur klarheit sorgte bayers viertes tor per abstauber traf hlozek schuss diaby dpa,jeremie frimpong,de,2023-04-20T21:20:28Z
fur marcel sabitzer manchester united traum europa league titel beim sechsfachen rekordgewinner sevilla geplatzt spaten gegentore heimhinspiel rachten donnerstag ebenso zwei peinliche schnitzer englander unterlagen mussen anvisierte champions league qualifikation uber premier league schaffen sevillas halbfinalgegner mai juventus turin hurde sporting lissabon nahm leverkusen fuhrte brussel dank traumstart moussa diaby spater mitchel bakker sowie jeremie frimpong liess aufstieg nicht mehr nehmen zudem traf adam hlozek fur deutschen casper terho erzielte ehrentor fur gastgeber,jeremie frimpong,de,2023-04-21T04:27:00Z
"party fans bayer profis moussa diaby lukas hradecky florian wirtz karim bellarabi piero hincapie jonathan tah vortanzer torschutze jeremie frimpong kollegen feiern halbfinal einzug jeremie frimpong vorne hinten frimpong uberall gleichzeitig reagierte cool nutzte chance note robert andrich starker auftritt ,,emotionalen leaders"" werkself langst nominierung nationalelf verdient merkte sekunde lust nacht note nadiem amiri anstelle angeschlagenen exequiel palacios beginnen wurde uberraschte viele wohl belgier offensive wenig akzente dafur enormer einsatz fur mannschaft note mitchel bakker monster spiel niederlanders volley abnahme setzte union keeper moris derart druck frimpong ball ,,auflegte"" leitete bakker mehr geht nicht bester auftritt bayer trikot weltklasse note moussa diaby franzose schoss schnellste europa league tor saison entstehung zweiten vierten treffers entscheidend beteiligt note amine adli fur frimpong ende reichte beim franzosen zumindest fur joker einsatz kurz schluss gute schusschance note sardar azmoun fur hlozek iraner nachspielzeit zwei gute moglichkeiten vergab jedoch beide note",jeremie frimpong,de,2023-04-21T07:56:02Z
leverkusens metamorphose abstiegs titelkandidaten,jeremie frimpong,de,2023-04-21T08:50:46Z
gegner bayer halbfinale europa league roma zeigte rotterdam mannschaft lage bayer leverkusen xaist einziger deutscher klub uberhaupt europapokal dabei halbfinale xaeuropa league bundesliga klub besiegte donnerstagabend belgischen vertreter union saint gilloise hinspiel leverkusen ausgegangen fur bayer trafen moussa diaby minute michel bakker jeremie frimpong adam hlozek fur einzige tor belgier sorgte casper terho dpa,jeremie frimpong,de,2023-04-21T09:05:10Z
xabi alonso macht leverkusen besser lernt zugleich trainernovize team schon sekunden glucklichen umstanden fuhrung gehen wurde torschutze moussa diaby erhielt vorlage gegnerseite konnte fussballweise alonso nicht voraussehen schon ersten minute wurde leverkusener spielanlage sichtbar offensiven rollenwechseln stabilen defensiven fundament gepragt diaby florian wirtz adam hlozek jeremie frimpong teilten raume bedarf belieben linken seite marschierte derweil mitchel bakker nieder hradecky anatomisches wunder glaubte weiss nicht viele lungen mann wahrscheinlich mehr xazwei niederlandischen linksverteidiger bakker nachgesagt verstehe innerhalb zwei szenen fussballspiels sowohl welt kreisklasse verkorpern ferner beruchtigt fur haufiges zuspatkommen ausser euro einsatze punktspielen gekostet zuletzt gewisse regelmassigkeit arbeitszeiten eingekehrt fur bakkers auftreten spiel gilt wild immer nicht mehr wust fruher beim treffer blieb bakker cool vollendete meisterlich ausgespielten gegenangriff uber wirtz diaby flankengeber hlozek anteil zogerlichen union torwart anthony moris zusetzte ball fur frimpong geradewegs einschuss xabereitlegte inzwischen jedoch spieler bakker neu erfunden spieler wiederentdeckt schon unauffindbar kader verloren gegangen exequiel palacios nadiem amiri spieler selten erreichtes niveau getrimmt verteidiger jonathan tah ruf trainers alonso nahert rang spielers alonso leverkusens semifinalwurdige leistung hradecky brussel xabeitragen spektakulare trainerwechsel bayern saison nicht gerettet bereits thomas tuchel beschadigt dennoch fehlt fantasie jemand dafur verantwortung ubernehmen wurde spannend,jeremie frimpong,de,2023-04-21T10:02:05Z
torschutzen mitchel bakker feiert moussa diaby,jeremie frimpong,de,2023-04-21T13:21:07Z
timo werner leipziger kassierten leverkusen ruckschlag kampf platz champions league nkunku leitete abschluss beste leipziger phase mude wirkenden leverkusener beschrankten aufs verteidigen gingen risiko werner vergab riesenchance hradecky rannte dabei anfallig fur konter sachsen belohnten fur klare uberlegenheit szoboszlai brachte leverkusener angriff jeremie frimpong fall feld amiri verwandelte elfmeterpunkt,jeremie frimpong,de,2023-04-23T17:26:22Z
bayer trainer xabi alonso versank jubeltraube leverkusener bank leipzigs trainer marco rose brachte pause christopher nkunku deutschlands fussballer jahres aussenbandriss vorwoche minutiges comeback gegeben leipzigs spiel wurde zielstrebiger gab wenigstens chancen eben nkunku tah parade hradecky ball letzter sekunde fussen wegschlug kurz darauf parierte hradecky kopfball willi orban eckball frimpong verpasste leverkusener konter entscheidung fur amiri elfmeterpunkt sorgte abpfiff schlug amiri uberschwanglich hand rasen,jeremie frimpong,de,2023-04-23T17:26:57Z
warum sehe faz net nicht leverkusens torschutze nadiem amiri rechts jeremie frimpong jubeln treffer ebenso schlauen pragmatischen spielweise ruckt leverkusen tabelle leipzig heran sachsen mussen champions league teilnahme bangen,jeremie frimpong,de,2023-04-23T17:33:57Z
jeremie frimpong bekommt gluckwunsche trainers xabi alonso leverkusen derzeit gute laune seit zwei monaten niederlage energie leverkusen beweist beim leipzig xabi alonso immer besser lauft haufen dagegen befurchtungen ulrich hartmann leverkusen leverkusener zwolf pflichtspielen niederlage derzeit formstarkstes team liga duell gegangen mussten wichtigsten mittelfeldspieler florian wirtz verzichten jahrige sass magen darm verstimmung immerhin tribune sah zunachst aktivere leipziger mannschaft deren trainer marco rose kurz spiel dazn verraten chancen rucken jeremie frimpong suchen frimpong bayers supertorgefahrlicher rechtsaussensturmerverteidiger niederlandischen nationaltrainer ronald koeman wegen defensivschwachen ignoriert koeman sieht irgendwie gar xaabwehrmann leipziger fanden trotz weitgehender uberlegenheit chancen rucken frimpong stattdessen platzierte leverkusens piero hincapie minuten trockenen meter lattenschuss warnung ehe adam hlozek minute fuhrung fur gastgeber erzielte angriff uber rechts erfolgt uber seite frimpong moussa diaby vorlage treffer gab rucken frimpong jubelten leverkusener xaabwehrspieler leipzig kam pause christopher nkunku fur kevin kampl sachsische spiel benotigte rheinischen dauerregen mehr vertikalitat erschwerten leverkusener allerdings dadurch weit zuruckzogen gingen leipziger balle horizontal links rechts zuruck chancen ergaben trotzdem etwa standards eckenverhaltnis lautete ende fur leipzig allein tor blieb xaversagt ausgerechnet frimpong breiter brust statt anfalligem rucken entschied partie funf minuten schluss fur leverkusen konter beendete leipzigs dominik szoboszlai strafraum per foul gelb rote karte einbrachte bayer elfmeter nadiem amiri minute einschoss statistiken gewonnen bringt nichts klagte leipzigs benjamin henrichs entscheidenden szenen nicht konsequent xagenug dfb prasident bernd neuendorf rudi voller neuer sportchef nationalelf sprechen sportausschuss bundestages uber katar wirklich drangenden fragen stellt niemand ende voller gelernt,jeremie frimpong,de,2023-04-23T18:00:31Z
kannst netzwelt werbefrei nutzen details abo findest,jeremie frimpong,de,2023-04-26T14:06:21Z
"leverkusens edmond tapsoba berlins sheraldo becker kampfen ball dabei schaut schweizer nicht moussa diaby bereits funf tore bisherigen sieben bundesligaduellen union bejubeln durfte jeremie frimpong amine adli gehoren schnellsten spielern bundesliga ,,es braucht kurze abstande bereit unterstutzen nicht drauf leverkusen hohe geschwindigkeit schwierig verteidigen"" sagte fischer team spaniers xabi alonso derzeit ,,formstarkste mannschaft"" adelte seit pflichtspielen nicht mehr verloren angesichts tabellenkonstellation seit heimspielen ungeschlagenen tabellendritten sechstplatzierten gast leverkusen konnten gaste mehr spielanteile fur behaupten spielweise unioner zugutekame frage geduld beantwortet wobei fischer geduld nicht abwarten verwechseln mochte ,,wenn abwartend beginnen spielen nie geholfen zweite halfte bochum abwartend"" sagt trainer ruckblickend vorherige heimspiel beim abstiegskandidaten ,,wir tun gut daran ersten minute aktiv schluss heimspiel gewinnen",jeremie frimpong,de,2023-04-27T12:25:55Z
