data,player,language,publishedAt
wenig berauschend bayerleverkusen wolfsburg lieferten spiel ergebnis passt allerdings merkte zuletzt besten bundesliga mannschaft hohe belastung internationalen spiele merklich langen balle vfl trainer niko kovac flinken jungs bezeichneten offensiv stars diaby kamen selten spielfreude vergangenen wochen kaum sehen beste gelegenheit halben stunde besass adam hlozek tscheche traf latte passgeber stand jedoch zuvor abseits nicht besser machten wolfsburger vorherigen funf heimspiele nicht gewinnen konnten erkrankten kapitan maximilian arnold fehlte zuschauern power mittelfeld beste einzige vfl chance pause yannick gerhardt kopfball knapp uber tor bayerleverkusen torhuter lukas hradecky ging,jeremie frimpong,de,2023-04-16T19:29:40Z
siegesserie bayerleverkusen gerissen fur team trainer alonso reichte auswartsspiel vfl wolfsburg zuvor bayerleverkusen funfmal folge fussball bundesliga gewonnen allerdings merkte zuletzt besten bundesliga mannschaft hohe belastung internationalen spiele merklich langen balle vfl trainer niko kovac flinken jungs bezeichneten offensiv stars diaby kamen selten spielfreude vergangenen wochen kaum sehen beste gelegenheit halben stunde besass adam hlozek tscheche traf latte passgeber stand jedoch zuvor abseits wolfsburg erkrankten kapitan arnold,jeremie frimpong,de,2023-04-16T19:31:10Z
aktuelle nachrichten politik wirtschaft sport kultur allerdings merkte zuletzt besten bundesligamannschaft hohe belastung internationalen spiele merklich langen balle vfl trainer niko kovac flinken jungs bezeichneten offensiv stars diaby kamen selten spielfreude vergangenen wochen kaum sehen beste gelegenheit halben stunde besass adam hlozek tscheche traf latte passgeber stand jedoch zuvor abseits nicht besser machten wolfsburger vorherigen funf heimspiele nicht gewinnen konnten erkrankten kapitan maximilian arnold fehlte zuschauern power mittelfeld beste einzige vfl chance pause yannick gerhardt kopfball knapp uber tor bayerleverkusen torhuter lukas hradecky ging,jeremie frimpong,de,2023-04-16T19:34:14Z
bayerleverkusen edmond tapsoba andrich odilon kossounou demirbay schlusspfiff allerdings merkte zuletzt besten bundesliga mannschaft hohe belastung internationalen spiele merklich langen balle vfl trainer niko kovac flinke jungs bezeichneten offensiv stars diaby kamen selten spielfreude vergangenen wochen kaum sehen beste gelegenheit halben stunde besass adam hlozek tscheche traf latte passgeber stand jedoch zuvor abseits nicht besser machten wolfsburger vorherigen funf heimspiele nicht gewinnen konnten erkrankten kapitan maximilian arnold fehlte zuschauern power mittelfeld beste einzige vfl chance pause yannick gerhardt kopfball knapp uber tor bayerleverkusen torhuter lukas hradecky ging,jeremie frimpong,de,2023-04-16T19:39:52Z
hinspiel bayerleverkusen klasse aussenseiters belgien gezeigt spatestens wissen alle fur gute jungs sind sagte bayerleverkusen torhuter lukas hradecky sie schwer knacken,jeremie frimpong,de,2023-04-16T19:41:56Z
siegesserie bayerleverkusen gerissen fur team trainer alonso reichte auswartsspiel sonntag vfl wolfsburg zuvor bayerleverkusen funfmal folge fussball bundesliga gewonnen torlose remis taugt bedingt mutmacher fur viertelfinal ruckspiel europaleague kommenden donnerstag union saint gilloise hinspiel bundesliga tabelle bleibt bayerleverkusen sechster vfl belegt vier punkten ruckstand neunten platz allerdings merkte zuletzt besten bundesliga mannschaft hohe belastung internationalen spiele merklich langen balle vfl trainer niko kovac flinken jungs bezeichneten offensiv stars diaby kamen selten spielfreude vergangenen wochen kaum sehen beste gelegenheit halben stunde besass adam hlozek tscheche traf latte passgeber stand jedoch zuvor abseits nicht besser machten wolfsburger vorherigen funf heimspiele nicht gewinnen konnten erkrankten kapitan maximilian arnold fehlte zuschauern power mittelfeld beste einzige vfl chance pause yannick gerhardt kopfball knapp uber tor bayerleverkusen torhuter hradecky ging,jeremie frimpong,de,2023-04-16T20:05:00Z
trainer kovac schwarmt verteidiger viele millionen bringen soll geld derjenige mitbringen abwehrmann verpflichten mochte boss schafer beschreibt vorzuge spielers linksfuss extremes tempo spielt sekunde micky bringt uber ganze saison konstant gute leistungen hat manager coach kovac betonen trotzdem reichlich entwicklungspotenzial gleichwohl ragt meter mann heraus geschwindigkeit schnellste innenverteidiger liga sonntag bayerleverkusen nahm probleme bayers topsprintern diaby alonso zweiten halfte lieber linke verschob auf das bonne heure schwarmt kovac was moment zeigt ausserordentlich europaweit registriert interesse van ven gibt wolfsburger entscheidern bekannt offizielle anfragen gebe keine interessierte klubs england konnen daran orientieren insel zuletzt fur innenverteidiger uber tisch ging chelsea zahlte fur wesley fofana stolze millionen euro leicester city van vens landsmann sven botman wolfsburger linksfuss newcastle united wechsel lille premier league millionen euro wert kurzum millionen entsprechender entwicklung kicker informationen kaum gehen,jeremie frimpong,de,2023-04-18T16:13:08Z
diaby bayerleverkusen schutze bakker besorgt feiern zusammen macht deckel drauf bakker setzt zuvor torwart moris sensationell druck fehlpass keepers einschieben belgier terho ergebnis kosmetik union nochmal druckt bayerleverkusen zwischenzeitlich hinten schwimmt,jeremie frimpong,de,2023-04-20T20:50:39Z
besser fur bayerleverkusen kaum laufen ruckspiel union saint gilloise geht werkself sekunden fuhrung lasst danach nichts anbrennen steht erstmals seit europapokal halbfinale hinspiel tabellenzweiten belgien runde zuvor union berlin ausgeschaltet hatte ausgegangen diaby brachte mannschaft trainer alonso brussel sekunden fuhrung bakker adam hlozek legten nach tor belgier erzielte casper terho vorjahr eintracht frankfurt deutsche wartezeit titel zweitwichtigsten europacup jahren beendet bayerleverkusen vorganger wettbewerb uefa cup gewonnen letzte bayerleverkusen titel uberhaupt gewinn dfb pokals jahr zuletzt bayerleverkusen jahren halbfinale europacups erreicht damals stiessen rheinlander sogar endspiel championsleague vor verloren real madrid pause verstarkten gastgeber druck weiter leverkusener abwehr seit wochen starken tah verteidigte leidenschaftlich gewissenhaft bayerleverkusen legte sogar nach bakker moris erfolgreich bedrangte torhuter ball fusse spielte leere tor traf belgier gaben immer nicht kamen anschlusstreffer trafen simon adingra latte fur klarheit sorgte bayers viertes tor per abstauber traf hlozek schuss diaby,jeremie frimpong,de,2023-04-20T20:51:25Z
leverkusener profis tanzten fans rund metern schaute trainer alonso voller stolz deutschlands letzte titel hoffnung europa heisst bayerleverkusen statt bayern werkself erreichte uber weite strecken titelreifen leistung einziger fussball bundesligist halbfinale europacup wettbewerbs darf titel seit jahren traumen auf fall sei ganz grosser tag sagte andrich rtl lobte anhanger ich sehr happy ding heute gezogen haben pause verstarkten gastgeber druck weiter leverkusener abwehr seit wochen starken tah verteidigte leidenschaftlich gewissenhaft bayerleverkusen legte sogar nach bakker moris erfolgreich bedrangte torhuter ball fusse spielte leere tor traf belgier gaben immer nicht kamen anschlusstreffer trafen simon adingra latte fur klarheit sorgte bayers viertes tor per abstauber traf hlozek schuss diaby,jeremie frimpong,de,2023-04-20T20:54:03Z
kapitan lukas hradecky stand mehr halbe stunde schlusspfiff journalisten dachte frohlockend daruber nach viele bier gleich dreistundigen busfahrt hause erlaubt wurden plotzlich rief club chef fernando carro rasen musst rauskommen wahnsinn sagte carro rund fans bayerleverkusen sangen immer dauerschleife forderten feierten halbfinal einzug europaleague spieler einzeln,jeremie frimpong,de,2023-04-20T20:54:23Z
letzte deutsche titel hoffnung europa heisst bayerleverkusen statt bayern bayerleverkusen uber weite strecken titelreifen leistung einziger bundesligist halbfinale europacup wettbewerbs erreicht darf titel seit jahren traumen zwei tage bayern munchen championsleague erreichte werkself viertelfinal ruckspiel union saint gilloise vorschlussrunde europaleague hinspiel tabellenzweiten belgien runde zuvor union berlin ausgeschaltet hatte ausgegangen diaby brachte mannschaft trainer alonso donnerstag brussel sekunden fuhrung bakker adam hlozek legten nach tor belgier erzielte casper terho vorjahr eintracht frankfurt deutsche wartezeit titel zweitwichtigsten europacup jahren beendet bayerleverkusen vorganger wettbewerb uefa cup gewonnen letzte bayerleverkusen titel uberhaupt gewinn dfb pokals jahr zuletzt bayerleverkusen jahren halbfinale europacups erreicht damals stiessen rheinlander sogar endspiel championsleague vor verloren real madrid pause verstarkten gastgeber druck weiter leverkusener abwehr seit wochen starken tah verteidigte leidenschaftlich gewissenhaft bayerleverkusen legte sogar nach bakker moris erfolgreich bedrangte torhuter ball fusse spielte leere tor traf belgier gaben immer nicht kamen anschlusstreffer trafen simon adingra latte fur klarheit sorgte bayers viertes tor per abstauber traf hlozek schuss diaby,jeremie frimpong,de,2023-04-20T20:55:54Z
aktuelle nachrichten politik wirtschaft sport kultur bayerleverkusen vortanzer jubelt uber tor vorjahr gewann eintracht frankfurt europaleague konnte bayerleverkusen titel holen union saint gilloise zieht bayerleverkusen halbfinale ein hinspiel tabellenzweiten belgien runde zuvor union berlin ausgeschaltet hatte ausgegangen diaby brachte mannschaft trainer alonso donnerstag brussel sekunden fuhrung bakker adam hlozek legten nach tor belgier erzielte casper terho vorjahr eintracht frankfurt deutsche wartezeit titel zweitwichtigsten europacup jahren beendet bayerleverkusen vorganger wettbewerb uefa cup gewonnen letzte bayerleverkusen titel uberhaupt gewinn dfb pokals jahr zuletzt bayerleverkusen jahren halbfinale europacups erreicht damals stiessen rheinlander sogar endspiel championsleague vor verloren real madrid pause verstarkten gastgeber druck weiter leverkusener abwehr seit wochen starken tah verteidigte leidenschaftlich gewissenhaft bayerleverkusen legte sogar nach bakker moris erfolgreich bedrangte torhuter ball fusse spielte leere tor traf belgier gaben immer nicht kamen anschlusstreffer trafen simon adingra latte fur klarheit sorgte bayers viertes tor per abstauber traf hlozek schuss diaby konnen rechte artikel erwerben,jeremie frimpong,de,2023-04-20T21:02:06Z
bayerleverkusen xaleverkusen xahat uber weite strecken titelreifen leistung einziger bundesligist halbfinale europacup wettbewerbs erreicht darf titel seit jahren traumen tag bayern munchen championsleague erreichte werkself viertelfinal ruckspiel union saint gilloise brussel vorschlussrunde europaleague hinspiel tabellenzweiten belgiens runde zuvor union berlin ausgeschaltet hatte ausgegangen diaby brachte mannschaft trainer alonso brussel sekunden fuhrung bakker adam hlozek legten nach tor belgier erzielte casper terho vorjahr eintracht frankfurt deutsche wartezeit titel zweitwichtigsten europacup jahren beendet xaleverkusen xahatte vorganger wettbewerb uefa cup gewonnen letzte bayerleverkusen titel uberhaupt gewinn dfb pokals jahr zuletzt bayerleverkusen jahren halbfinale europacups erreicht damals stiessen rheinlander sogar endspiel championsleague vor verloren real madrid pause verstarkten gastgeber druck weiter leverkusener abwehr seit wochen starken tah verteidigte leidenschaftlich gewissenhaft bayerleverkusen legte sogar nach bakker moris erfolgreich bedrangte torhuter ball fusse spielte leere tor traf belgier gaben immer nicht kamen anschlusstreffer trafen simon adingra latte fur klarheit sorgte bayers viertes tor per abstauber traf hlozek schuss diaby,jeremie frimpong,de,2023-04-20T21:03:29Z
gut sein fehlentscheidung sascha stegemann borussia dortmund meisterschaft kostet entscheidenden momente gab bundesliga historie mehrfach sportschau blickt zuruck,jeremie frimpong,de,2023-04-20T21:08:51Z
sevilla brachte spanische manunited tormann david gea harry maguire bedrangnis abwehrchef verlor druck dreier sevilla spieler ball vollendete youssef nesyri fruhen fuhrung kurz pause erhohte loic bade neysri traf patzer gea bayerleverkusen fuhrte brussel dank traumstarts diaby spater bakker sowie liess aufstieg nicht mehr nehmen zudem traf adam hlozek fur deutschen casper terho erzielte ehrentor red orf agenturen,jeremie frimpong,de,2023-04-20T21:11:48Z
torschutzen sich diaby links treffer fur bayerleverkusen gratuliert bakker treffer bayerleverkusen darf gala vorstellung dritten titel vereinsgeschichte traumen team trainer alonso gewann viertelfinal ruckspiel europaleague union saint gilloise belgien sturmte hinspiel erstmals seit europaisches halbfinale diaby sekunden bakker adam hlozek munzten uberlegenheit leverkusener treffer casper terho traf fur gastgeber bayerleverkusen danach wackeln xabrachten ausscheiden bayern championsleague bayerleverkusen letzte deutsche hoffnung europapokal wir mussen hochstem level performen halbfinale minuten erreichen alonso partie angekundigt hinspiel angeschlagene argentinische weltmeister palacios verlor wettlauf zeit stand nicht kader sturmer adli nahm zunachst bank xaplatz zuvor harmlosen gastgeber kamen schwungvoller kabine mitten besten phase saint gilloise nutzte schweren torwart patzer moris belgier gaben nicht auf durften treffer terho hoffen toptorjager victor boniface simon adingra senne lynen exzellente gelegenheiten anschluss hlozek beseitigte letzten zweifel triumph des xabundesliga sechsten vermeintlichen aussenseiter union saint gilloise prazisionsschuss teenagers prekares remis retten schlussphase sieht bayerleverkusen elf favorit fur einzug halbfinale aus,jeremie frimpong,de,2023-04-20T21:15:24Z
vorjahr gewann frankfurt europaleague konnte bayerleverkusen titel deutschland holen saint gilles zieht werkself halbfinale ein hinspiel tabellenzweiten belgien runde zuvor union berlin ausgeschaltet hatte ausgegangen diaby brachte mannschaft trainer alonso donnerstag brussel sekunden fuhrung bakker adam hlozek legten nach tor belgier erzielte casper terho sportchef simon rolfes geschaftsfuhrer fernando carro rannten schlusspfiff umarmten bayern profi einzeln vorjahr eintracht frankfurt deutsche wartezeit titel zweitwichtigsten europacup jahren beendet bayerleverkusen vorganger wettbewerb uefa cup gewonnen letzte bayerleverkusen titel uberhaupt gewinn dfb pokals jahr zuletzt bayerleverkusen jahren halbfinale europacups erreicht damals stiessen rheinlander sogar endspiel championsleague vor verloren real madrid pause verstarkten gastgeber druck weiter leverkusener abwehr seit wochen starken tah verteidigte leidenschaftlich gewissenhaft bayerleverkusen legte sogar nach bakker moris erfolgreich bedrangte torhuter ball fusse spielte leere tor traf belgier gaben immer nicht kamen anschlusstreffer trafen simon adingra latte fur klarheit sorgte bayers viertes tor per abstauber traf hlozek schuss diaby dpa,jeremie frimpong,de,2023-04-20T21:20:28Z
fur marcel sabitzer manchester united traum europa league titel sechsfachen rekordgewinner sevilla geplatzt spaten gegentore heimhinspiel rachten donnerstag ebenso zwei peinliche schnitzer englander unterlagen mussen anvisierte champions league qualifikation uber premier league schaffen sevillas halbfinalgegner mai juventus turin hurde sporting lissabon nahm bayerleverkusen fuhrte brussel dank traumstart diaby spater bakker sowie liess aufstieg nicht mehr nehmen zudem traf adam hlozek fur deutschen casper terho erzielte ehrentor fur gastgeber,jeremie frimpong,de,2023-04-21T04:27:00Z
party fans bayerleverkusen profis diaby lukas hradecky wirtz karim bellarabi hincapie tah vortanzer torschutze kollegen feiern halbfinal einzug vorne hinten uberall gleichzeitig reagierte cool nutzte chance note andrich starker auftritt emotionalen leaders werkself langst nominierung nationalelf verdient hatte merkte sekunde lust nacht hatte note amiri anstelle angeschlagenen palacios beginnen wurde uberraschte viele wohl belgier offensive wenig akzente dafur enormer einsatz fur mannschaft note bakker monster spiel niederlanders volley abnahme setzte union keeper moris derart druck ball auflegte leitete bakker ein mehr geht nicht bester auftritt bayerleverkusen trikot weltklasse note diaby franzose schoss schnellste europa league tor saison entstehung zweiten vierten treffers entscheidend beteiligt note adli fur reichte franzosen zumindest fur joker einsatz kurz schluss gute schusschance note sardar azmoun fur hlozek iraner nachspielzeit zwei gute moglichkeiten vergab jedoch beide note,jeremie frimpong,de,2023-04-21T07:56:02Z
bayerleverkusen metamorphose abstiegs titelkandidaten,jeremie frimpong,de,2023-04-21T08:50:46Z
gegner bayerleverkusen halbfinale europaleague sich roma zeigte rotterdam mannschaft lage ist bayerleverkusen xaist einziger deutscher klub uberhaupt europapokal dabei halbfinale der xaeuropa league bundesliga klub besiegte donnerstagabend belgischen vertreter union saint gilloise hinspiel bayerleverkusen ausgegangen fur bayerleverkusen trafen diaby minute michel bakker adam hlozek fur einzige tor belgier sorgte casper terho dpa,jeremie frimpong,de,2023-04-21T09:05:10Z
alonso macht bayerleverkusen besser lernt zugleich trainernovize dazu team sekunden glucklichen umstanden fuhrung gehen wurde torschutze diaby erhielt vorlage gegnerseite konnte fussballweise alonso nicht voraussehen minute wurde leverkusener spielanlage sichtbar offensiven rollenwechseln stabilen defensiven fundament gepragt war diaby wirtz adam hlozek teilten raume bedarf belieben linken marschierte derweil bakker nieder hradecky anatomisches wunder glaubte ich weiss nicht viele lungen mann hat wahrscheinlich mehr als xazwei niederlandischen linksverteidiger bakker nachgesagt verstehe innerhalb zwei szenen fussballspiels sowohl welt kreisklasse verkorpern ferner beruchtigt fur haufiges zuspatkommen ausser euro einsatze punktspielen gekostet hat zuletzt gewisse regelmassigkeit arbeitszeiten eingekehrt fur bakkers auftreten spiel gilt wild immer noch nicht mehr wust fruher treffer blieb bakker cool vollendete meisterlich ausgespielten gegenangriff uber wirtz diaby flankengeber hlozek anteil zogerlichen union torwart anthony moris zusetzte ball fur geradewegs einschuss xabereitlegte inzwischen jedoch spieler bakker neu erfunden spieler wiederentdeckt unauffindbar kader verloren gegangen palacios amiri spieler selten erreichtes niveau getrimmt verteidiger tah ruf trainers alonso nahert rang spielers alonso bayerleverkusen semifinalwurdige leistung hradecky brussel dazu xabeitragen spektakulare trainerwechsel bayern saison nicht gerettet bereits thomas tuchel beschadigt dennoch fehlt fantasie jemand dafur verantwortung ubernehmen doch wurde spannend,jeremie frimpong,de,2023-04-21T10:02:05Z
torschutzen sich bakker feiert diaby,jeremie frimpong,de,2023-04-21T13:21:07Z
timo werner leipziger kassierten bayerleverkusen ruckschlag kampf platz championsleague nkunku leitete abschluss beste leipziger phase ein mude wirkenden leverkusener beschrankten aufs verteidigen gingen risiko werner vergab riesenchance hradecky rannte dabei anfallig fur konter sachsen belohnten fur klare uberlegenheit szoboszlai brachte leverkusener angriff fall feld amiri verwandelte elfmeterpunkt,jeremie frimpong,de,2023-04-23T17:26:22Z
bayerleverkusen trainer alonso versank jubeltraube leverkusener bank leipzigs trainer marco rose brachte pause christopher nkunku deutschlands fussballer jahres aussenbandriss vorwoche minutiges comeback gegeben leipzigs spiel wurde zielstrebiger gab wenigstens chancen eben nkunku tah parade hradecky ball letzter sekunde fussen wegschlug kurz darauf parierte hradecky kopfball willi orban eckball verpasste leverkusener konter entscheidung fur amiri elfmeterpunkt sorgte abpfiff schlug amiri uberschwanglich hand rasen,jeremie frimpong,de,2023-04-23T17:26:57Z
aktuelle nachrichten politik wirtschaft sport kultur bayerleverkusen torschutze amiri rechts jubeln treffer ebenso schlauen pragmatischen spielweise ruckt bayerleverkusen tabelle leipzig heran sachsen mussen champions league teilnahme bangen,jeremie frimpong,de,2023-04-23T17:33:57Z
bekommt gluckwunsche trainers alonso bayerleverkusen derzeit gute laune seit zwei monaten keine niederlage energie bayerleverkusen beweist leipzig alonso immer besser lauft haufen dagegen befurchtungen ulrich hartmann bayerleverkusen leverkusener zwolf pflichtspielen niederlage derzeit formstarkstes team liga duell gegangen mussten wichtigsten mittelfeldspieler wirtz verzichten jahrige sass magen darm verstimmung immerhin tribune sah zunachst aktivere leipziger mannschaft deren trainer marco rose kurz spiel dazn verraten chancen rucken suchen werde bayers supertorgefahrlicher rechtsaussensturmerverteidiger niederlandischen nationaltrainer ronald koeman wegen defensivschwachen ignoriert wird koeman sieht irgendwie gar keinen xaabwehrmann leipziger fanden trotz weitgehender uberlegenheit keine chancen rucken stattdessen platzierte bayerleverkusen hincapie minuten trockenen meter lattenschuss warnung ehe adam hlozek minute fuhrung fur gastgeber erzielte angriff uber rechts erfolgt uber diaby vorlage treffer gab rucken jubelten leverkusener xaabwehrspieler leipzig kam pause christopher nkunku fur kevin kampl sachsische spiel benotigte rheinischen dauerregen mehr vertikalitat erschwerten leverkusener allerdings dadurch weit zuruckzogen gingen leipziger balle horizontal links rechts zuruck chancen ergaben trotzdem etwa standards eckenverhaltnis lautete fur leipzig allein tor blieb ihnen xaversagt ausgerechnet breiter brust statt anfalligem rucken entschied partie funf minuten schluss fur bayerleverkusen konter beendete leipzigs dominik szoboszlai strafraum per foul gelb rote karte einbrachte bayerleverkusen elfmeter amiri minute einschoss einige statistiken gewonnen haben bringt nichts klagte leipzigs benjamin henrichs wir entscheidenden szenen nicht konsequent xagenug dfb prasident bernd neuendorf rudi voller neuer sportchef nationalelf sprechen sportausschuss bundestages uber katar wirklich drangenden fragen stellt niemand voller gelernt,jeremie frimpong,de,2023-04-23T18:00:31Z
kannst netzwelt werbefrei nutzen details abo findest hier,jeremie frimpong,de,2023-04-26T14:06:21Z
bayerleverkusen edmond tapsoba berlins sheraldo becker kampfen ball dabei schaut schweizer nicht diaby bereits funf tore bisherigen sieben bundesligaduellen union bejubeln durfte adli gehoren schnellsten spielern bundesliga braucht kurze abstande bereit sein unterstutzen nicht drauf bayerleverkusen hohe geschwindigkeit schwierig verteidigen sagte fischer team spaniers alonso derzeit formstarkste mannschaft adelte seit pflichtspielen nicht mehr verloren hat angesichts tabellenkonstellation seit heimspielen ungeschlagenen tabellendritten sechstplatzierten gast bayerleverkusen konnten gaste mehr spielanteile fur behaupten spielweise unioner zugutekame frage geduld beantwortet wobei fischer geduld nicht abwarten verwechseln mochte wenn abwartend beginnen spielen nie geholfen zweite halfte bochum abwartend sagt trainer ruckblickend vorherige heimspiel abstiegskandidaten wir tun gut daran minute aktiv sein schluss heimspiel gewinnen wollen,jeremie frimpong,de,2023-04-27T12:25:55Z
union spitzenspiel besseren chancen jedoch keinen weiteren grossen schritt richtung championsleague machen ecke hereingeschlagen kopfball brachte bakker aufs tor stellte fur frederik ronnow torwart union jedoch keine grosse herausforderung dar bemerkenswert szene trotzdem erste spiel bayerleverkusen ronnow richtig eingreifen musste minute union ebenfalls nicht sonderlich viele gelegenheiten gehabt hatte gab dahin keine tore danach nicht fur intensives tolles spiel sagte unions trainer urs fischer wir derzeit formstarkste mannschaft liga uber minuten gut mitgehalten mitgespielt union ronnow doekhi knoche leite laidouni schafer haberer thorsby juranovic khedira roussillon giesselmann siebatcheu michel beckerleverkusen hradecky kossounou tah hincapie andrich tapsoba bakker hlozek azmoun diaby adli wirtz schiedsrichter fritz zuschauer ausverkauft wirtz auch erste vielversprechende vorwartsbewegung gaste einleitete zuspiel minute verzog diaby dahin union gespielt sturmischen anfangsphase mehrere gute gelegenheiten gehabt bayers abwehrspieler odilon kossounou klarte zweimal letzter sekunde kopfball jordan fand nicht ziel mitte halfte verlor begegnung deutlich tempo union stand hinten sicher bayerleverkusen kam vorn weiterhin gut gar nicht zuge sorgte kontern mitunter fur gefahr besten chance traf diaby zuspiel bakker ball nicht richtig kurz pause rutschte aussichtsreicher position versuch weg ball anzunehmen erste begann zweite halfte recht flott diesmal mit allerdings eher halbchancen beiden seiten minute gastgeber erneut zielstrebigere mannschaft kamen meist uber linke seite nachsten dran fuhrungstreffer becker schlenzer rechten pfosten vorbei flog danach tat nahe beider tore ausserst wenig,jeremie frimpong,de,2023-04-29T15:32:17Z
