data,player,language,publishedAt
aktuelle nachrichten politik wirtschaft sport kultur gegensatz leverkusenern daran vermochte ruckkehr nationalspieler super talent wirtz nichts andern jahrige magen darm probleme uberwunden robuste korperliche union defensive tat zunachst schwer bayers gefahrlichste szene leitete bemerkenswerterweise ehemalige unioner andrich balleroberung berliner halfte ein schuss ging druber zweidrittel ballbesitz nutzten leverkusenern halbzeit nichts blieben harmlos bisschen verzogerung initiierten gastgeber jahr schalke koln vfl bochum daheim gespielt hatten zumindest kurzzeitige ahnliche drangphase pause spielbeginn aissa laidouni becker trafen nicht zwischendurch frederik ronnow unioner tor retten mussen dichte verteidigung berliner kam bayerleverkusen elf trotz passquote phasenweise prozent einfach kaum durch mehr thema,moussa diaby,de,2023-04-29T15:37:38Z
applaus nullnummer alten forsterei,moussa diaby,de,2023-04-29T15:59:43Z
kaum durchkommen bayerleverkusen wirtz links verzweifelt samstag defensive union berlin die wissen meter richtig einzuschatzen erforderlich wurden interventionen unioner partie entzundeten kaum begonnen hatte funf minuten hielt sheraldo becker metern drauf lukas hradecky keine grosseren muhen hernach verteidiger kouakou kossonou zwei grosserer not stelle vereitelte chance beckers minute jordan siebatcheu extremis parat fruchteten justierungen alonsos ubernahm bayerleverkusen grossere kontrolle uber partie fand ausdruck blitzkonter wirtz ball ablegte franzose verfehlte das xaziel rest partie grosserem ballbesitz leverkusener taktik gepragt zahen verteidigungshaltung unioner leverkusener versuchten unentwegt gegner zurechtzulegen immer verlagerten spiel geriet ums steril einfach schwer hier stadion durchzukombinieren wissen meter richtig einzuschatzen klagte deutsche nationalspieler wirtz immer versuchte individuelle kreativitat loch defensive sieb kopenicker reissen durchschlagenden xaerfolg,moussa diaby,de,2023-04-29T18:35:16Z
ganz entspannt fruhstuck amsterdam bayerleverkusen trainer alonso zuletzt berlin gelb gesperrte amiri dabei amiri held hinspiel sieg mungersdorf kurz einwechselung traf per freistoss bayerleverkusen drehte partie anschliessend komplett,moussa diaby,de,2023-05-01T16:20:02Z
doppelpacker matchwinner bayerleverkusen davie selke,moussa diaby,de,2023-05-05T20:28:33Z
haben keine zukunft paris neymar messi heisse psg kandidaten fur sommer neapels super sturmer victor osimhen bayerleverkusen star,moussa diaby,de,2023-05-05T10:22:34Z
aktuelle nachrichten politik wirtschaft sport kultur,moussa diaby,de,2023-05-27T16:30:22Z
inmitten tausender gluckseliger fans bochumer stadion konnten trainer thomas letsch helden kaum umarmungen retten klassenerhalt vfl bochum fussball bundesliga europacup aspiranten bayerleverkusen sorgte ruhrgebietsstadt fur grosse emotionen,moussa diaby,de,2023-05-27T16:03:12Z
inmitten tausender gluckseliger fans bochumer stadion konnten trainer thomas letsch helden kaum umarmungen retten klassenerhalt vfl bochum fussball bundesliga europacup aspiranten bayerleverkusen sorgte ruhrgebietsstadt fur grosse emotionen was mannschaft verein stadt ausgezeichnet hat immer aufgestanden dran geglaubt spieltag sein heimspiel volle hutte sagte thomas letsch kleine ewigkeit nachdem trubel entronnen war,moussa diaby,de,2023-05-27T16:03:12Z
kampf platz vfl fernduell bayerleverkusen konnte saison tatsachlich eigentor fur klarheit sorgen wolfsburger bayerleverkusen bayerleverkusen fuhrung gebracht andrich traf schliesslich wolfsburger ausgleich eigene netz maximilian arnold liess per strafstoss folgen frimpong sorgte oktober fur endstand samstag rolle spielen konnte hie,moussa diaby,de,2023-05-22T12:15:46Z
daniel farke fuhlte unruhigen woche hektischen sonntags moralischer sieger chapeau total zufrieden leistung verdienter punktgewinn sagte trainer borussia monchengladbach dazn bayerleverkusen,moussa diaby,de,2023-05-21T19:53:27Z
mittag geruchte uber beschlossenes trainer daniel farke abend erfolgreiche aufholjagd dank zweier skurriler tor geschenke borussia monchengladbach unruhige woche nicht mehr fur moglichen gehaltenen punkt rheinischen duell bayerleverkusen beendet zunachst entwischte adli schonem pass hincapie marvin friedrich tunnelte links torhuter jan olschowsky verletzten jonas omlin vertrat zweiten treffer machte jahrige zumindest ungluckliche figur demirbay flanke frimpong kurzester distanz einkopfte dritten chance gastgeber insgesamt unspektakularen halbzeit olschowsky stelle parierte schuss adli spitzem winkel zweiten versuch setzte weit druber gladbach kam dank gegnerischer hilfe uberhaupt chance bayerleverkusen keeper lukas hradecky schuss hofmann zweimal nachfassen,moussa diaby,de,2023-05-21T19:46:28Z
aktuelle nachrichten politik wirtschaft sport kultur einsetzendem platzregen versuchte dreierkette agierende borussia farke weltmeister christoph kramer genesenen topsturmer marcus thuram vertraute folge mehr spielanteile ubernehmen einzig nationalspieler hofmann stellte bayerleverkusen torwart lukas hradecky ernsthafte probleme gegenseite vergab vorentscheidung klaglich abpraller schoss franzose uber leere tor wenig spater kassierte demirbay funfte gelbe karte mehr thema beide teams drangten nachste tor besten moglichkeiten vergaben hincapie postwendend stindl ausgleich fuss traf noch nachdem amiri ball hradecky spielen wollte thuram eigenen tor fuss gespielt hatte konnen rechte artikel erwerben,moussa diaby,de,2023-05-21T19:39:14Z
daniel farke fuhlte unruhigen woche hektischen sonntags moralischer sieger chapeau total zufrieden leistung verdienter punktgewinn sagte trainer borussia monchengladbach dazn bayerleverkusen,moussa diaby,de,2023-05-21T19:28:06Z
bayerleverkusen frimpong gladbachs netz schenkten nichts gegenseite vergab vorentscheidung klaglich abpraller schoss franzose uber leere tor wenig spater kassierte demirbay funfte gelbe karte unverandert kamen beide mannschaften kabine unverandert blieb zunachst partie bayerleverkusen stand defensiv kompakt gladbach blieb ideenlos machte bayerleverkusen spannend bakker brachte hradecky ruckpass bedrangnis hofmann luchste ball schob aufs freie tor ein beide teams drangten nachste tor besten moglichkeiten vergaben hincapie postwendend stindl ausgleich fuss traf noch amiri letzten minute ball unbedrangt fusse thuram spielte ausgleichstorschutzen ablegte,moussa diaby,de,2023-05-21T19:26:11Z
lars stindl letzten partien fur gladbach jubeln kerim demirbay neun spielen gladbach sechs treffern beteiligt drei tore dei assists fohlen schoss bundesliga drei tore amiri traf borussia funf oft keinen verein gewann sechs bundesliga spiele fohlen dabei funf toren beteiligt ein treffer vier torvorlagen,moussa diaby,de,2023-05-20T05:00:50Z
bayerleverkusen kader stosst destruktive romer grenzen erfahrung werkself vergangenen wochen haufig gemacht hat verteidigt gegner kompakt stellt gar massiert hinten rein fehlen werkzeuge bollwerk nachhaltig auseinanderzuschrauben herausragende hochstgeschwindigkeitsfussballer frimpong gegner leicht ausgebremst offensivspiel entscheidende facette fehlt phase saison viele mannschaften bayerleverkusen exzellentes konterspiel taktische disziplin konsequentes defensivdenken mehr weniger eliminieren fehlt durchschlagskraft prasenz strafraum wolfsburg union berlin pause koln hinspiel rom bayerleverkusen ernuchternde erfahrung machen,moussa diaby,de,2023-05-19T10:35:21Z
wirtz mitte bringt stimmungslage bayerleverkusen roma perfekt ausdruck defensiv orientierten gegner bayerleverkusen erwartet hinspiel roma offensiv aufs kontern beschrankt halbzeit bearbeiteten leverkusener geduldigem passspiel gegnerischen stellungen angeordnet eisernen funfer abwehrkette plus vorgelagerter dreier reihe schufen passable gelegenheiten fur schusse strafraumgrenze demirbay versuchte immer wieder kontersituationen bayerleverkusen spezialitat liessen romer nicht nahezu einzigen ausnahmefall traf latte minute wir konzentration gespielt gut vorbereitet kompetitiv lobte alonso xaspater bayerleverkusen wenig geboten das letzte bisschen vermissen lassen sagte rolfes durchsetzungskraft mourinhos eiserne festung sprengen konnen sardar azmoun alonso notgedrungen fachfremden angreifer strafraumzentrum platziert nie wurde seit monaten verletzte torjager patrik schick vermisst diesmal bayerleverkusen elf stuck brav konnte fur abgezockte roma annahme beiden spielen bestatigt schlusselspielern wirtz frimpong geistige frische fehlte uberraschendes xazaubern mourinho blieb dennoch hut sorge bayerleverkusen womoglich lucke fur schusse halbdistanz finden konnte knupfte coach zweiten halfte abwehrreihen dichter brachte mittelfeldspieler wijnaldum fur angreifer belotti erteilte schliesslich vermuten order offenen nervenkrieg gegnerischen rhythmus brechen negative emotionen wecken schauspieleinlagen zeit zerrinnen lassen all stand mutmasslich der xataktiktafel bayerleverkusen trainer alonso versucht spieler anzutreiben kontrahent mourinho beobachtet ruhe mannes sechstes europacup finale ist,moussa diaby,de,2023-05-19T09:15:11Z
star trainer mourinho ruhrte roma halbfinal ruckspiel zement bayerleverkusen biss daran zahne aus endspiel europaleague wartet sevilla juventus verlangerung besiegte uber zuschauern ausverkauften bayarena dominierte werkself patrick pentz bank sass uber gesamte erste halfte hinweg spiel beste gelegenheit fand vor ball spitzem winkel rechte lattenkreuz knallte roma setzte offensiv gar keine akzente beschrankte ausschliesslich verteidigen konnte vorsprung hinspiel pause retten zweite spielabschnitt gestaltete zunachst ahnlich erste bayerleverkusen verpasste weiterhin klare uberlegenheit tore umzumunzen demirbay scheiterte distanzschuss roma tormann rui patricio sardar azmoun verfehlte hereingabe hauchzart brachte roma unentschieden kompakten defensivleistung uber zeit sevilla verbuchten beide teams spielabschnitt vielzahl chancen lucas ocampos per kopf marcos acuna vergaben fur uberlegende heimteam aussichtsreiche gelegenheiten juventus wurde fast ausschliesslich umschaltspiel gefahrlich angel maria verfehlte gehause leichtfertig per lupfer moise keane scheiterte aluminium kurz pausenpfiff sorgte nicht gegebener elfmeter fur aufregung juan cuadrado gegenspieler oliver torres linie strafraums falle brachte seitenwechsel dominierte sevilla intensiv gefuhrte partie erste treffer fiel gegenseite dusan vlahovic chippte ball kurz einwechslung uber schlussmann yassine bounou tor fuhrung gaste wahrte nicht lange ebenfalls eingewechselte suso brachte rekordsieger sehenswerten distanzschuss zuruck spiel schlussphase rettete juve tormann wojciech szczesny team starken paraden verlangerung,moussa diaby,de,2023-05-19T07:28:00Z
bayerleverkusen muht ausschliesslich verteidigende romer vergeblich verpasst finale europaleague danach frust gross team bemuht erhoffte fruhe tor vorzulegen versuche demirbay eher harmlos traf schonem pass wirtz spitzem winkel latte spielfeld rand durchlebte alonso spiel intensiv mit lief dirigierte wild lautstark dagegen verspruhte mourinho wenige meter links demonstrativ gelassenheit meist handen taschen bewegte wenige meter links rechts pause torschusse prozent ballbesitz statistische zeugen leverkusener dominanz ausser diabys lattenkracher meisten torchancen schusse distanz mehr weniger gefahr verspruhten fur grosste aufregung sorgte szene minute romas abwehrspieler bryan cristante letzter mann sardar azmoun arm zog leverkusener forderten rote karte schiedsrichter slavko vincic slowenien liess weiterspielen direkt pause sorgten bayerleverkusen fans pyro show wegen rauchentwicklung fur knapp zweiminutige spielunterbrechung mourinho halbzeit derweil nochmal defensiv gewechselt gelang gasten immer erfolgreicher kleinen nickligkeiten spielfluss unterbrechen leverkusener wurden angesichts davonlaufenden zeit immer hektischer azmoun vergab grosse chance dpa,moussa diaby,de,2023-05-19T07:07:49Z
mourinho mourinhos erster fuhrte alonso startrainer rom trostete herzlichen umarmung ehemaligen spieler rannte erhobener siegerfaust kurve ruttelte ausgelassen fangzaun romischen abwehr bollwerk meister taktiker mourinho bayerleverkusen bayerleverkusen traum europa league triumph zerplatzt halbfinal ruckspiel rannte fussball bundesligist leidenschaftlich beherzt erfolglos schied aus hinspiel bayerleverkusen vorwoche verloren team bemuht erhoffte fruhe tor vorzulegen versuche demirbay eher harmlos traf schonem pass wirtz spitzem winkel latte spielfeld rand durchlebte alonso spiel intensiv mit lief dirigierte wild lautstark dagegen verspruhte mourinho wenige meter links demonstrativ gelassenheit meist handen taschen bewegte wenige meter links rechts pause torschusse prozent ballbesitz statistische zeugen leverkusener dominanz ausser diabys lattenkracher meisten torchancen schusse distanz mehr weniger gefahr verspruhten fur grosste aufregung sorgte szene minute romas abwehrspieler bryan cristante letzter mann sardar azmoun arm zog leverkusener forderten rote karte schiedsrichter slavko vincic slowenien liess weiterspielen direkt pause sorgten bayerleverkusen fans pyro show wegen rauchentwicklung fur knapp zweiminutige spielunterbrechung mourinho halbzeit derweil nochmal defensiv gewechselt gelang gasten immer erfolgreicher kleinen nickligkeiten spielfluss unterbrechen leverkusener wurden angesichts davonlaufenden zeit immer hektischer azmoun vergab grosse chance informationen spiel uefa com auf deutsch,moussa diaby,de,2023-05-19T03:41:21Z
werfen beta version kunftigen seiten meinung konnen helfen com verbessern zunachst fuhlten demirbay links vor ehe wirtz franzosen steilpass szene setzte diabys beherzter abschluss spitzem winkel knallte ans lattenkreuz gaste denen star trainer mourinho elf stadio olimpico vertraute schienen beeindruckt offensiv kamen tief stehende romer xakaum entfaltung wahrend gastgeber weitere wenngleich nicht wirklich zwingende torabschlusse herausspielten,moussa diaby,de,2023-05-18T22:05:00Z
sevilla roma bestreiten heuer finale uefa europaleague romern reichte donnerstag halbfinal ruckspiel torloses remis bayerleverkusen erfolg vorwoche endspiel einzuziehen wartet mai budapest rekordsieger sevilla hinspiel juventus turin verlangerung durchsetzte uber fans ausverkauften bayarena dominierte werkself osterreichische goalie patrick pentz bank sass uber gesamte erste halfte hinweg spiel beste gelegenheit fand vor ball spitzem winkel rechte lattenkreuz knallte roma setzte offensiv gar keine akzente beschrankte ausschliesslich verteidigen konnte vorsprung hinspiel pause retten ruckspiel bayerleverkusen steht roma dank hinspieltreffers bove konsequenter defensivarbeit finale europaleague zweite halbzeit gestaltete ahnlich erste bayerleverkusen verpasste weiterhin uberlegenheit tore umzumunzen demirbay scheiterte distanzschuss roma tormann rui patricio sardar azmoun verfehlte hereingabe hauchdunn brachten italiener unentschieden kompakten defensivleistung uber zeit red orf agenturen,moussa diaby,de,2023-05-18T22:00:06Z
aktuelle nachrichten politik wirtschaft sport kultur chancen blieben zunachst selten brillante wirtz gute ideen passe tiefe fuhrte gefahrlichsten situation spielhalfte gelang starker abschluss recht spitzem winkel latte uber kurzen ecke krachte rom hingegen verteidigte arbeitete ganz geist trainers xajose mourinho fernschuss konnten italiener nicht verhindern echte druckphase serie leverkusener chancen stadion endgultig entzunden konnen verhinderten strategie erfolgreich vielversprechend fur bayerleverkusen pause kopfball sardar azmoun iraner jedoch nicht entschlossen genug ausfuhrte,moussa diaby,de,2023-05-18T21:16:32Z
leverkusener abwehrmann tah kummert rom nicht ums verteidigen hier tammy abraham schiesst fast tor team bemuht erhoffte fruhe tor vorzulegen versuche demirbay eher harmlos traf schonem pass wirtz spitzem winkel latte spielfeld rand durchlebte alonso spiel intensiv mit lief dirigierte wild lautstark dagegen verspruhte mourinho wenige meter links demonstrativ gelassenheit meist handen taschen bewegte wenige meter links und xarechts pause torschusse prozent ballbesitz statistische zeugen leverkusener dominanz ausser diabys lattenkracher meisten torchancen schusse distanz mehr weniger gefahr verspruhten fur grosste aufregung sorgte szene minute romas abwehrspieler bryan cristante letzter mann sardar azmoun arm zog leverkusener forderten rote karte schiedsrichter slavko vincic slowenien liess recht xaweiterspielen direkt pause sorgten bayerleverkusen fans pyro show wegen rauchentwicklung fur knapp zweiminutige spielunterbrechung mourinho halbzeit derweil defensiv gewechselt gelang gasten immer erfolgreicher kleinen nickligkeiten spielfluss unterbrechen leverkusener wurden angesichts davonlaufenden zeit immer hektischer azmoun vergab grosse xachance,moussa diaby,de,2023-05-18T21:12:59Z
mourinho mourinhos erster fuhrte alonso startrainer rom trostete herzlichen umarmung ehemaligen spieler rannte erhobener siegerfaust kurve ruttelte ausgelassen fangzaun team bemuht erhoffte fruhe tor vorzulegen versuche demirbay eher harmlos traf schonem pass wirtz spitzem winkel latte spielfeld rand durchlebte alonso spiel intensiv mit lief dirigierte wild lautstark dagegen verspruhte mourinho wenige meter links demonstrativ gelassenheit meist handen taschen bewegte wenige meter links rechts pause torschusse prozent ballbesitz statistische zeugen leverkusener dominanz ausser diabys lattenkracher meisten torchancen schusse distanz mehr weniger gefahr verspruhten fur grosste aufregung sorgte szene minute romas abwehrspieler bryan cristante letzter mann sardar azmoun arm zog leverkusener forderten rote karte schiedsrichter slavko vincic slowenien liess weiterspielen direkt pause sorgten bayerleverkusen fans pyro show wegen rauchentwicklung fur knapp zweiminutige spielunterbrechung mourinho halbzeit derweil nochmal defensiv gewechselt gelang gasten immer erfolgreicher kleinen nickligkeiten spielfluss unterbrechen leverkusener wurden angesichts davonlaufenden zeit immer hektischer azmoun vergab grosse chance,moussa diaby,de,2023-05-18T21:03:28Z
immer unterbrechungen vermeintliche verletzungen diskussionen bereits halben stunde rom halbfinal ruckspiel euopa league bayerleverkusen begonnen spielfluss mitteln zerstoren erfolg team bemuht erhoffte fruhe tor vorzulegen versuche demirbay eher harmlos traf schonem pass wirtz spitzem winkel latte spielfeld rand durchlebte alonso spiel intensiv mit lief dirigierte wild lautstark dagegen verspruhte mourinho wenige meter links demonstrativ gelassenheit meist handen taschen bewegte wenige meter links rechts pause torschusse prozent ballbesitz statistische zeugen leverkusener dominanz ausser diabys lattenkracher meisten torchancen schusse distanz mehr weniger gefahr verspruhten fur grosste aufregung sorgte szene minute romas abwehrspieler bryan cristante letzter mann sardar azmoun arm zog leverkusener forderten rote karte schiedsrichter slavko vincic slowenien liess weiterspielen direkt pause sorgten bayerleverkusen fans pyro show wegen rauchentwicklung fur knapp zweiminutige spielunterbrechung mourinho halbzeit derweil defensiv gewechselt gelang gasten immer erfolgreicher kleinen nickligkeiten spielfluss unterbrechen leverkusener wurden angesichts davonlaufenden zeit immer hektischer azmoun vergab grosse chance gegner roms endspiel mai budapest sevilla juventus turin verlangerung bezwang partie minuten hinspiel geendet,moussa diaby,de,2023-05-18T21:00:51Z
einbahnstrassenfussball chance jagt chance bayerleverkusen defensives bollwerk namens rom kein einziges tor erzielt verpasst werkself finale europaleague final experte defensiv meister mourinho zieht dagegen romern endspiel ein zunachst fuhlten demirbay links vor ehe wirtz franzosen steilpass szene setzte diabys beherzter abschluss spitzem winkel knallte ans lattenkreuz gaste denen star trainer mourinho elf stadio olimpico vertraute schienen beeindruckt offensiv kam tief stehende roma kaum entfaltung wahrend gastgeber weitere wenngleich nicht wirklich zwingende torabschlusse herausspielten folge konzentrierte spielgeschehen fast ganzlich romische halfte bayerleverkusen presste hoch wusste wirtz spielwitz gefallen halbzeit fur aufwand toren belohnen wechsel aufseiten werkself rollte ball keine sekunden pause spiel direkt unterbrochen bengalos erleuchteten leverkusener fan block rauchschwaden zogen uber spielfeld etwa zwei minuten spater setzte schiedsrichter slavko vincic partie fort,moussa diaby,de,2023-05-18T21:00:20Z
tempo karte abschlussmakel julian brandt januar februar raphael guerreiro marz donyell malen april player the month potm bundesliga kommt vierten folge bvb niederlander scheint fans funf treffern vorlage vormonat uberzeugt haben malen setzte voting frimpong bayerleverkusen benjamin pavard bayern munchen timo werner leipzig sowie josha vagnoman vfb stuttgart durch vielen fehleinkauf abgeschrieben explodierten malens leistungen zuletzt vergangenen beiden bundesliga partien konnte angreifer vier scorerpunkte verbuchen tragt grossen anteil daran bvb meisterkampf bayern weiterhin offen halt belohnt potm auszeichnung inklusive spezialkarte fut wirklich stark fallt herbst fifa saison allerdings nicht aus,moussa diaby,de,2023-05-18T15:14:06Z
gewonnen bayerleverkusen zittert star trainer mourinho portugiese weiss werkself mannschaft schnellen offensivstars wirtz frimpong uberrennen kann deshalb gibt selbstbewusst auftretende mourinho deutschem boden demutig wenn halbfinale steht prozentige chance wettbewerb gewinnen sagt ich weiss nicht richtung spiel gehen wird,moussa diaby,de,2023-05-18T10:01:41Z
willkommen kollege wiedersehen alonso alsono links mourinho gemeinsamen zeiten real madrid gut kennen fiel rom auffallend herzlich aus,moussa diaby,de,2023-05-16T16:39:24Z
jahr sports kontext aktuellen fussball titels fifa team the year bundesliga kuren lassen verraten hier wer sprung geschafft hat,moussa diaby,de,2023-05-15T15:36:00Z
zwei elfmeter kein sieger vfb stuttgart bayerleverkusen ausgeglichenen partie getrennt schwaben verpassten heimspiel sonntag zuschauern wichtigen sieg abstiegskampf liegen verbleibenden beiden spieltagen fussball bundesliga tabellenplatz bayerleverkusen kassierte drei tage niederlage halbfinal hinspiel europaleague rom weiteren ruckschlag uber liga maximal conference league erreichen bayerleverkusen mehr ballbesitz offensiv keine zundenden ideen scharfe hereingabe bekam sardar azmoun fuss nicht mehr richtig heran freistoss demirbay fur edmond tapsoba schwer nehmen mehr brachte werkself nationalspieler wirtz zunachst draussen sass minuten nicht zustande aufseiten stuttgarter haute wataru endo freistehend uber ball knapp minuten spater verzog guirassy zweiten reihe deutlich verhalf bayerleverkusen palacios schwaben unfreiwillig fuhrung argentinier foulte strafraumgrenze vfb kapitan endo schiedsrichter frank willenborg entschied elfmeter guirassy trat chippte ball lassig halbhoch tormitte sturmer traf bereits zehnten bundesliga saison dritten spiel nacheinander,moussa diaby,de,2023-05-14T15:54:04Z
fabian bredlow gab kampferisch wir mental team stark genug schaffen sagte torhuter vfb stuttgart zuspitzende lage rennen klassenerhalt fussball bundesliga bayerleverkusen gehen schwaben tabellen verbleibenden zwei spieltage kommenden sonntag treten fsv mainz womoglich ruckstand zahler relegationsrang dahin gewachsen vfb sicht schlimmsten fall dritte abstieg seit schlusspfiff rheinhessen sogar besiegelt,moussa diaby,de,2023-05-14T15:51:51Z
aktuelle nachrichten politik wirtschaft sport kultur bayerleverkusen mehr ballbesitz offensiv keine zundenden ideen scharfe hereingabe bekam sardar azmoun fuss nicht mehr richtig heran freistoss demirbay fur edmond tapsoba schwer nehmen mehr brachte werkself nationalspieler wirtz zunachst draussen sass minuten nicht zustande seiten stuttgarter haute wataru endo freistehend uber ball knapp minuten spater verzog guirassy zweiten reihe deutlich mehr thema,moussa diaby,de,2023-05-14T15:32:45Z
serhou guirassy vfb stuttgart verwandelt elfmeter lukas hradecky scharfe hereingabe bekam sardar azmoun fuss nicht mehr richtig heran freistoss demirbay fur edmond tapsoba schwer nehmen mehr brachte werkself nationalspieler wirtz zunachst draussen sass minuten nicht xazustande verhalf bayerleverkusen palacios schwaben unfreiwillig fuhrung argentinier foulte strafraumgrenze vfb kapitan endo schiedsrichter frank willenborg entschied elfmeter guirassy trat chippte ball lassig halbhoch tormitte sturmer traf bereits zehnten bundesliga saison dritten spiel xanacheinander,moussa diaby,de,2023-05-14T15:31:56Z
sebastian hoeness brachte wahrsten sinne wortes punkt eine vfb stuttgart heimspiel bayerleverkusen holte trainer namlich wenig gegner auch,moussa diaby,de,2023-05-14T15:27:30Z
schiedsrichter willenborg schaute bredlows aktion genau entschied elfmeter fur bayerleverkusen beide mannschaften erkennbar ballkontrolle bedacht stuttgart angst konter laufen stand defensiv weitaus tiefer dadurch felduberlegenen leverkusener fruh fuhrung gehen konnen hereingabe kamen allerdings sardar azmoun jeremy frimpong jeweils schritt spat gegenseite schlug endo aussichtsreicher position strafraum uber ball beide mannschaften taten folge schwer chancen herauszuarbeiten unfreiwillig hilfe kam halbzeit mutigeren vfb schliesslich palacios endo strafraum foulte danach brachte alonso nationalspieler wirtz ausgleich stand stuttgarts ungestumer schlussmann bredlow pate traf strafraum edmond tapsoba faust kopf nationalspieler josha vagnoman vergab per kopf anschluss grosse chance erneuten fuhrung vfb,moussa diaby,de,2023-05-14T15:25:38Z
