data,player,language,publishedAt
trainer xabi alonso mitgereisten fans monaco glucksmoment exequiel palacios hebt tor euro highlight geht bundesliga sonntag uhr beim freiburg,exequiel palacios,de,2023-02-24T09:33:31Z
sechser droht viereinhalb monaten pause bitterer abschied leverkusen dafur erscheint verletzungspause schon lang zudem konkurrenzsituation doppelsechs seit woche voll saft stehenden exequiel palacios nadiem amiri kerem demirbay robert andrich voraussetzungen extrem schwierige fur aranguiz zumal zuletzt aufgrund personellen engpasse innenverteidigung zentral abwehrkette eingesetzte andrich kunftig mittelfeld auflaufen durfte xabi alonso vorrucken jahrigen sechs sonntag hertha bsc nicht sicher einstufen mochte,exequiel palacios,de,2023-03-03T21:35:13Z
leverkusens sechser erklart budapest spiel jungsten fortschritt bayer donnerstag achtelfinal hinspiel europa league ferencvaros budapest empfangt robert andrich fehlen exequiel palacios sah defensive mittelfeldspieler beim erfolg elfmeterschiessen monaco dritte gelbe karte gesperrt massive schwachung fur werkself doppelsechs andrich palacios zuletzt erfolgsfaktor andrich ausgerechnet ersten kurzen phase saison bayer gleichzeitig spielerisch uberzeugt erfolgreichen fussball spielt zwangspause einlegen wurmt bedingt schon argerlich irgendwann ware sperre wahrscheinlich gekommen daher lieber eventuell viertel halbfinale sorgen erklart jahrige lacheln,exequiel palacios,de,2023-03-07T11:34:39Z
"mitchel bakker mittwoch abschluss training leverkusen nicht ausgeschlossen jedoch bakker ungarn startelf steht ,,er option"" erklart alonso mittelfeld doppel sechs verzichten robert andrich exequiel palacios gesperrt fur stehen kerem demirbay nadiem amiri bereit jeremie frimpong budapest einsatzbereit hertha wegen muskularer probleme bereits minuten platz verlassen mussen ,,er gut trainiert fuhlt besser dabei"" erklart alonso grossen respekt ungarn ,,das guter gegner sehe niveau monaco",exequiel palacios,de,2023-03-08T14:25:18Z
,exequiel palacios,de,2023-03-09T19:36:53Z
warum sehe faz net nicht allerdings robert andrich argentinischen weltmeister exequiel palacios beide eigentlich gesetzten sechser gesperrt charles aranguiz zudem verletzt donnerstag machten sache zumindest ordentlich mehr thema,exequiel palacios,de,2023-03-09T19:53:46Z
spaten tor joker sven michel union berlin mitreissenden achtelfinal hinspiel europa league unentschieden gerettet chancen weiterkommen deutlich verbessert berliner taten royale union saint gilloise heimischen stadion alten forsterei erneut schwer kamen ende zuschauern schossen victor boniface minute yorbe vertessen gaste dreimal fuhrung josip juranovic robin knoche michel erzielten jeweiligen ausgleichstore fussball bundesligisten comeback qualitaten bewies,exequiel palacios,de,2023-03-09T20:01:53Z
gut fehlentscheidung sascha stegemann borussia dortmund meisterschaft kostet entscheidenden momente gab bundesliga historie mehrfach sportschau blickt zuruck,exequiel palacios,de,2023-03-09T20:18:19Z
spielen nicht gucken weit geht platz gefuhl spiel gut kontrollieren sagte nadiem amiri rtl durchhanger zweiten halfte bisschen gefahrlich geworden brachte bayer diesmal nicht wanken grossen ganzen gutes spiel gemacht erwachsen konzentriert ende durchgezogen lobte amiri kerem demirbay mittelfeldzentrum anstelle gelbgesperrten robert andrich exequiel palacios fur gewisse stabilitat balance gesorgt gerade erwachsene spielweise brauche weiss mal vogelwild geht her tut nicht gut anfallig fur gegentore,exequiel palacios,de,2023-03-09T22:03:00Z
"leverkusens trainer stellt nahende wiedersehen klub bayern munchen rotationsproblem fur erste spiel bremen gestaltet zumindest ersten blick einfacher februar hinspiel monaco niederlage mainz startelf funf positionen anderte stehen stamm sechser robert andrich exequiel palacios donnerstag gesperrt frisch fur einsatz beginn verfugung disziplinproblemen hertha bsc nicht berucksichtigte budapest nicht eingesetzte mitchel bakker links anfangsformation rutschen konnte mittelsturmer patrik schick sieht trainer ,,er braucht vielleicht mehr zeit"" hingegen offenbar nicht bereit fur erste elf adam hlozek amine adli bieten zwei alternativen fur dreieroffensive",exequiel palacios,de,2023-03-10T17:47:41Z
heisse begegnung bremen trotz fruhen fuhrungstreffers marvin duksch gibt werder bundesliga spiel bayer leverkusen hand niclas fullkrug verkurzt kurz schluss per elfmeter tor kommt spat spiel nachlesen,exequiel palacios,de,2023-03-12T11:30:02Z
torschutzen moussa diaby amine adli feiern adlis treffer fur leverkusen exequiel palacios argentinische weltmeister katar nachsten starken spiel standig ball hinkam note mitchel bakker minute grossen torchancen niederlander liess seite nichts anbrennen flanken fehlte bisweilen prazision note,exequiel palacios,de,2023-03-17T07:01:04Z
munchner gehen verfolger liga gipfel borussia dortmund joshua kimmich brachte munchner fuhrung argentinische weltmeister exequiel palacios drehte spiel zwei verwandelten foulelfmetern schiedsrichter tobias stieler gefoulten amine adli wegen vermeintlicher schwalben jeweils zunachst gelb gegeben beide male nahm karte videostudium zuruck leverkusen dicht europacup platzen dran zuvor union berlin duell woche internationalen geschaft gescheiterten mannschaften anspruch champions league platze untermauert oberosterreicher oliver glasner trainierte frankfurter eintracht kletterten berliner nunmehr punkten dritten platz distanzierten sechsten platz liegenden hessen zahlern halten,exequiel palacios,de,2023-03-19T18:22:00Z
bayern nicht mehr tabellenfuhrer fussball bundesliga leverkusen liegt schiedsrichter tobias stieler zweimal komplett daneben zweimal videoassistenten korrigiert zweimal jubelt bayer kurz darauf fur munchner dritte pleite saison leverkusen drehte spiel exequiel palacios minute foulelfmeter verwandelte schiedsrichter tobias stieler benotigte beiden strafstossen kraftige unterstutzung video assistenten stieler gab beiden fallen amine adli zunachst gelb wegen vermeintlichen schwalbe nahm karten jeweils zuruck gravierende fehleinschatzungen leverkusen var korrektur wohl sieg gebracht leverkusen begann stark schwungvoll fcb keeper yann sommer aufmerksam direkt aufs tor gezogenen ecke kerem demirbay parierte jeremie frimpong unmittelbar davor verfehlte moussa diaby distanz knapp besser geht zeigten bayern flanke joao cancelo legte leon goretzka kimmich elf metern muhelos verwandelte gegentreffer nahm leverkusen schwung uberzeugung anfangsphase beide teams neutralisierten weitgehend,exequiel palacios,de,2023-03-19T18:28:09Z
riesenfreude bayer leverkusen schlug bayern argentinier exequiel palacios einziger aktueller weltmeister bundesliga drehte spiel zwei foulelfmetern kurios schiedsrichter tobias stieler beiden aktionen benjamin pavard dayot upamecano gefoulten amine adli wegen vermeintlicher schwalben zunachst gelb xagegeben bayer drucker bevor munchner erste chance gab weitere chancen moussa diaby jeremie frimpong palacios uberraschender jeweils ecken torschusse minuten uber prozent ballbesitz gastgeber nichts schlug serienmeister eiskalt leon goretzka legte fur kimmich schuss odilon kossounou unhaltbar latte xaabfalschte bereits kimmichs vierter saisontreffer mehr lediglich saison sechs standige gesang fans schuss tor bayern somit absolut passend standen bayern kompakter bekamen mehr spielkontrolle nahmen leverkusenern wind segeln allerdings pause weitere gelegenheit erarbeiten nagelsmann trotzdem nicht wirklich zufrieden signalisierte dreifach wechsel pause neben musiala gnabry kam kinsgley coman thomas muller sadio mane joao cancelo blieben xakabine,exequiel palacios,de,2023-03-19T18:28:23Z
sonntagspartien fussball bundesliga spieltags uberblick joshua kimmich nationalmannschaft abwesenheit manuel neuer kommenden woche kapitan anfuhren munchner fuhrung gebracht argentinier exequiel palacios einziger aktueller weltmeister bundesliga drehte spiel zwei foulelfmetern kurios schiedsrichter tobias stieler beiden aktionen benjamin pavard dayot upamecano gefoulten amine adli wegen vermeintlicher schwalben zunachst gelb gegeben beide male nahm karte videostudium zuruck beide male entschuldigte adli beide male zeigte verspatung punkt bayer europa league einziger bundesligist neben munchnern viertelfinale europacup wettbewerbs steht baute verdienten sieg serie sieben pflichtspiele niederlage dicht dran europacup platzen trainer xabi alonso team hervorragend eingestellt setzte zeichen bayern bosse ehemalige mittelfeld stratege fur bayern spielte munchen moglicher trainer zukunft beobachtet bayer drucker bevor munchner erste chance gab weitere chancen moussa diaby jeremie frimpong palacios uberraschender jeweils ecken torschusse minuten uber prozent ballbesitz gastgeber nichts schlug serienmeister eiskalt leon goretzka legte fur kimmich schuss odilon kossounou unhaltbar latte abfalschte bereits kimmichs vierter saisontreffer mehr lediglich saison sechs nagelsmann nicht wirklich zufrieden signalisierte dreifach wechsel pause neben musiala gnabry kam kinsgley coman thomas muller sadio mane joao cancelo blieben kabine tor fiel seite verstarkten bayern offensiv bemuhungen musiala verzog tollem solo doppelpass gnabry knapp folgte nachste elfmeter ruckstand druckten gaste ausgleich bayer keeper hradecky lief hochstform,exequiel palacios,de,2023-03-19T18:35:00Z
"ausgerechnet topspiel bvb patzt munchen zwei skurrile elfmeter situationen sorgen fur entscheidung kimmich nationalmannschaft abwesenheit manuel neuer kommenden woche kapitan anfuhren munchner fuhrung gebracht argentinier exequiel palacios einziger aktueller weltmeister bundesliga drehte spiel zwei foulelfmetern leverkusen hradecky kossounou andrich tapsoba frimpong fosu mensah palacios demirbay hincapie diaby tah wirtz hlozek adli bakker munchen sommer pavard stanisic upamecano ligt joao cancelo gnabry kimmich davies sane goretzka tel muller musiala mane coman schiedsrichter stieler zuschauer ausverkauft tore kimmich palacios foulelfmeter palacios foulelfmeter bayer europa league einziger bundesligist neben munchnern viertelfinale europacup wettbewerbs steht baute verdienten sieg serie sieben pflichtspiele niederlage dicht dran europacup platzen ,,wir aggressiv viele zweikampfe gewonnen"" lobte defensivspieler robert andrich trainer xabi alonso team hervorragend eingestellt setzte zeichen bayern bosse ehemalige mittelfeld stratege fur bayern spielte munchen moglicher trainer zukunft beobachtet ,,wir top energie gespielt"" lobte alonso kurioserweise bayern englische woche knochen nagelsmann wechselte trotzdem zweimal thomas muller leon goretzka ersetzten beginn serge gnabry jamal musiala",exequiel palacios,de,2023-03-19T18:38:59Z
warum sehe faz net nicht nicht ergebnis beobachter uberrascht mag seltenheitswert beiden treffer werkself zweimal zeigte schiedsrichter tobias stieler amine adli gelbe karten glaubte franzose mittels schwalben fouls strafraum vorgetauscht zweimal griff videoassistent korrigierend gab jeweils elfmeter ezequiel palacios verwandelte erstaunlichen sieg moglich machten borussia dortmund erstmals seit ende spieltages tabellenspitze steht gluck spiel ergebnis unverdient sieg fur werkself keinesfalls mannschaft xabi alonso insgesamt niveauvoll fussball gespielt wahrend bayern vielen phasen matt wirkten ersten stunde rheinlander meist ball agierten mutig ersten chancen zweikampf traf benjamin pavard fuss adli verursachte strafstoss fuhrte bevor dayot upamecano gleiche missgeschick passierte palacios zweiten elfmetertreffer schiessen konnte schlussphase uberlegenheit munchner erdruckend leverkusens torhuter lukas hradecky abwehr hielten tatsachlich stand mehr thema,exequiel palacios,de,2023-03-19T18:39:29Z
"bayern geht zwei kuriosen elfmeter entscheidungen tabellenzweiter bundesliga hit borussia dortmund april munchner verloren halbzeit fuhrung verdient bayer leverkusen punkt ruckstand bvb tag zuvor koln gewonnen joshua kimmich nationalmannschaft abwesenheit manuel neuer kommenden woche kapitan anfuhren munchner fuhrung gebracht argentinier exequiel palacios einziger aktueller weltmeister bundesliga drehte spiel zwei foulelfmetern kurios schiedsrichter tobias stieler beiden aktionen benjamin pavard dayot upamecano gefoulten amine adli wegen vermeintlicher schwalben zunachst gelb gegeben beide male nahm karte videostudium zuruck beide male entschuldigte adli beide male zeigte verspatung punkt bayer europa league einziger bundesligist neben munchnern viertelfinale europacup wettbewerbs steht baute verdienten sieg serie sieben pflichtspiele niederlage dicht dran europacup platzen trainer xabi alonso team hervorragend eingestellt setzte zeichen bayern bosse ehemalige mittelfeld stratege fur bayern spielte munchen moglicher trainer zukunft beobachtet bayer drucker bevor munchner erste chance gab weitere chancen moussa diaby jeremie frimpong palacios uberraschender jeweils ecken torschusse minuten uber prozent ballbesitz gastgeber nichts schlug serienmeister eiskalt leon goretzka legte fur kimmich schuss odilon kossounou unhaltbar latte abfalschte bereits kimmichs vierter saisontreffer mehr lediglich saison sechs standige gesang fans ,,ein schuss tor bayern"" somit absolut passend standen bayern kompakter bekamen mehr spielkontrolle nahmen leverkusenern wind segeln allerdings pause weitere gelegenheit erarbeiten",exequiel palacios,de,2023-03-19T19:02:39Z
bayern munchen tabellenfuhrung deutschen bundesliga borussia dortmund verloren rekordmeister verlor sonntag zwei kuriose elfmeter videobeweis bayer leverkusen team trainer julian nagelsmann dritten saisonniederlage punkt ruckstand dortmund samstag koln gewonnen gehen bayern verfolger duell borussia april joshua kimmich brachte munchner fuhrung argentinische weltmeister exequiel palacios drehte spiel zwei verwandelten foulelfmetern schiedsrichter tobias stieler gefoulten amine adli wegen vermeintlicher schwalben jeweils zunachst gelbe karte gegeben beide male nahm karte videostudium zuruck leverkusen dicht europacup platzen dran tabellendritter union berlin heimsieg eintracht frankfurt leipzig vorbei rang vier schob freiburg mainz tore palacios elfmeter elfmeter bzw kimmich leverkusen pentz ersatzbayern wanner,exequiel palacios,de,2023-03-19T19:14:59Z
adli verspricht schiedsrichter trikot duplizitat ereignisse leverkusen bayern zweiten halfte bot zweimal drang amine adli munchner strafraum kam fall sah zweimal gelbe karte leverkusener offensivspieler nicht gelb rot platz flog lag var team soren storks meldete namlich feld schiedsrichter tobias stieler chance bekam ursprungliche entscheidung korrigieren ende gab jeweils elfmeter fur werkself exequiel palacios beide sicher endstand verwandelte beide entscheidungen standen zwei extremen sagte stieler partie dazn weiterspielen kam fur nie betracht begrundete referee entscheidung adli wegen vermeintlichen schwalben verwarnen ersten situation sehe kontakt nicht sehe fallen total atypisch deshalb schwalbe entschieden review area erkannte stieler benjamin pavard adli hacke getreten atypische fallen ausgelost,exequiel palacios,de,2023-03-19T20:00:00Z
nix stieler lag zwei entscheidenden situationen maximal daneben zweimal referee hamburg liga sonntagsspiel bayer leverkusen bayern munchen machtig geirrt zweimal bezichtigte leverkusener amine adli schwalbe bayern strafraum zweimal verhangte fur vermeintlichen tauschungsversuch voller uberzeugung gelbe karte zweimal kleinlaut zurucknehmen entschuldigung bitten foulelfmeter fur bayer geben zweimal verwandelte exequiel palacios wurde uberraschender sieg leverkusener adli nicht nachtragend ganz gegenteil geherzt schon wahrend spiel verriet stieler trikot versprochen mal sehen ankommt,exequiel palacios,de,2023-03-19T20:01:45Z
verwenden cookies angebot fur verbessern mehr informationen finden unserer datenschutzerklarung lag einfach uberaus kuriosen art weise leverkusen spiel ruckstand sieg gedreht xadenn zweimal quasi identische szene ereignet hauptbeteiligten leverkusens offensivmann amine adli schiedsrichter tobias stieler video assistant referee var xaund exequiel palacios hauptdarsteller var festspiele leverkusens amin adli schiedsrichter tobias stieler,exequiel palacios,de,2023-03-19T20:12:00Z
xabi alonsos kniff andrich zuvor werkself guten beginn hingelegt liess ruckstand nicht hangen gegenteil wiederbeginn bayer aktiver gaste munchen drehte zwei exequiel palacios verwandelte var elfmeter partie zuschauern hexenkessel selten erlebt schwarmte hradecky unterstutzung rangen naturlich geholfen bayern nicht besten tag erwischt tag umso besser freute keeper verteilte ausdrucklich lob verdient teil sieg mittagsschlaf handy nachricht trainer heute spielst libero,exequiel palacios,de,2023-03-19T22:08:00Z
content videobeweis beitragen wurde jahrelang scheintote spannung bundesliga wiederzubeleben wer hatt gedacht genau sonntag bayarena bestaunen schreiben spielminute xatopspiel werkself xaund rekordmeister xaleverkusens xaamine adli fallt xaim strafraum xader munchner xaschiedsrichter tobias stieler wittert allerdings oscarreife schauspieleinlage zeigt fachgerecht gelb xaausgerechnet kolner keller beweist jedoch unschuld jahrigen xastieler nimmt entscheidung samt verwarnung zuruck spricht leverkusener strafstoss xaargentinische weltmeister exequiel palacios lasst nicht nehmen trifft schreiben spielminute xatopspiel werkself xaund rekordmeister xaleverkusens xaamine adli fallt xaim strafraum munchner xaschiedsrichter tobias stieler wittert allerdings oscarreife schauspieleinlage zeigt fachgerecht gelb xaausgerechnet kolner keller beweist jedoch unschuld jahrigen xastieler nimmt entscheidung samt verwarnung zuruck spricht leverkusener strafstoss xaargentinische weltmeister exequiel palacios lasst nicht nehmen trifft sorge werter leser sehen nicht doppelt genauso tatsachlich passiert zweimal vermeintliche schwalbe zweimal videobeweis zweimal elfmeter xadas vielleicht nicht gerade wunder bern zumindest mal kurios genug fur xastern xades spieltags xain dortmund durften beommeln bvb startet neue woche spitzenreiter sollten ergebnisse platzen xanoch nachlesen geht entlang kolner diesmal davon abraten,exequiel palacios,de,2023-03-20T05:11:00Z
borussia dortmund sagt schiri boss gluck entscheidung all schelte video assistenten immer langst nicht immer recht einstecken mussen bot sonntagliche spiel bayer leverkusen bayern munchen deutlichen kuriosen kontrast zweimal nahm schiedsrichter tobias stieler schwalbe amine adli strafraum bayern wahr verwarnte deshalb jeweils beide male intervenierte var soren storks jedoch vollig recht adli klar gefoult worden stieler nahm folgerichtig beiden fallen gelbe karte zuruck bat adli per handschlag entschuldigung sprach leverkusenern strafstoss exequiel palacios sicher verwandelte var hausherren partie womoglich verloren amine adli gelb rot feld verlassen mussen unparteiischen ware welle kritik entgegengeschlagen ende einverstanden leverkusener ohnehin referee ebenfalls lebensretter nannte kollegen erkennbar erleichtert interview senders dazn sogar bayern trainer julian nagelsmann hielt fest generell freund var sagte coach heute zwei elfmeter demnach sinne gerechtigkeit daher bitter fair,exequiel palacios,de,2023-03-20T05:39:04Z
bayern argert uber beiden elfmeterszenen spiel rechnerisch ungunsten bayern drehte kommentierte unisono fair beide male gute sicht daher fur relativ schnell ersichtlich beides elfmeter sagte nagelsmann beim ersten mal gleich gedacht adli ferse getroffen wurde beim zweiten mal wusste schwalbe fall nicht schiedsrichter stieler beiden fallen leverkusens amine adli zunachst gelb gegeben beide male nahm zuruck entschuldigte gab elfmeter exequiel palacios leverkusens sieg sicherte uber videobeweis gecheckt denke zweimal klar sagte torschutze joshua kimmich nagelsmann zog versohnlich strich thematik generell freund var sagte coach heute zwei elfmeter demnach sinne gerechtigkeit daher bitter fair,exequiel palacios,de,2023-03-20T05:55:43Z
"wurde video assistenten nicht geben bayern sonntag wohl leverkusen gewonnen leverkusens amine adli gelb rot gesehen endet spiel fur leverkusen stieler beiden fallen leverkusens amine adli zunachst gelb gegeben beide male nahm zuruck entschuldigte gab elfmeter exequiel palacios leverkusens sieg sicherte unparteiische nachher erleichtert ,,ich wurde gerettet spiel wurde gerettet"" sagte ,,denn zwei fehlentscheidungen stehen geblieben daher nehme heute humor ebenso sah adli stieler trikot versprach ,,heute froh var eingegriffen hat"" sagte franzose wahrend entscheidungs findung sei ,,naturlich angespannt nervos"" ,,aber einfach glucklich ersten entscheidung adli ausgetretenen schuh gezeigt anschliessend vehement rasen gepfeffert gluck nicht voreilig gelb rot sehen",exequiel palacios,de,2023-03-20T07:29:11Z
"warum sehe faz net nicht stieler beiden fallen leverkusens amine adli zunachst gelb gegeben beide male nahm zuruck bat entschuldigung gab elfmeter exequiel palacios leverkusens sieg sicherte unparteiische nachher erleichtert ,,der var immer kritisiert gut quasi lebensretter fur spiel lebensretter"" sagte ,,denn zwei fehlentscheidungen stehen geblieben daher nehme heute humor ebenso sah adli stieler trikot versprach ,,heute froh var eingegriffen hat"" sagte franzose wahrend entscheidungs findung sei ,,naturlich angespannt nervos"" ,,aber einfach glucklich ersten entscheidung adli ausgetretenen schuh gezeigt anschliessend vehement rasen gepfeffert gluck nicht voreilig gelb rot sehen",exequiel palacios,de,2023-03-20T07:48:37Z
"protest schlechter nicht altern konnen ausgerechnet leverkusener fans wahrend partie bayern grosses banner aufschrift ,,videobeweis abschaffen"" gezeigt ende grossen profiteure technischen hilfsmittel zweimal regelhuter kolner keller verantwortender position soren storks gemeldet zweimal korrigierte schiedsrichter tobias stieler entscheidung zurecht zugunsten leverkusens",exequiel palacios,de,2023-03-20T09:29:34Z
"dazn experte michael ballack gesprach julian nagelsmann moderatorin laura wontorra trainer xabi alonso weltmeister exequiel palacios ,,da sieht jungs fit marschieren drei tage spielen konnen spricht fur trainings belastung trainings steuerung gerade schweren internationalen gang draufzusetzen spricht fur leverkusener naturlich fur trainer"" schwarmte dazn experte michael ballack alonsos team",exequiel palacios,de,2023-03-20T13:16:11Z
"exequiel palacios trifft fur leverkusen bayern einzige aktuelle weltmeister bundesliga verdammt eilig beim bayern wurde palacios uberraschenden elfer helden palacios ,,ich glucklich beide tore schiessen konnte wichtiger sieg fur fans genauso mussen weitermachen trainer gesagt schiessen woche viele elfmeter trainiert freue verwandelt wusste ruhig bleiben wichtige momente druck nerven behalten kuhlen kopf bewahrt gluck gutgegangen xabi alonso gibt elfmeter schutzen exequiel palacios anweisungen warum fiel wahl plotzlich palacios trainer xabi alonso ,,wir fur europa league spielern elfmeter geubt vertrauen pala training gut gemacht letzten zwei monaten gut gespielt selbstvertrauen manchmal wichtigste elfer doppel stellte palacios klub rekord zuvor sturm idolen ulf kirsten stuttgart dimitar berbatov lautern gelungen zwei strafstosse bundesliga spiel fur bayer leverkusen verwandeln palacios gewinn erhofften schub gegeben seit wochen uberragenden form ,,wir viele spiele beinen bundesliga europa league gluck konnten viele siege einfahren"" blickt mittelfeld abraumer letzten wochen zuruck palacios ,,jetzt geht argentinien zeit freunden familie verbringen freue nationalelf bayer leverkusen uber bayern xabi alonsos meisterstuck trainer",exequiel palacios,de,2023-03-20T13:56:19Z
schalke reis nimmt spieler ausdrucklich schutz rollenverteilung klar tom krauss pflicht alleiniger sechser florian wirtz beschatten wahrend alex kral robert andrich drexler exequiel palacios kummern sollten pause wurde drexler ausgewechselt wochenlangen ausfall nicht ungewohnlich klar tank nicht komplett voll sagte drexler anschliessend fur kam eder balanta spiel trainer thomas reis hielt ursprunglichen rollenverteilung fest heisst krauss blieb alleinunterhalter sechserposition neben kral fungierte balanta achter weiterhin passe leverkusener schnellen aussenbahnspieler unterbinden,exequiel palacios,de,2023-04-03T08:12:20Z
funf scorerpunkte marz folgerichtig guerreiro wahl spieler monats potm marz bundesliga jeremie frimpong exequiel palacios beide bayer leverkusen omar marmoush vfl wolfsburg marius bulter schalke erhan masovic vfl bochum durchgesetzt viele fans aufgrund ausblicks enormes tempo eher frimpong gewunscht guerreiros potm karte ebenfalls starken grundattributen stechen dribbling pass hervor einzig physis verhindert aufnahme sogenannte gullit gang gruppe spielern deren sechs hauptwerte fut allesamt mindestens punkte betragen beim genaueren blick spezialkarte wissen vornehmlich beweglichkeit balance kurzpasse uberzeugen,exequiel palacios,de,2023-04-07T13:44:53Z
lasst gegner schlecht aussehen macht mitspieler besser leverkusens teenager florian wirtz zweiter rechts danach wirtz mehrfach knapp dran lupenreinen assist hattrick entweder verdaddelten mitspieler gute ideen kevin trapp lenkte kaum haltbaren ball adli neben pfosten wirtz gerne ubersehen schafft spiel kollegen sicherheit geben frankfurt fielen verteidiger edmond tapsoba jonathan tah erfolgreich frankfurter sturmer randal kolo muani konzentrierten torschutze adli sturmer exequiel palacios zeigten inspiriert wirtz wirbel xakonnen nicht mehr nennenswerte aspekte wirtz darbietung gab lag darum ging treffen wirkte weniger zielstrebig trapp minute weitere parade ermoglichte dennoch sah lange osterspaziergang fur werksklub frankfurter kraft vermissen liessen vergangenen saison international furchteinflossend gemacht xahatte,exequiel palacios,de,2023-04-08T19:43:08Z
