data,player,language,publishedAt
sardar azmoun belohnte bayerleverkusen fur grossen aufwand bayerleverkusen trainer alonso versuchte offensive anzukurbeln brachte fur zweite halbzeit nationalspieler wirtz anstelle tschechen adam hlozek gefahrlich wurden gaste zunachst freistoss demirbay uber tor flog traf azmoun butterweichen flanke technisch anspruchsvoll ausgleich verdient beinahe nicht lange gehalten vier minuten spater vergaben freiburger dreifache kopfball chance philipp lienhart traf dabei latte nachspielzeit vergab bayerleverkusen wiederum doppelchance schick traf latte demirbay schob vorbei,mitchel bakker,de,2023-02-26T16:29:33Z
gereizter bayern spannendsten titelkampf seit jahren meisterlich zuruckgeschlagen munchner dauer champions konterten angriff borussia dortmund bundesliga thron topspiel union berlin machtigen offensive spielfreude kronte fussball starensemble trainer julian nagelsmann sonntag zuschauern allianz arena tore eric maxim choupo moting minute kingsley coman geburtstagskind jamal musiala xain nachspielzeit halfte bayerleverkusen trainer alonso versuchte offensive anzukurbeln brachte fur zweite halbzeit nationalspieler wirtz anstelle tschechen adam hlozek gefahrlich wurden gaste zunachst freistoss demirbay uber tor flog traf azmoun butterweichen flanke technisch anspruchsvoll ausgleich verdient beinahe nicht lange gehalten vier minuten spater vergaben freiburger dreifache kopfball chance philipp lienhart traf dabei latte weiteren ergebnisse bundesliga spieltags,mitchel bakker,de,2023-02-26T16:30:00Z
vincenzo grifo gelang herrlicher freistosstreffer fuhrung fur freiburg reichte bayerleverkusen nicht bayerleverkusen trainer alonso versuchte offensive anzukurbeln brachte fur zweite halbzeit nationalspieler wirtz anstelle tschechen adam hlozek gefahrlich wurden gaste zunachst freistoss demirbay uber tor flog traf azmoun flanke technisch anspruchsvoll iraner widmete tor menschen politischen unruhen erschutterten heimat alle leute iran unterstutzen unterstutze sie gedanken immer ihnen sagte azmoun ausgleich verdient beinahe nicht lange gehalten vier minuten spater vergaben freiburger dreifache kopfball chance philipp lienhart traf dabei die xalatte,mitchel bakker,de,2023-02-26T16:32:55Z
tor zauberfuss vincenzo grifo fur freiburg wenig badener mussten bayerleverkusen begnugen champions league platz vier vorerst los grifo herrlichen freistoss treffer minute fuhrung gebracht iraner sardar azmoun erzielte summe verdienten ausgleich fur werkself bayerleverkusen trainer alonso versuchte offensive anzukurbeln brachte fur zweite halbzeit nationalspieler wirtz anstelle tschechen adam hlozek gefahrlich wurden gaste zunachst freistoss demirbay uber tor flog traf azmoun butterweichen flanke technisch anspruchsvoll ausgleich verdient beinahe nicht lange gehalten vier minuten spater vergaben freiburger dreifache kopfball chance philipp lienhart traf dabei latte,mitchel bakker,de,2023-02-26T16:35:24Z
aktuelle nachrichten politik wirtschaft sport kultur bayerleverkusen trainer alonso versuchte offensive anzukurbeln brachte fur zweite halbzeit nationalspieler wirtz anstelle tschechen adam hlozek gefahrlich wurden gaste zunachst freistoss demirbay uber tor flog traf azmoun prazisen flanke technisch anspruchsvoll ausgleich verdient beinahe nicht lange gehalten vier minuten spater vergaben freiburger grosse kopfball chance philipp lienhart traf dabei latte konnen rechte artikel erwerben,mitchel bakker,de,2023-02-26T16:41:45Z
marseille fur bayerleverkusen sturmer reserviert,mitchel bakker,de,2023-02-27T10:00:11Z
stand bayerleverkusen uber hertha bsc nicht kader lesen bildplus warum niederlander guten spielen monaco freiburg tribune sass,mitchel bakker,de,2023-03-06T13:56:57Z
bayerleverkusen linksverteidiger unsicherheitsfaktor alkmaars kerkez liste kein spieler bayerleverkusen vermag abrupt extremen her springen gute ansatze allzu oft aussetzern direkt konterkariert gilt fur linken defensivakteur mittlerweile nicht auf neben platz steht weg imago sportimage fur sieben millionen euro ablose paris germain kam bereits november treffpunkt abflug bayers usa reise verpasst zudem vorbereitungsspiel zurich dezember erheblich spat gekommen worauf schweizer anders geplant nicht einsatz kam angeblich nicht einzigen verfehlungen spielers jungsten schlafmutzigkeit tief eigene fleisch geschnitten nachdem zuvor freiburg gutes spiel abgeliefert hatte sportlich schwankende akteur kleinen statusgewinn direkt zunichte gemacht hertha bsc vertrat innenverteidiger hincapie kicker note absolut zufriedenstellend donnerstag europaleague ferencvaros budapest beginnen darf steht mehr infrage normwalerweise donnerstag dabei alonso sonntag ruckkehr modellathleten spieltagskader angekundigt grund fur bakkers fehlen nicht bekannt war physisch starken schnellen linksfuss direkt startelf zuruckzuholen ware padagogisch gruppendynamisch verkehrte zeichen jahrige voraussicht hinten anstellen mussen wird befindet somit selbstzerstorungskurs saison profitierte lange davon einzige spieler kader ist position profil her grundsatzlich ideal ausfullen konnte folglich alonso lange zeit absolut gesetzt zuletzt bereits geandert wahlte alonso aufbau viererkette fur meist kein kandidat mehr fur position links hinten blondschopf aufgrund wiederholender stellungsfehler unkonzentriertheiten zuvor ohnehin unsicherer kantonist status ausserhalb platzes zementiert zukunft ungewiss zwei vergeblichen anlaufen sommer winter bayerleverkusen nicht weitere transferperiode ungenutzt lassen linken defensivseite besser aufzustellen alkmaars ungarischer nationalspieler milos kerkez dafur mehreren kandidaten leverkusener liste gross chancen bundesligisten verpflichtung offensivverteidigers fall konkreten werbens waren angesichts langer vertragslaufzeit sowie finanzstarkerer interessenten premier league frage bakkers perspektiven bayerleverkusen jungsten faux pas trotz vertrags fall verschlechtert,mitchel bakker,de,2023-03-07T18:58:15Z
mittwoch abschluss training bayerleverkusen thema letzten tagen rund bayerleverkusen spat abschluss training bundesliga spiel hertha bsc erschienen war warf bayers trainer alonso linksverteidiger kader achtelfinal hinspiel europaleague ferencvaros budapest donnerstag uhr live rtl begnadigt alonso niederlander holt zuruck spieltagsaufgebot gegen budapest naturlich kader kundigte alonso abschluss training alonso sagt uber massnahme letzten wochenende fur nicht schwierig gibt regeln fur kader wichtig respekt gegenuber zeigen entscheidung nichts besonderes normal karriere immer erlebt bedeutet fur sommer verkaufskandidat durfte bayerleverkusen trainer macht deutlich die entscheidung keine konsequenz fur zukunft galt sonntag fur hertha spiel mitch gesprochen gesprach durfte alonso spieler klargemacht haben weitere disziplinlosigkeiten nicht duldet wenn passiert entscheidung geben meint alonso nicht ausgeschlossen jedoch ungarn startelf steht option erklart alonso mittelfeld doppel sechs verzichten muss andrich palacios gesperrt fur stehen demirbay amiri bereit frimpong budapest einsatzbereit hertha wegen muskularer probleme bereits minuten platz verlassen mussen gut trainiert fuhlt besser dabei erklart alonso grossen respekt ungarn hat das sehr guter gegner sehe niveau monaco,mitchel bakker,de,2023-03-08T14:25:18Z
bayerleverkusen trainer wiederholte verfehlung niederlanders abgehakt fur bundesligaspiel hertha bsc alonso linksverteidiger kader gestrichen spat abschlusstraining gekommen war fur ferencvaros spiel schliesst trainer ruckkehr bakkers startelf nicht aus ware riskanter zug konnte bayerleverkusen startelf zuruckkehren getty images entscheidung alonso wochenende getroffen hatte fur spanischen weltmeister relativ einfach nachdem wiederholten male keine sechs monate langen amtszeit trainers erheblicher verspatung mannschaftstermin gekommen war blieb jahrigen keine wahl niederlander denkpause verordnen fur nicht schwierig regeln fur kader wichtig respekt gegenuber zeigen nichts besonderes entscheidung treffen erklarte alonso mittwoch schliesslich massnahmen laufbahn spieler wiederholt verschiedenen trainern vorexerziert bekommen das normal karriere immer erlebt entscheidung klar betont spanier kundigte jedoch aber morgen naturlich kader comeback bakkers fur budapest spiel donnerstag trainer bereits sonntag anklingen lassen niederlandische nationalspeler allerdings kandidat fur startelf kann uberrascht trotzdem option entscheidung galt fur sonntag schliesst alonso direkte ruckkehr bakkers tribune anfangsformation namlich nicht aus ich gesprochen keine entscheidung konsequenzen fur zukunft hat passiert geben darf mehr gespannt sein trainer letztlich entscheidet startelf beordern ware padagogischer sicht riskant konnte fur ubrigen kader wankelmutige charakter steckt vollig verkehrte signal sein andererseits europaleague letzte weg verkorkste saison retten zwickmuhle fur alonso hertha bsc beispielsweise durchaus zufriedenstellende notlosung innenverteidiger hincapie linken schienenspieler wahlen konnte nominierung bakkers platz ohnehin unsicherer kantonist leistungstrager ist fur bayerleverkusen alonso gefahrlichen spiel werden,mitchel bakker,de,2023-03-08T14:37:28Z
bayerleverkusen trainer stellt nahende wiedersehen klub bayern munchen rotationsproblem fur erste spiel bremen gestaltet zumindest einfacher februar hinspiel monaco niederlage mainz startelf funf positionen anderte stehen stamm sechser andrich palacios donnerstag gesperrt waren frisch fur einsatz beginn verfugung disziplinproblemen hertha bsc nicht berucksichtigte budapest nicht eingesetzte links anfangsformation rutschen konnte mittelsturmer patrik schick sieht trainer braucht vielleicht mehr zeit hingegen offenbar nicht bereit fur erste elf adam hlozek adli bieten zwei alternativen fur dreieroffensive,mitchel bakker,de,2023-03-10T17:47:41Z
adli adam hlozek feiern dritten leverkusener treffer minute frimpong flanke fliegen gleich mehrere spieler vorbei kugel landet per dropkick knaller trifft zuvor marvin ducksch bremen fuhrung gebracht,mitchel bakker,de,2023-03-12T18:23:46Z
diaby bayerleverkusen bundesliga vormarsch zuschauern weserstadion gingen stark ersatzgeschwachten bremer halben stunde marvin ducksch fuhrung minute frimpong adam hlozek drehten partie zugunsten gaste ehe niclas fullkrug per handelfmeter endstand erzielte wir mussen spiel nicht verlieren kommentierte ducksch internet sender dazn wir hinten einfach fehler kritisierte eigene abwehr bayerleverkusen torwart lukas hradecky sagte das ganz glucklicher sieg augen tah gab werder echt schwer gemacht marvin ducksch findet wir hinten einfach fehler bremen fiel gasten konzentration liga alltag dennoch lange schwer personal arg gebeutelten gastgeber kurzfristig kranken leonardo bittencourt verzichten mussten stockte offensive anfangs gewaltig werder ubernahm zahen beginn kommando ging ducksch nicht unverdient fuhrung werder freude wehrte nicht lange drei minuten spater gelang wuchtigen schuss ausgleich,mitchel bakker,de,2023-03-12T18:29:14Z
vfl wolfsburg union berlin letzten partie spieltages deutschen bundesliga getrennt ausgleich wolfsburger fiel minute niederosterreicher patrick wimmer zwei minuten zuvor eingewechselt worden war freiburg holte hause schlusslicht hoffenheim last minute sieg punktegleich union funfter werder bremen verlor bayerleverkusen tore marvin ducksch niclas fullkrug elfmeter wenig fur zahlbares aufseiten leverkusener frimpong adam hlozek weser stadion trafen ofb teamgoalie patrick pentz sass siegern bank bremen elfter bayerleverkusen vier zahler davor neunter deutsche bundesliga runde tore ducksch fullkrug elfer bzw frimpong hlozek bremen friedl schmid beide krank bayerleverkusen pentz ersatz,mitchel bakker,de,2023-03-12T18:33:46Z
trotz riskanten gross rotation bleibt bayerleverkusen fussball bundesliga europapokal kurs beiden achtelfinalspielen europaleague ferencvaros budapest woche highlight spiel bayern munchen liga gewannen rheinlander sonntagabend werder bremen mischen kampf platz sieben fur europa conference league reichen konnte platz sechs derzeit schwachelnden frankfurter liegen sechs zahler entfernt zuschauern weserstadion gingen stark ersatzgeschwachten bremer halben stunde marvin ducksch fuhrung minute uberragende frimpong adam hlozek drehten partie zugunsten gaste ehe niclas fullkrug per handelfmeter endstand erzielte drei tage ferencvaros bayerleverkusen coach alonso team gleich funf positionen umgebaut wurde wirtz geschont jahrige stand gar nicht kader leicht angeschlagen ist das ging fur heute nicht sagte bayerleverkusen geschaftsfuhrer simon rolfes partie dazn wir vorsichtig ihm schliesslich mittelfeldspieler wegen verletzung monatelang ausgefallen bremen fiel gasten konzentration liga alltag dennoch lange schwer personal arg gebeutelten gastgeber kurzfristig kranken leonardo bittencourt verzichten mussten stockte offensive anfangs gewaltig werder ubernahm zahen beginn kommando ging ducksch nicht unverdient fuhrung werder freude wehrte nicht lange drei minuten spater gelang wuchtigen schuss flanke frimpongs ausgleich,mitchel bakker,de,2023-03-12T18:42:02Z
aktuelle nachrichten politik wirtschaft sport kultur zuschauern weserstadion gingen stark ersatzgeschwachten bremer halben stunde marvin ducksch fuhrung minute frimpong adam hlozek drehten partie zugunsten leverkusener ehe niclas fullkrug per handelfmeter endstand erzielte wir mussen spiel nicht verlieren kommentierte duksch internet sender dazn wir hinten einfach fehler kritisierte eigene abwehr bremen fiel bayerleverkusen konzentration liga alltag dennoch lange schwer personal arg gebeutelten gastgeber kurzfristig kranken leonardo bittencourt verzichten mussten stockte offensive anfangs gewaltig werder ubernahm zahen beginn kommando ging ducksch nicht unverdient fuhrung werder freude wehrte nicht lange drei minuten spater gelang wuchtigen schuss ausgleich konnen rechte artikel erwerben,mitchel bakker,de,2023-03-12T18:48:50Z
gilt konzentration mannschaft alonso derzeit europaleague dennoch feiert erfolg bremen wichtigsten spieler marvin ducksch brachte gastgeber zunachst fuhrung minute glich jedoch umgehend kurz pause trafen frimpong adam hlozek fur rheinlander anschlusstreffer verwandelten handelfmeter niclas fullkrug kam fur gastgeber spat bayerleverkusen torwart lukas hradecky anschliessend erkennbar erleichtert das ganz glucklicher sieg augen sagte xaer spanier alonso spricht uber bayern profi traineramt bayerleverkusen gemeinsamkeiten wirtz lionel messi erklart spiel wirklich mathematik verbindet,mitchel bakker,de,2023-03-12T19:25:06Z
verwenden cookies angebot fur verbessern mehr informationen finden unserer datenschutzerklarung drei minuten erzielt bremen ausgleich halt team spiel guten verlasslichen linksverteidiger finden schwer nicht seit gestern sucht bayerleverkusen spieler jahrelang beackerte wendell linke defensivseite werkself immerhin bundesligaspiele machte schnelle brasilianer fur schwarz rot championsleague europaleague seitdem wendells leistungen schwankend wurden schliesslich porto abgegeben wurde sucht bayerleverkusen nachfolger einer zeug hatte dauerhaft hinten links leverkusener stammelf etablieren ware niederlander seit sommer bayerleverkusen spielt zeigte bundesliga spieltag auswartssieg leverkusener werder bremen steckt gewann hinten fast zweikampf leitete viele offensivaktionen ein ging mutig kopfballduelle bewies abschlussqualitaten besitzt erzielte wichtige zwischenzeitliche wuchtiger direktschuss oberen kurzen torwinkel nachdem flanke linke durchgerutscht war selten prasent dominant spiel bremen herausragende mitspieler gewohnt spielte paris kylian mbappe neymar nicht ungefahr versucht bayerleverkusen grunde seit ersatzmann finden nicht leistungsschwankungen leidet niederlander jedoch scheiterte januar verpflichtung nationalspieler robin gosens horrenden abloseforderungen inter mailands kurzlich abgelaufenen transferperiode liess vfb stuttgart bayers kroatischen wunschkandidaten borna sosa nicht ziehen hinzu kommt disziplin nicht immer genau nimmt seit alonso anfang oktober trainer werkself ubernahm fiel bereits dreimal negativ auf termine verpasste zuletzt erschien wichtigen bundesliga heimspiel hertha bsc spat abschlusstraining wurde daraufhin alonso kader gestrichen bakkers vertrag bayerleverkusen lauft winter premier league klub newcastle united xamillionen euro ablose fur geboten haben regelmassig spiele bremen zeigt bayerleverkusen unersetzlich status potentieller verkaufskandidat verlieren werkself verantwortlichen wurde sicherlich freuen nicht gute leistungen meistens postwendend sportlichen erfolg bedeuten wirklich schwer ist guten verlasslichen linksverteidiger finden ruhrpott derby fussball bundesliga schalke borussia dortmund geben schalker einfach nicht auf zweimal kommen ruckstand zuruck spiel freiburg entwickelt langsam sicher spitzenmannschaft bundesliga zehn monate finalteilnahme dfb pokal breisgauer rolle aussenseiter entwachsen,mitchel bakker,de,2023-03-12T19:51:00Z
mitchell weiser bayerleverkusen kampf ball schuss lag wohl menge wut uber selbst niederlander erzielte minute wichtige knaller latte minute schoss linksverteidiger knapp linken werder winkel vorbei startelf zuruckgekommen hertha bsc spat abschlusstraining gekommen war trainer alonso kader gestrichen europaleague gehorte achtelfinal hinspiel budapest aufgebot kam nicht einsatz starke reaktion bremen sicht rolfes gutes signal hoffentlich lektion gelernt hat wichtig sachen mannschaft funktionieren letzten monaten grosse schritte vorne gemacht erfolg bremen sagte rolfes ein wichtiger sieg fur tabelle ran platz bremen schwer anfang gebraucht reinzukommen tor fur werder sogar besser getan danach aggressiver schneller verdient gemacht insgesamt verdient gefuhrt spiel verdient gewonnen zuletzt nicht einfach,mitchel bakker,de,2023-03-12T21:01:03Z
bremen kassierte meisten gegentore bochum,mitchel bakker,de,2023-03-15T14:09:00Z
wurde immer ofter harter gepruft juve torwart wojciech szczesny wuchs freiburg gemeisterten aufgabe start zweiten halbzeit forderte alonso team nochmals volle konzentration bundesligist beginn hellwach vergab grosse moglichkeit aufs schuss wurde letzten moment geblockt treffer frimpong zahlte wegen abseits nicht sardar azmoun diaby schuss pfosten liessen weitere chancen liegen obwohl bereits sonntag uhr dazn bundesliga rekordmeister bayern munchen geht bayerleverkusen unbedingt zweiten treffer nachlegen adli belohnte bemuhungen der xaschlussphase kostenlos anmelden,mitchel bakker,de,2023-03-16T20:14:34Z
einziger deutscher klub steht bayerleverkusen viertelfinale europaleague heimspiel gelingt werkself auswarts ferencvaros budapest souveraner sieg abou diaby sorgt dabei schnell fur klare verhaltnisse budapest dibusz wingo marquinhos lisztes abena knoester civic esiti vecsei zachariassen gojak manner traore mmaee baden frederiksen trainer tschertschessowleverkusen hradecky tapsoba tah hincapie kossouno frimpong fosu mensah palacios andrich demirbay diaby azmoun hlozek wirtz adli trainer alonsoschiedsrichter artur soares dias portugal tore diaby adli zuschauer gelbe karte tschertschessow trainer mai bayerleverkusen budapest zuruckkehren findet stadion ferencvaros finale statt zunachst steht viertelfinale auslosung freitag uhr zentrale europaischen fussball union uefa bayerleverkusen attraktiven gegner freuen manchester united europa league rekordsieger sevilla juventus turin ebenfalls nachste runde geschafft kurz darauf fur gefahr sorgen konnen hereingabe aussenverteidigers harmlos galt zunachst fur ungarn ball plotzlich amer gojak fusse fiel jahrige scheiterte jedoch frei bayerleverkusen tor lukas hradecky schuss latte adama traore finnische nationaltorhuter gluck start zweiten halbzeit forderte alonso team nochmals volle konzentration bundesligist beginn hellwach vergab grosse moglichkeit aufs schuss wurde letzten moment geblockt treffer frimpong zahlte wegen abseits nicht sardar azmoun diaby schuss pfosten liessen weitere chancen liegen adli belohnte bemuhungen schlussphase,mitchel bakker,de,2023-03-16T21:49:55Z
aktuelle nachrichten politik wirtschaft sport kultur kurios direkt wechsel leverkusener fast ahnliche weise erhoht fuhrung gegangen waren diesmal vierte minute zweiten halbzeit tapsoba langen ball diaby spielte gab diesmal ablegte niederlander wurde letzten moment gebremst mehr thema gaste nicht mehr passiv durchgang geschehen deutlich besser griff frimpongs tor stand abseits diaby traf pfosten adli sorgte fur erlosende konnen rechte artikel erwerben,mitchel bakker,de,2023-03-16T22:02:42Z
bayerleverkusen feiert einzug viertelfinale europaleague kurz darauf fur gefahr sorgen konnen hereingabe aussenverteidigers harmlos galt zunachst fur ungarn ball plotzlich amer gojak fusse fiel jahrige scheiterte jedoch frei bayerleverkusen tor lukas hradecky schuss latte adama traore finnische nationaltorhuter gluck start zweiten halbzeit forderte alonso team nochmals volle konzentration bundesligist beginn hellwach vergab grosse moglichkeit aufs schuss wurde letzten moment geblockt treffer frimpong zahlte wegen abseits nicht sardar azmoun diaby schuss pfosten liessen weitere chancen liegen obwohl bereits sonntag uhr dazn bundesliga rekordmeister bayern munchen geht bayerleverkusen unbedingt zweiten treffer nachlegen adli belohnte bemuhungen schlussphase,mitchel bakker,de,2023-03-16T22:08:33Z
europareise union berlin lotto park anderlecht ungluckliches genommen royale union saint gilloise verpasste bundesligist historischen einzug viertelfinale europaleague belgier muden berlinern seit funf spielen sieg sind klar uberlegen kurios direkt wechsel leverkusener fast ahnliche weise erhoht fuhrung gegangen waren diesmal vierte minute zweiten halbzeit tapsoba langen ball diaby spielte gab diesmal ablegte niederlander wurde letzten moment gebremst gaste nicht mehr passiv durchgang geschehen deutlich besser griff frimpongs tor stand abseits diaby traf pfosten adli sorgte fur erlosende,mitchel bakker,de,2023-03-16T22:14:32Z
torschutzen sich diaby adli feiern adlis treffer fur bayerleverkusen frimpong niederlander wahnte kurz pause torschutze passgeber stand davor deutlich abseits frimpong wirkte nicht spritzig gewohnt note palacios argentinische weltmeister katar nachsten starken spiel standig ball hinkam note minute grossen torchancen niederlander liess nichts anbrennen flanken fehlte bisweilen prazision note wirtz nicht ganz auffallig sonst trotzdem guten szenen minute pass kurz pause torschuss note,mitchel bakker,de,2023-03-17T07:01:04Z
aktuelle nachrichten politik wirtschaft sport kultur sieg bayern bayerleverkusen zuzutrauen wirtz kreuzbandriss viele genialen balle gegnerische strafraume spielt diaby formkrise aufbluht frimpong starksten flugelspieler liga avanciert sardar azmoun genau fahrt kommt torhuter lukas hradecky immer weniger fehler macht mehr thema,mitchel bakker,de,2023-03-19T13:48:37Z
gut sein fehlentscheidung sascha stegemann borussia dortmund meisterschaft kostet entscheidenden momente gab bundesliga historie mehrfach sportschau blickt zuruck,mitchel bakker,de,2023-03-19T20:35:24Z
wirtz leverkusener abschluss training spiel saint gilloise wirtz jedoch nicht einzige spieler bayerleverkusen kader sperre internationalen buhne droht odilon kossounou demirbay zwei gelben karten vorbelastet verwarnungen championsleague konto,mitchel bakker,de,2023-04-13T07:31:14Z
kleine happy end grossen abnutzungskampf bayerleverkusen fur optimismus gesorgt das ticket fur halbfinale gibt nicht for free sagte trainer alonso viertelfinal hinspiel europaleague union saint gilloise aber chancen kopf mehr grossen wunsch fur ruckspiel bleiben optimistisch,mitchel bakker,de,2023-04-13T18:25:08Z
morgenpost sportstubchen,mitchel bakker,de,2023-04-13T18:33:39Z
hincapie tah bedanken fur fan unterstutzung einziger neuer spieler startelf niederlander brauchte anlaufzeit steigerte zweiten halfte deutlich top flanken frimpong azmoun plus tore verdient note adli vorlage diaby kurz pause beste szene diesmal allerdings eigene gefahrliche offensiv aktion note sardar azmoun fur adli vier minuten einwechslung schien spiel fur vorbei iraner offenbar vertreten zentralen sturmer anderte statik bayerleverkusen wurde immer gefahrlicher starke vorlage wirtz sekunden schluss fehlten zentimeter bakkers flanke note adam hlozek fur diaby note,mitchel bakker,de,2023-04-14T08:16:22Z
verwenden cookies angebot fur verbessern mehr informationen finden unserer datenschutzerklarung gut moglich werksklub sommer erneut versucht schliesslich position links hinten team alonso alonsos daley sinkgraven derzeit nicht herausragend besetzt gibt angebote ausland real sociedad sevilla spanien tottenham hotspur englischen premier league sollen interesse bekundet haben sosa kroatiens hauptstadt zagreb geboren enge verbindungen deutschland besitzt seit zeit neben kroatischen deutsche staatsburgerschaft grossvater einst jugoslawien deutschland ausgewandert ulm sudostlich stuttgart gezogen sosas mutter geboren spater zuruck kroatien gegangen kind borna sosa oft deutschland grosseltern,mitchel bakker,de,2023-04-15T16:09:00Z
aktuelle nachrichten politik wirtschaft sport kultur obwohl bundesliga geht schont trainer alonso regelmassig wochenenden wichtige spieler internationalem terrain moglichst starke leistungen wahrscheinlicher machen zuletzt folgte strategie wolfsburg sonntag sassen tah adli wirtz vier spieler bank wirklich wichtigen partien meist startelf zahlen finden derzeit eben europaleague statt schliesslich konnen gewinn titels gleich zwei ziele erreicht werden erfolg fur fussball ewigkeit qualifikation fur kommende champions league spielrunde zentraler bedeutung fur mittelfristige entwicklung klubs ist wir superchance sagt alonso aussichten viertelfinalhinspiel belgier,mitchel bakker,de,2023-04-20T15:41:59Z
