data,player,language,publishedAt
"bayer leverkusen se clasifico a los cuartos de final de la europa league. el elenco del ecuatoriano piero hincapie supero al ferencvaros de hungria, este de marzo del .\n en la serie global, bayer leverkusen gano -. de esa manera avanzo de ronda en la europa league.\n este de marzo, los alemanes ganaron - en su visita al ferencvaros torna club\ub en la puskas arena park.\n el - fue el mismo marcador de la ida. en ambos cotejos fue titular el ecuatoriano piero hincapie.\n bayer leverkusen amplio su ventaja y al final se impuso - al ferencvaros en el global.\n el ecuatoriano piero hincapie empezo como titular. tuvo un encuentro destacado y fue sustituido en la parte de complemento, a los ' por odilon kossounou.\n los goles del triunfo del bayer los hicieron moussa diaby (') y amine adli\xa(').\n el\xatanto inaugural del compromiso cayo durante los primeros minutos y le permitio establecer su estilo y ser aun mas dominante. de por si, el resultado del choque previo ya le permitia jugar con tranquilidad e, inclusive, clasificar con una derrota.\xamoussa diaby\xafue el encargado de poner la primera para el leverkusen. despues de una incursion inicial del ferenvaros, los visitantes recuperaron el balon y se lanzaron en contragolper por buscar el gol.el delantero frances gano en\xavelocidad\xay no tuvo problemas. ante la salida del arquero como ultimo hombre para impedir la anotacion, este definio sin dificultades.\n dentro del segundo tiempo, el equipo aleman fue el que mas cerca estuvo del gol. en la ultima parte del compromiso, el tanto definitivo cayo como\xaamine adli.despues de una llegada por la banda y un\xacentro, el jugador tan solo tuvo que empujar la pelota. luego de que su companero convirtio, piero hincapie abandono la cancha.\n el partido de ida de los ocatvos de final de la uefa europa league fue fructifero para el\xabayer leverkusen y piero hincapie, tras la victoria de - ante el ferencvaros de hungria.\n los aficionados no debieron esperar demasiado para que llegase el primer tanto de su escuadra. a los nueve minutos que se haya iniciado el compromiso, el elenco dirigido por\xaxabi alonso\xase puso por encimad del marcador.\n piero hincapie\xaincidio y fue uno de los gestores para que caiga el primer tanto. como si fuera un mediocampista de recuperacion, el tricolor aprovecho una mala salida del arquero rival y gano metros con la pelota dominada.\xadesde fuera del area, el defensor se animo a probar suerte, pero su remate impacto en un contrario. despues del rebote, la jugada se rearmo y esta vez le quedo a\xakerim demiray.\xael volante aleman no desperdicio su chance y saco un\xaderechazo\xaimposible para el arquero. desde el borde del area, su tiro tuvo potencia y colocacion.el - definitivo llego en el ocaso del segundo tiempo. fue una jugada similar a la que devino en la primera anotacion, aunque este se origino desde un\xatiro libre.\xaadam hlozek\xaejecuto el lanzamiento. este impacto en el vertical y la pelota quedo dividida en el area. el defensa edmond tapsoda la peco y anoto su nombre en el marcador.\n ",piero hincapi,es,2023-03-16T22:00:13Z
"el volante junior sornoza, del independiente del valle, se constituyo en la mayor novedad del llamado para la expedicion a australia. no fue tomado en cuenta durante todo el proceso del tecnico argentino gustavo alfaro, pese a su gran desempeno con el club y a la insistencia de los hinchas.\n sanchez revelo la lista apenas tres dias despues de asumir como seleccionador de ecuador, en medio de un ambiente de gran expectativa. sanchez fue el entrenador de la anfitriona qatar en el reciente mundial.\n en la convocatoria constan nombres como moises caicedo, mediocentro del brighton ingles; y piero hincapie, zaguero del bayer leverkusen, de alemania; y angelo preciado, lateral derecho del genk de belgica; tambien van pervis estupinan, lateral izquierdo del brighton ingles; y gonzalo plata, atacante del valladolid de espana.\n sanchez incluyo a goleador enner valencia, el goleador historico que actualmente juega con el turco fenerbache. valencia viene de marcar tres tantos en un mundial en el que ecuador quedo fuera tras la primera ronda.\n en la primera fecha de la fifa de este ano, ecuador se medira con los australianos en sydney, el de marzo, y cuatro dias mas tarde jugara la revancha, en melbourne.\n sanchez ya viajo a ese pais y tiene previsto reunirse alla con los convocados.\n ",piero hincapi,es,2023-03-16T21:40:46Z
"en la convocatoria del dt felix sanchez resaltan junior sornoza y alexander alvarado, habilidosos volantes tricolores que no fueron parte de la seleccion de ecuador que jugo el mundial qatar .\n el 'zorro' sornoza tendra otra oportunidad en esta\xanueva etapa\xade la tri. la ultima vez que habia sido convocado por ecuador fue en la fecha fifa de septiembre de .desde aquella convocatoria pasaron un ano y medio ( dias), y un mundial incluido, para que junior sornoza\xavuelva a ser considerado\xacon la seleccion de ecuador.\n el '' de independiente del valle fue el mejor futbolista ecuatoriano en sudamerica en . pese a eso,\xagustavo alfaro, en ese entonces dt de ecuador, decidio no contar con el para el mundial qatar .solo en la temporada pasada, junior sornoza disputo partidos entre cuatro competiciones distintas. ademas,\xagano la copa sudamericana\xay la copa ecuador.en cuanto a numeros se refiere, el manabita\xaconvirtio goles\xay asistio veces en poco mas de minutos.mientras que, en esta temporada, la , junior sornoza sigue a muy buen nivel y apenas tres meses ya cosecho otros dos titulos, que fueron la supercopa ecuador y la\xarecopa sudamericana.sus numeros por el momento son de un gol y dos asistencias en cuatro partidos. felix sanchez lo ha tomado en cuenta para los amistosos ante australia, el y el de marzo del .\n otro de los nombres que sorprendieron en la lista de felix sanchez fue el de\xaalexander alvarado,\xajugador de liga de quito.el '' de los albos fue el mejor jugador de su equipo en la campana pasada y en la presente sigue siendo la\xaprincipal figura.alvarado tuvo pocas oportunidades de mostrarse en la era gustavo alfaro, quien solo lo convoco para unos amistosos previos al mundial, y solo sumo cuatro minutos.\n alexander dominguez (liga de quito)hernan galindez (aucas)moises ramirez (independiente del valle)\ub\n angelo preciado (genk)jose hurtado (red bull bragantino)felix torres (santos laguna)piero hincapie (bayer leverkusen)william pacho (royal antwerp)pervis estupinan (brighton & hove albion)diego palacios (la fc)xavier arreaga (seattle sounders)\ub\n carlos gruezo (san jose earthquakes)jhegson mendez (sao paulo)moises caicedo (brighton & hove albion)alan franco (talleres de cordoba)jose cifuentes (la fc)angel mena (leon)junior sornoza\xa(independiente del valle)alexander alvarado\xa(liga de quito)gonzalo plata (valladolid)jeremy sarmiento (brighton & hove albion)\ub\n michael estrada (cruz azul)enner valencia (fenerbahce)kevin rodriguez\xa(independiente del valle)\n ",piero hincapi,es,2023-03-16T21:29:35Z
"ecuador medira fuerzas con australia el y de marzo en las ciudades de sydney y melbourne, en lo que sera el estreno del estratega espanol al frente de la ""tri"".\n sanchez asumio la direccion del combinado ecuatoriano la semana pasada. reemplazara al estratega argentino gustavo alfaro, que logro la cuarta clasificacion de ecuador a una cita mundialista.\n entre las novedades de la convocatoria esta el retorno del mediocampista junior sornoza del independiente del valle, que se corono campeon de la recopa sudamericana en febrero.\n el timonel espanol, ex dt de catar, tambien incluyo entre los nombres al mediocampista de liga de quito, alexander alvarado, y al defensa jose hurtado del red bull bragantino.\n el ataque de la tricolor estara a cargo de enner valencia, el maximo goleador de la seleccion ecuatoriana y que pasa por un gran momento en su equipo, el fenerbahce de turquia.\n en la delantera tambien estaran michael estrada del cruz azul de mexico y el joven kevin rodriguez, quien debuto en la seleccion mayor en catar, de la mano de alfaro.\n el atacante djorkaeff reasco quedo fuera de la lista.\n a continuacion la lista de convocados:\n alexander dominguez (liga de quito), hernan galindez (aucas) y moises ramirez (independiente del valle).\n defensas: angelo preciado (genk, belgica), jose hurtado (red bull bragantino, brasil), felix torres (santos laguna, mexico), piero hincapie (bayer leverkusen, alemania), william pacho (antwerp, belgica), pervis estupinan (brighton, inglaterra), diego palacios (los angeles fc, eeuu) y xavier arreaga (seattle sounders, eeuu).\n volantes: carlos gruezo (san jose earthquakes, eeuu), jhegson mendez (sao paulo, brasil), moises caicedo (brighton, inglaterra), alan franco (talleres, argentina), jose cifuentes (los angeles fc, eeuu), angel mena (leon, mexico), junior sornoza (independiente del valle), alexander alvarado (liga de quito), gonzalo plata (real valladolid, espana) y jeremy sarmiento (brighton, inglaterra).\n delanteros: michael estrada (cruz azul, mexico), enner valencia (fenerbahce, turquia) y kevin rodriguez (independiente del valle).\n pld/cl\n ",piero hincapi,es,2023-03-16T21:20:37Z
"nombres como el de junior sornoza o alexander alvarado figuran en la convocatoria de la seleccion de ecuador presentada por el dt felix sanchez este de marzo del .\n el espanol felix sanchez fue presentado esta semana como nuevo entrenador de ecuador, que el y el de marzo del jugara partidos amistosos de visita ante australia.\n esta es su primera convocatoria. la mayoria de jugadores, como moises caicedo o enner valencia, estuvieron en el mundial qatar .\n de los convocados,\xa estuvieron en qatar . solo jose hurtado, junior sornoza y alexander alvarado no fueron considerados por gustavo alfaro, entonces dt de la tri.\n en la lista de sanchez resaltan tambien otros cracks ecuatorianos que se destacan en equipos de europa como piero hincapie, pervis estupinan y otros.\n ""en breve vamos a sacar la lista.\xaevidentemente estaran muchos de los jugadores\xaque estaran en el pasado mundial porque tienen el nivel y porque se lo merecen"", explico felix sanchez en la rueda de prensa de presentacion el de marzo del .\n inmediatamente indico que ""no es una lista cerrada"" y que las puertas de la seleccion de ecuador estaran abiertas para todos los jugadores.\n el debut de felix sanchez con la seleccion de\xaecuador se dara el de marzo\xaante australia en el commbank stadium de sydney.el de mismo mes jugara nuevamente contra los australianos, pero en el marvel stadium de melbourne.\n ",piero hincapi,es,2023-03-16T20:19:38Z
"el fenerbahce de enner valencia y el bayer leverkusen de piero hincapie jugaran los partidos de octavos de final de la uefa europa league, este jueves de marzo de .\n el primero en entrar en accion en el partido de revancha de los octavos de final de la europa league sera el\xafenerbahce de turquia, cuadro del goleador ecuatoriano enner valencia, que recibira al sevilla de espana.el partido entre el fenerbahce y el sevilla se jugara desde las : (hora de ecuador).\n se espera que mas de personas lleguen hasta el ulker fenerbahce sukru saracoglu stadium en estambul, para alentar a su equipo en su intencion de seguir en la europa league.\xaen el partido de\xaida el sevilla fue mas practico y gano por -\xacon tantos de joan jordan y erick lamela. con esta ventaja llegan a la revancha y saben que tienen todas las cartas a su favor para terminar de inclinar la serie en su favor.\ub\n partido: fenerbahce vs. sevillahora: :estadio: ulker fenerbahce sukru saracoglutransmite: star+\ub\n a las : es el turno para el\xabayer leverkusen que visita al ferencvaros\xaen el puskas arena park de budapest, la capital de hungria.en la ida el\xabayer leverkusen se impuso por - al ferencvaros\xacon tantos del aleman kerem demirbay y del burkines edmond tapsoba. con este resultado llegan con una ventaja mas que interesante para pasar de ronda.en los alemanes se espera que ocupe la\xatitularidad en el bloque defensivo el ecuatoriano piero hincapie, titular indiscutible ya sea en la linea de tres o como carrilero por izquierda, dos esquemas que xabi alonso practica en la bundesliga y en la europa league.\ub\n partido: ferencvaros vs. leverkusenhora: :estadio: puskas arena parktransmite: star+\ub\n en la conference league, la tercera competencia de clubes en importancia de la uefa, jordy caicedo y nilson angulo tambien tendran accion.a las :\xajordy caicedo y el sivasspor\xareciben sivas arena a la fiorentina. en la ida los italianos ganaron por -.a las :\xanilson angulo y el anderlecht\xavisitan al villarreal en el madrigal. en la ida empataron -.\n ",piero hincapi,es,2023-03-16T17:06:27Z
"el nuevo tecnico de ecuador felix sanchez pretende sacarle todo el potencial a la prometedora camada de jugadores de la seleccion.\n al ser presentado el lunes como nuevo entrenador de la tri, sanchez resalto la calidad del plantel que se clasifico a la copa mundial que se disputo a fines de .\n el estratega espanol afirmo que su mision sera entender lo que es el jugador ecuatoriano, sus caracteristicas, puntos fuertes y debiles,"" y con nuestra manera de trabajar incrementar aun mas su calidad"".\n sanchez, quien dirigio a qatar en el reciente mundial, reemplaza al mando del equipo ecuatoriano al argentino gustavo alfaro, quien estuvo en ese cargo hasta diciembre pasado.\n alfaro y sanchez se enfrentaron en el partido inaugural del mundial de qatar, con ecuador imponiendose -. los ecuatorianos no pudieron sortear la primera fase, al igual que los qataries.\n sanchez, de anos, emprendio su carrera como entrenador en la masia, la renombrada academia juvenil del barcelona de espana. se incorporo despues de la academia aspire de qatar y siguio como timonel en los equipos nacionales del emirato. saco campeon a la seleccion absoluta en la copa de asia y les llevo a las semifinales de la copa de oro de la concacaf en .\n aunque se despidio temprano en su cuarta presentacion mundialista, ecuador no desentono y el equipo tiene un nucleo de jugadores que milita en clubes europeos, muchos que no pasan de los anos.\n tal es el caso del volante de contencion moises caicedo (brighton), el zaguero piero hincapie (bayer leverkusen) y el atacante gonzalo plata (valladolid). tambien estan los laterales pervis estupinan (brighton) y angelo preciado (genk).\n sanchez destaco que buscara siempre un equipo de presion alta y que independientemente en donde esten ubicados ""todos los que quieran formar parte del grupo, tendran que trabajar con la ilusion de ir mejorando partido a partido"".\n en la presentacion, sanchez recibio la camiseta del pais con su apellido y el numero en la espalda, en referencia a la proxima cita mundialista en estados unidos, mexico y canada.\n aun no se ha confirmado la fecha de inicio de las eliminatorias sudamericanas, pero todo apunta a septiembre de este ano. ecuador tambien afrontara la copa america que se escenificara en estados unidos a mediados de .\n el primer desafio para sanchez sera el de este mes cuando visiten a australia para el primero de dos amistosos en ese pais. el otro se jugara cuatro dias mas tarde.\n ""sonamos con los mundiales, con la competencia, con ser parte de ello, con que la seleccion gane y clasifique, pero, sobre todo, sonamos con un futbol ecuatoriano mas grande y que tengamos un pleno crecimiento"", dijo el presidente de la federacion ecuatoriana francisco egas.\n ""hemos decidido tomar decisiones valientes y el camino muchisimo mas dificil"", anadio al explicar la contratacion de un tecnico que no tiene gran reconocimiento y popularidad en ecuador.\n hasta hace poco, ecuador estuvo en negociaciones con el argentino ricardo gareca, pero la negociacion no prospero, debido a que ""tomo mucho tiempo la decision"", de acuerdo con recientes declaraciones de ese tecnico. garece acabo firmando la semana pasada con velez sarsfield en su pais.\n ",piero hincapi,es,2023-03-13T18:50:57Z
"el ecuatoriano\xapiero hincapie\xajugo los minutos el apretado triunfo del bayer leverkusen ante el werder bremen. el equipo del tricolor remonto y vencio -.\n la escuadra farmaceutica llegaba en alza luego de vencer entre semana en la\xauefa europa league. con una impecable actuacion del ecuatoriano, el club se impuso - en el partido de ida de los octavos de final ante el ferencvaros.para el nuevo choque y como ya es costumbre, el defensa ecuatoriano arranco desde el pitazo inicial en el compromiso. durante esta ocasion, el plantel del tricolor visito a sus\xarivales.hincapie se mostro solido, aunque no pudo impedir el primer gol de los locales. estos fueron los primeros en ponerse en ventaja a raiz de una desatencion de los dirigidos por\xaxabi alonso.\xala pelota habia quedado dividida en la cancha del leverkusen, sin embargo,\xaexequiel palacios\xapifio al momento de rechazar un balon. de tal manera, este quedo a merced de los de bremen.\xala jugada desacomodo al defensa de la mitad del mundo que, aunque intento llegar a tiempo a marcar y poner incomodo a un contrincante, fue desbordo. una serie de pases dejo a\xamarvin ducksch\xasolo y frente al arco para poner la primera a la media hora del compromiso.\n el gol definitivo para la victoria del plantel de piero hincapie llego con complicidad de la defensa rival. en esta oportunidad,\xafrimpong volvio a ser protagonista.\xaa los ', el bayer leverkusen atacaba, pero su avance parecia no llevar mayor peligro. el delantero decidio probar suerte desde\xafuera del area\xay el balon impacto en un defensor, que amortiguo el remate y lo dejo casi sin potencia, pero aun con direccion a porteria.\xacon el arquero descolocado por la trayectoria previa, la pelota avanzo lentamente hacia el arco rival. a pesar del esfuerzo de pavlenka por retornar, este no atino a\xadespejar el balon.\xaa los ,\xaadam hlozek\xaaumento la cuenta para los visitantes, sin embargo, el adversario no se resigno. gracias a un penal en instantes posteriores pudo poner el descuento para buscar igualar el marcador, pero no lo logro.el triunfo mantiene al cuadro del ecuatoriano en la novena posicion de la\xabundesliga, pero le permite descontar puntos con los rivales que se encuentran por encima. asimismo, el equipo se acerca a puestos de competiciones europeas, pues esta a solo seis puntos.\n ",piero hincapi,es,2023-03-12T18:51:09Z
"el partido de ida de los ocatvos de final de la uefa europa league fue fructifero para el\xabayer leverkusen y piero hincapie, tras la victoria de - ante el ferencvaros de hungria.\n despues de haber sido eliminados de la fase de grupos de la uefa\xachampions league, el plantel del futbolista ecuatoriano fue relegado hacia la competicion de segundo orden. en primera instancia debio enfrentarse a los clasificados en el puesto dos de los grupos del nuevo certamen.\xael conjunto farmaceutico alcanzo la clasificacion de manera agonica en los dieciseisavos. en su pasado duelo, este quedo con la serie empatada y se definio en penales ante el\xamonaco.\xacon un marcador de\xa-\xaen la tanda desde los pasos, el cuadro aleman obtuvo su boleto hacia la siguiente ronda. los resultados en el primer choque y la revancha fueron de -, en cada uno se impuso el visitante.\n los aficionados no debieron esperar demasiado para que llegase el primer tanto de su escuadra. a los nueve minutos que se haya iniciado el compromiso, el elenco dirigido por\xaxabi alonso\xase puso por encimad del marcador.\xapiero hincapie\xaincidio y fue uno de los gestores para que caiga el primer tanto. como si fuera un mediocampista de recuperacion, el tricolor aprovecho una mala salida del arquero rival y gano metros con la pelota dominada.\xadesde fuera del area, el defensor se animo a probar suerte, pero su remate impacto en un contrario. despues del rebote, la jugada se rearmo y esta vez le quedo a\xakerim demiray.\xael volante aleman no desperdicio su chance y saco un\xaderechazo\xaimposible para el arquero. desde el borde del area, su tiro tuvo potencia y colocacion.\n los alemanes mostraron un desempeno sobrio y controlaron el partido de principio a fin. nuevas ocasiones de gol no se les faltaron, aunque el travesano les\xasalvo del empate\xaen una ocasion.\xael - definitivo llego en el ocaso del segundo tiempo. fue una jugada similar a la que devino en la primera anotacion, aunque este se origino desde un\xatiro libre.\xaadam hlozek\xaejecuto el lanzamiento. este impacto en el vertical y la pelota quedo dividida en el area. el defensa edmond tapsoda la peco y anoto su nombre en el marcador.\xacon la ventaja de - como local, el bayer leverkusen puede ir con mayor tranquilidad hacia hungria para disputar el cotejo de vuelta. la revancha sera el\xajueves de marzo de .\n ",piero hincapi,es,2023-03-09T20:02:02Z
"enner valencia y piero hincapie\xajugaran los dieciseisavos de final de la uefa europa league. los jugadores representaran al fenerbahce y al bayer leverkusen.\n este jueves de marzo de iniciaran los compromisos a ida y vuelta entre los segundos de cada grupo y los clubes que finalizaron terceros en tal fase de la uefa\xachampions league. el primer caso es el del delantero ecuatoriano y el segundo, el del defensor.\xavalencia y el fenerbahce se enfrentaran al\xasevilla\xade espana. el primer choque se llevara a cabo en el estadio ramon sanchez pizjuan a las :, por lo que los turcos seran visitantes.\xacon la escuadra de estambul, 'superman' vive el mejor momento de su carrera y buscara revalidarlo en la competencia internacional. el futbolista es el\xamaximo goleador de la escuadra en la temporada.\xadentro de su torneo local, el artillero lleva\xa goles\xay cuatro asistencias en duelos. en lo que respecta a la uefa europa league, sus tantos son dos, mientras que en la copa de su pais hizo uno.\xapiero hincapie tambien llega en alza con la escuadra alemana. desde que xabi alonso asumio las riendas del equipo, este le ha dado una correccion de rumbo. cuando el dt llego, el\xabayer leverkusen\xase encontraba en puestos de descenso y, ahora, se encuentra en el noveno puesto de la bundesliga, a ocho puntos de torneos europeos.\xaal igual que el sevilla, el plantel farmaceutico tambien abrira la serie como local. su rival sera el\xaferencvaros\xade hungria. este duelo se llevara a cabo ante del que disputara valencia, a partir de las : arrancara.\n el publico podra acceder a los cotejos por medio de television por cable. asimismo, la suscripcion via streaming tambien estara disponible para los interesados.\xafecha: de marzo del .partido: bayer leverkusen vs. ferencvaros.hora: :trasmision: fox sports / star+ fecha: de marzo del .partido: sevilla vs. fenerbahce.hora: :.transmision: fox sports / star+\n ",piero hincapi,es,2023-03-09T15:00:45Z
"los\xajugadores ecuatorianos\xaen el exterior tendran accion desde este viernes hasta el lunes de marzo de en campeonatos profesionales de\xaeuropa y america.\n como siempre, los partidos que mas llaman la atencion son los del\xabrighton\xapor la presencia de los tres ecuatorianos:\xamoises caicedo, pervis estupinan y jeremy sarmiento.'las gaviotas', que recien se clasificaron a los cuartos de final de la fa cup, volveran a las canchas este sabado de marzo cuando se enfrenten al\xawest ham, en el falmer stadium, a las : (hora ecuador).\n un poquito mas tarde, a las : (hora ecuador),\xaenner valencia\xatendra actividad con el\xafenerbahce que se enfrentara al kayserispor por la liga de turquia.\n 'superman' esta viviendo su campana mas goleadora en europa y actualmente es el goleador del torneo\xacon tantos, casi duplicando a su perseguidor fabio borini, que tiene .el domingo de marzo\xaentraran en escena otros jugadores ecuatorianos en el exterior. se destacan gonzalo plata y piero hincapie\xaque tendran actividad con sus respectivos equipos.\n el real valladolid recibira a las : (hora ecuador) al rcd espanyol, con el afan de sumar para alejarse del descenso. mientras que, el bayer leverkusen recibira a las : (hora ecuador) al herta berlin.ecuador tambien tendra presencia en otras ligas de europa como belgica y de america, como estados unidos, mexico, brasil o argentina.\n de marzo: brighton & hove albion vs. west ham\n en el brighton militan moises caicedo, pervis estupinan y jeremy sarmiento.\n de marzo: karagumruk vs. sivasspor: kayserispor vs. fenerbahce\n de marzo: real valladolid vs. rcd espanyol\n de marzo: bayer leverkusen vs. herta berlin\n de marzo: oostende vs. club brujas de marzo: stvv vs. krc genk: antwerp vs. mechelen: gent vs. anderlecht\n de marzo: los angeles fc vs. portland timbers: orlando city vs. fc cincinnati: inter miami vs. philadelphia union: seattle sounders vs. real salt lake: sj earthquakes vs. whitecaps\n de marzo: mazatlan vs. cruz azul: tijuana vs. atlas de marzo: leon vs. atletico san luis: america vs. pachuca: monterrey vs. juarez: chivas vs. santos laguna de marzo: queretaro vs. toluca\n de marzo: newell's vs. barracas central de marzo: independiente vs. instituto: talleres vs. velez\n de marzo: sao-joseense vs. athletico paranaense de marzo: botafogo vs. sao paulo: sao bento vs. bragantino: bahia vs. vitoria: resende vs. botafogo\n ",piero hincapi,es,2023-03-03T16:14:56Z
