data,player,language,publishedAt
"felix sanchez alista su viaje a europa, para reunirse con los jugadores de la seleccion ecuatoriano que militan en ese continente. el itinerario esta definido.\n el recorrido se iniciara en espana y terminara en belica, pasando ademas por inglaterra, turquia, alemania y belgica. la gira del entrenador felix sanchez se extendera desde el de mayo hasta el del mismo mes.\n la nueva agenda de felix sanchez se ejecuta despues de su trabajo con los clubes nacionales. en el pais, el estratega presencio los partidos del campeonato ecuatoriano y visito los entrenamientos de clubes como barcelona, emelec, independiente del valle, liga de quito...\n felix sanchez planifico quedarse entre tres y cuatro dias en cada uno de los paises que visitara. este tiempo le servira no solo para reunirse con los jugares, sino tambien para conversar con los entrenadores que estan al frente de los clubes donde militan.\n asi quedo definido el itinerario:\n del al de mayo - se reunira con gonzalo plata del valladolid\n del al de mayo - estara en inglaterra para conversar con moises caicedo, pervis estupinan y jeremy sarmiento, del brighton\n del al de mayo - su viaje lo llevara a turquia para ver a enner valencia, goleador de fenerbahce\n del al de mayo - se quedara estos dias en alemania para ver a piero hincapie, del bayer leverkusen\n del al de mayo - se reunira en belgica a angelo preciado, que milita en el genk.\n de al de mayo - por ultimo, visitara a william pacho y anthony valencia, del royal antwerp, en belgica.\n el estratega espanol ya prepara lo que seran los siguientes enfrentamientos de la seleccion de ecuador. estos se jugaran el y de junio de ante bolivia y costa rica, segun confirmo la ecuafutbol.\n esos seran los ultimos partidos amistosos antes del inicio de las eliminatorias sudamericanas para el mundial del .\n ",piero hincapi,es,2023-05-07T19:17:38Z
"el bayer leverkusen perdio en casa - ante el colonia en la apertura de la fecha de la bundesliga, con lo que complico sus aspiraciones de llegar a la europa league.\n el partido entre el\xabayer leverkusen vs. colonia se jugo el viernes\xa de mayo de en el bayarena.este encuentro es considerado como uno de los clasicos de la bundesliga por la ubicacion geografica de ambas ciudades, separadas por un poco mas de kilometros.el ecuatoriano piero hincapie fue titular en el bayer leverkusen que dirige el espanol xabi alonso. formo la linea de tres junto al aleman jonathan tah y al burkines edmond tapsoba.el sitio especializado\xasofascore\xale otorgo a\xapiero hincapie una calificacion de , puntos. el mejor jugador del bayer leverkusen ante el colonia fue amine adli con , puntos.\ub\n el colonia puso el - en el marcador a los minutos de iniciado el partido por intermedio de davie selke, delantero aleman de anos que lograba su tercer tanto en la bundesliga.en la jugada de este gol hubo una falta sobre piero hincapie,\xapero ni el juez central y menos el var\xalo consideraron asi, por lo que el tanto subio al marcador.el leverkusen llego al - en el marcador a los\xa minutos con un golazo del mediocampista frances amine adli, quien cristalizo una jugada colectiva que empezo en su propia cancha y termino en el fondo del arco defendido por el portero aleman marvin schwabe.el colonia no sintio el golpe del empate del leverkusen y\xaanoto el - nuevamente con davie selke\xaa los minutos, con un gran golpe al balon con la pierna derecha que poco pudo hacer lukas hradecky para detenerlo.para davie selke este fue el cuarto gol en la temporada. los anteriores los hizo ante bayern munich () y borussia dortmund (), los dos lideres que tiene la bundesliga a cuatro fechas de cerrar la temporada.\ub\n este resultado frena al bayer leverkusen en su objetivo de seguir sumando puntos para alcanzar el cupo a la uefa europa league que esta en manos del rb leipzig.el leverkusen se quedo en la\xasexta posicion con puntos, pero con serias posibilidades\xade ceder su puesto al wolfsburgo, septimo, con puntos y aun con el partido pendiente de esta jornada .en la fecha el bayer leverkusen tiene que visitar al stuttgart en el mercedes-benz arena. el juego esta programado para el domingo de mayo desde las : (hora de ecuador).\n ",piero hincapi,es,2023-05-05T21:06:47Z
"independiente del valle\xaanuncio este viernes de mayo de los pormenores de su nuevo\xacentro de alto rendimiento\xa(car), que estara ubicado en esmeraldas..""independiente del valle le apuesta a la formacion y desarrollo de la juventud ecuatoriana a traves del deporte, por eso invertimos en car en\xaesmeraldas. agentes de cambio que representaran al ecuador por el mundo"", publico idv en sus distintas redes sociales.la publicacion estuvo acompanada de un video donde se muestran jugadas de algunos futbolistas oriundos de esmeraldas y que tuvieron su paso por idv como\xapiero hincapie y william pacho.ademas, en las imagenes se aprecia las canchas y espacios verdes con los que contara este centro de alto rendimiento.""los chicos de esmeraldas podras\xacumplir sus suenos de futuro\xay ser verdaderos 'agentes de cambio'. el car cuenta con cancha de primera,\xainfraestructura de lujo, atencion medica y alimentacion"", informo pablo trujillo, jefe de prensa de independiente del valle.uno de los motivos por los cuales independiente del valle opto por construir su car en esmeraldas fue porque quieren ""potenciar la transversalidad del deporte"" y debido a que la provincia ha brindado una cantidad importante de\xafutbolistas\xaque han dejado el nombre del ecuador en lo mas alto.\n entre los mas recientes estan\xapiero hincapie, william pacho, pervis estupinan, jose cifuentes, felix torres, jackson porozo, robert arboleda y ayrton preciadomientras que, entre los historicos estan enner valencia, alexander dominguez, walter ayovi, jorge guagua, frickson erazo, segundo castillo,\xaivan hurtado, carlos tenorio, neicer reasco, entre otros.\n ",piero hincapi,es,2023-05-05T20:38:57Z
"felix sanchez realizara una\xagira por europa\xapara visitar a los jugadores ecuatorianos que militan en clubes de ese continente. se ha confirmado que tambien se reunira con los ecuatorianos del brighton como moises caicedo, pervis estupinan y jeremy sarmiento.\n una vez finalizado su recorrido por ecuador, donde visito a varios equipos en sus complejos como\xabarcelona sc, liga de quito, independiente del valle, entre otros, y estuvo presente en varios partidos del sudamericano sub y la ligapro, tendra una siguiente tarea con los ecuatorianos en el exterior.durante la rueda de prensa que se realizo en la\xacasa de la seleccion\xaeste viernes de mayo de , felix sanchez confirmo sobre su viaje el 'viejo continente'.""en dias vamos a salir a europa a visitar jugadores que estan afuera. el brighton sera uno de los clubes que visitaremos [...]. la\xacomunicacion con los chicos es importante"", destaco sanchez bas.\n la gira del dt de ecuador y de su cuerpo tecnico tendra una\xaduracion aproximadamente de dias. esta iniciara el y finalizara el de mayo.durante ese lapso, felix sanchez visitara a ocho jugadores de cinco instituciones diferentes.en el cronograma que compartio la federacion ecuatoriana de futbol, los jugadores que recibiran a felix sanchez son: gonzalo plata,\xamoises caicedo, pervis estupinan, jeremy sarmiento,\xaenner valencia, piero hincapie, angelo preciado y william pacho.\n fecha: - de mayojugador: gonzalo plataclub: real valladolid (espana)fecha: - de mayojugador: moises caicedo, pervis estupinan y jeremy sarmientoclub: brighton (inglaterra)fecha: - de mayojugador: enner valenciaclub: fenerbahce (turquia)fecha: - de mayojugador: piero hincapieclub: bayer leverkusen (alemania)fecha: - de mayojugador: angelo preciadoclub: genk (belgica)fecha: - de mayojugador: william pachoclub: royal antwerp (belgica).\n ",piero hincapi,es,2023-05-05T19:39:51Z
"las celebraciones del de mayo en el dia de star wars (\'star wars day\') tambien se realizan en el futbol ecuatoriano. equipos, jugadores y hasta en la seleccion de ecuador se deseo \'que la fuerza nos acompane\'.\n es mas, hay jugadores como el joven \'crack\' ecuatoriano kendry paez que festejan su cumpleanos en esta jornada.\n star wars es la afamada saga de peliculas de ciencia ficcion ha trascendido el mundo del cine para ser parte de la cultura popular de todo el planeta. tanto es asi que el de mayo se festeja el dia de star wars.\n se trata de una fecha en la que los seguidores de la saga celebran por todo lo alto con el \'may the fourth be with you\' (que el de mayo te acompane). la frase se origino en reino unido.\n el \'may the fourth be with you\' (que el de mayo te acompane) es similar al \'may the force be with you\'\xa(que la fuerza te acompane). esta ultima frase es iconica de los poderosos jedis.\n el dia y esas frases no pasan desapercibidas en el mundo del deporte.\n ""hoy juega liga, que la fuerza este con nosotros!"" publicaron los albos de liga de quito en sus cuentas oficiales.\n el mensaje esta acompanado con una imagen de jugadores con trajes de jedis y ademas sables laser, como los que usan los personajes en las peliculas de george lucas.\n ldu jugara desde las : de este de mayo del ante botafogo, en brasil, por la copa sudamericana.\n desde la cuenta en twitter @latri, de la seleccion de ecuador, tambien se realizo una llamativa publicacion con la imagen de piero hincapie y la etiqueta #maythethbewithyou.\n asi, en el mundo entero muchos clubes y jugadores se sumaron a las celebraciones.\n ""yo soy tu padre"", publico el atletico de madrid con una imagen del dt diego simeone. esa frase es una de las mas iconicas en el universo star wars.\n independiente del valle tambien publico una imagen de su joven estrella kendry paez, quien cumple anos este de mayo.\n el futbolista tiene todo arreglado para jugar, desde el , en el poderoso chelsea de la premier league.\n los rayados recordaron el cumpleanos del futbolista y tambien colocaron la etiqueta #maythethbewithyou.\n \n \n \n \n ",piero hincapi,es,2023-05-04T18:08:09Z
"los ecuatorianos william pacho\xay anthony valencia consiguieron su\xaprimer titulo\xaen el futbol de europa, con el royal antwerp.\n el\xaroyal antwerp vencio - al kv mechelen\xaeste domingo de abril de , con goles de vicent janssen y michel-ange balikwisha, y se consagro campeon de la\xacopa de belgica /.el zaguero william pacho, que se unira en el mercado de verano al eintracht frankfurt, fue\xatitular\xay dejo otra gran actuacion defensiva, como lo lleva haciendo toda la campana.pacho disputo ' en la final y en ese lapso realizo tres despejes, una intercepcion, un quite,\xagano de duelos\xay acerto el % de sus entregas.el tricolor de anos fue una de las figuras del royal antwerp durante toda la\xacopa de belgica. william pacho disputo todos los compromisos que jugo su club por esta competencia, que fueron un total de seis, y en dos de esos partidos se fueron hasta los penales.\n por otra parte,\xaanthony valencia\xano tuvo actividad porque se esta recuperando de una lesion muscular, que lo aqueja desde mediados de febrero. sin embargo, el guayaquileno tambien es campeon porque participo en el partido de octavos de final ante standard lieja, donde jugo minutos.\n william\xapacho\xase unio en enero de al royal antwerp, tras un buen paso en independiente del valle.en sus primeros seis meses con el equipo belga apenas disputo tres partidos, sin embargo, en la campana / se hizo con la titularidad.sus buenas actuaciones hicieron que consolide su carrera en\xaeuropa, con solo un ano y medio en el continente. pacho es considerado uno joven defensor con mucho potencial y por eso ya dio otro paso en su carrera a una liga mas imponente.desde la campana /, william pacho defendera los colores del\xaeintracht frankfurt\xade alemania, club con el cual firmo hasta .florian plettenberg, periodista aleman, detallo que el valor de la transaccion se ubica en los millones de euros.william pacho sera el segundo ecuatoriano en alemania en la actualidad, pues en el pais teuton tambien juega\xapiero hincapie, que defiende la camiseta del bayer leverkusen.\n ",piero hincapi,es,2023-05-01T15:58:23Z
"el defensa piero hincapie, del bayer leverkusen, realizo una broma al volante moises caicedo, del brighton. ocurrio a traves de un divertido video.\n tanto el esmeraldeno como el oriundo de santo domingo compartieron las categorias formativas de\xaindependiente del valle. ambos surgieron del club y partieron hacia el extranjero para continuar con sus carreras.\xael futbol los volvio a reencontrar por medio de la escuadra nacional, donde ambos son figuras y fijos en las convocatorias. al dia de hoy, el uno milita en el\xabayer leverkusen\xade alemania y el otro en el brighton de inglaterra, junto con dos compatriotas.\xaen el programa espanol carrusel deportivo, uno de los invitados fue el futbolista del cuadro britanico. antes, el\xazaguero\xadel conjunto aleman se habia dado cita.\xadurante su charla, el defensor dejo un mensaje para moises caicedo, quien lo vio cuando estuvo en su posicion. alli, hincapie bromeo con el jugador del brighton y obtuvo una\xarespuesta\xaentre risas.\xa""\'moi\', hermanito, ?como se siente estar pasando este momento tan bueno con el brighton. espero que puedan clasificar a la champions y que la juegues. un abrazo grande y que dios te bendiga.\xaestas\xamuy bien, tienes que hacer un poco mas de gimnasio porque te veo un poco debil"", menciono el futbolista del leverkusen de manera jocosa.\n apenas finalizo el mensaje de piero hincapie,\xamoises caicedo\xarespondia su amigo. tambien con una sonrisa, este le dijo que no era cierto lo que el mencionaba y le envia sus buenos deseos.\xa""que no se crea, parece que estoy flaco, pero si viene contra mi, se va a chocar. muchas gracias a piero que tambien esta pasando un buen momento.\xaestoy muy feliz de que ambos estemos dejando a ecuador en lo mas alto.\xaseguire trabajando muy fuerte y estoy seguro de que el tambien lo hara"", agrego el tricolor.\xael volante es una de las figuras del\xabrighton\xay mas de uno de los grandes de inglaterra busca incorporarlo a sus filas. con su escuadra se ubica en la zona alta de la tabla y busca ingresar hacia torneos internacionales.\n ",piero hincapi,es,2023-04-28T21:41:09Z
"el bayer leverkusen alcanzo las semifinales de la uefa europa league. el equipo de piero hincapie tuvo un marcador global de - ante el union saint gillon de belgica.\n a pesar de que el marcador y el desempeno en casa no habian sido los esperados por la escuadra de xabi alonso, el empate previo de - dejaba la serie abierta. los belgas esperaban dar las sorpresa y sacar la victoria que se les escapo agonicamente en el duelo previo.\xacon piero hincapie como titular, el elenco farmaceutico se lanzo en busca de la victoria como visitante. el ponerse al frente en el marcador no le costo demasiado y encamino desde un inicio el triunfo.\n el leverkusen no espero demasiado para ponerse en ventaja y, antes de que se cumplan dos minutos de partido, cayo el primer gol. moussa diaby aparecio y demostro sus condiciones como delantero al encarar al golero rival.\xala escuadra alemana gestaba su primer ataque y florian wirtz se lanzo hacia las parcelas contrarias. en su carrera protegio bien la pelota, dejo dos rivales atras y se asocio bien con diaby, quien devolvio de primera.\xaaunque parecia que la pelota se iba a escapar del dominio teuton despues de que quedo dividida, un pase en profundidad logro encontrar al delantero frances. este se interno en el area y eludio al guardameta. aun faltaba mas.\xadespues del dominio de la visita desde los primeros minutos, el partido se puso cuesta arriba para el equipo de belgica y el leverkusen no bajo los brazos. a los , mitchel bakker consiguio poner la segunda anotacion gracias a un veloz contraataque.\n empezado el segundo tiempo, jeremy frimpong llego a los minutos y puso el tercero para los suyo. el union saint guilloin consiguio el descuento gracias a carper terho.\xa a los , adam hlozek sello la goleada y puso el - final en el marcador.\n ",piero hincapi,es,2023-04-20T21:58:46Z
"sevilla\xaelimino al manchester united en la uefa\xaeuropa league. el encuentro, valido por la vuelta de los cuartos de final, se realizo en el estadio ramon sanchez-pizjuan el jueves de abril de . finalizo - a favor de los espanoles.\n el resultado global fue de - y coloco al sevilla en las semifinales de la competicion europea, donde se enfrentara a la\xajuventus, que avanzo hasta dicha instancia tras eliminar al sporting lisboa.\n en esta jornada, el bayer leverkusen del ecuatoriano piero hincapie tambien avanzo a las semifinales de la liga europa.\n con un tremendo derroche fisico, de presion arriba y de tener el control con una buena defensa y mucha efectividad en ataque, los sevillistas no dieron opcion alguna a un united sobrepasado y sin rumbo, que quizas comenzo a perder este cruce de cuartos con el - de la ida, despues de que se hubiera puesto con -, pero que en otra noche grande en nervion no pudo parar a un\xasevilla\xalanzado y que resolvio con los goles de en-nesyri (m. y m.) y bade (m.).el choque\xacomenzo igualado, intenso, pero con el equipo ingles mas suelto y queriendo pisar terrenos peligrosos, sobre todo con la movilidad del austriaco sabitzer -bigoleador en el - de la ida- para buscar al tridente formado por antony, martial y sancho, si bien los hispalenses, muy concentrados, presionaron bien y frenaron los tibios intentos visitantes.el sevilla hallo muy pronto el premio a su compromiso, a su lucha denodada para ganar los duelos individuales y no dar facilidades a un conjunto de fuerza y calidad como el dirigido por el neerlandes erik ten hag, al aprovechar a los minutos\xaen-nesyri\xaun robo al borde del area de lamela tras un fallo garrafal de maguire, que no controlo un balon envenenado que le envio de gea, para batirle por bajo.el equipo espanol pudo ampliar su renta, pero ocampos, muy incisivo, como lamela, en la presion y la salida del balon, para desahogar a los suyos, no llego a una dejada de cabeza de en-nesyri que despejo de gea y luego, a minutos del descanso, el propio ocampos marco con la derecha a centro de su compatriota marcos acuna, pero, a instancias del var, el gol fue anulado por fuera de juego del lateral zurdo argentino.antes, el central brasileno marcao se retiro lesionado y llorando a la media hora del partido y fue relevado por suso, con lo que rakitic bajo a la media. en la reanudacion fue\xaten hag el que movio el arbol.\xano le quedaba otra y dio entrada a su maximo artillero rashford ( goles en lo que va de campana, en europa) y al lateral zurdo shaw, otro de los 'tocados'.sin embargo, fue el sevilla el que dio un golpe encima de la mesa que removio los cimientos de un bloque tan solvente como el del united. incansable fisica y mentalmente y superior a su rival,\xalogro el - a los minutos\xacon un cabezazo del central bade en un corner magistralmente botado por rakitic, que dio en el larguero y boto dentro de la meta inglesa.apreto, ademas, al ver la 'pajara' de un manchester united perdido, desconocido y sin rumbo, totalmente superado, pero un remate de rakitic lo desvio, providencial,\xade gea, quien de nuevo tuvo que intervenir para despejar un cabezazo de en-nesyri y, en un barullo posterior en el area, fue el luso dalot el que salvo el gol tras remachar el balon ocampos.pero el cuadro ingles no se rindio y apreto para meterse en el partido. rashford, muy intermitente al no estar aun a tope, no aprovecho un balon en el area al impedirlo un jesus navas descomunal y luego casemiro se topo con bono y eriksen mando fuera una falta peligrosa.para colmo de males para el united, el sevilla no bajo el piston y redondeo su magnifico partido con el -, obra de en-nesyri en el tras un fallo estrepitoso de de gea\xaen su salida al ir a despejar.\n ",piero hincapi,es,2023-04-20T21:46:26Z
"piero hincapie\xafue titular y disputo los minutos con el bayer leverkusen\xaque empato - en casa ante el union saint-gilloise, por la ida de los cuartos de final de la uefa europa league, este jueves de abril de .\n el conjunto de alemania amplio su racha de invicto a partidos consecutivos, gracias al gol de\xaflorian wirtz.la vuelta se jugara el proximo jueves de abril, a las : (hora ecuador), en el estadio lotto park de bruselas\n en los primeros minutos, bayer leverkusen fue el dominador del esferico. el conjunto aleman mantuvo la posesion, pero\xacarecio de profundidad,\xacosa que lo termino perjudicando.durante la primera mitad, los farmaceuticos no realizaron ningun remate a puerta.pese a no controlar mucho el balon, el union saint-gilloise encontro la forma de\xahacerle mucho dano, sobre todo cuando\xavictor boniface\xapisaba el area del leverkusen.a los ',\xaboniface\xacasi se fabrica un gol solo. el delantero nigeriano eludio rivales, se cayo, se levanto y continuo con la posesion del balon para terminar su jugada con un remate que fue atajado por lukas hradecky.en la jugada siguiente, en el tiro de esquina producto del remate de boniface, el conjunto belga tuvo una oportunidad unica, pero el remate de ismael kandouss se estrello en el travesano.la mas clara del bayer leverkusen llego a los ', con un cabezazo de\xapiero hincapie, tras un centro de jeremie frimpong. el remate del ecuatoriano se fue apenas desviado.\n la falta de profundidad y verticalidad le\xapaso factura al bayer leverkusen\xaen la segunda mitad.a los ', victor boniface, el jugador mas peligroso del union saint-gilloise abrio el marcador. el\xanigeriano vencio al guardameta, con un gran remate colocado dentro del area.ya con el marcador en contra, el bayer leverkusen apreto el acelerador y llego en reiteradas ocasiones al area rival, pero le falto eficacia.jeremie frimpong\xase quedo con el grito de gol en la garganta a los '. el carrilero del leverkusen erro un cabezazo dentro del area.finalmente, y tras muchos intentos, el conjunto de xabi alonso encontro el empate gracias a un gran remate de su\xajoya florian wirtz.el aleman saco un\xapotente disparo\xacon su derecha desde fuera del area y vencio al guardameta rival anthony moris a los '.en los ultimos minutos del cotejo, el leverkusen busco la remontada, pero no le alcanzo el tiempo.\n ",piero hincapi,es,2023-04-13T21:28:24Z
