data,player,language,publishedAt
"futbol/champions-league\n analizamos, numeros en mano, a las duplas mas potentes de europa. elegir la mejor es cosa tuya\n erling haaland y kevin de bruyne evidenciaron su gran entendimiento, por enesima vez esta temporada, en la goleada sobre el arsenal (-). el manchester city presume de contar con la \'pareja de moda\' en europa. su \'sociedad ilimitada\' ha lanzado a los de guardiola a por el triplete, pero hay otras duplas que aspiran a conquistar esa \'corona\'. en marca las ponemos todas sobre la mesa. ?y tu de quien eres?\n mucho se ha hablado de la (tirante) relacion entre messi y mbappe. mas aun despues de que francia ganara a argentina en la final del mundial. ""hay mucho respeto entre ellos. tienen una actitud ejemplar despues de los partidos"", destaco galtier.\n sobre el \'verde\', sin embargo, se entienden de maravilla. kylian y leo son la pareja, dentro de las cinco grandes ligas, que mas goles ha \'fabricado\' en comun: . no es una sociedad, todo hay que decirlo, muy equitativa. messi le ha \'regalado\' goles a mbappe mientras que kylian \'solo\' le ha dado tres a leo.\n el binomio del city \'atemoriza\' a europa. haaland y de bruyne han puesto la directa hacia el triplete (liga, copa y champions) y tienen el cruce de semis contra el madrid en la \'mirilla\'.""tienen una conexion especial y se nota. cuando kevin tiene el balon, erling sabe que puede correr y el balon le llegara"", remarca guardiola.\n su entendimiento se traduce en numeros. el noruego y el belga han producido goles de forma conjunta en premier. lo normal es ver a \'kdb\' asistiendo a haaland. asi ha sucedido hasta en ocho ocasiones. ante el arsenal, sin embargo, se cambiaron los papeles. fue erling quien le dio dos pases de gol a \'tintin\'. ""de bruyne es el mejor centrocampista del mundo. su sociedad con haaland ha elevado su juego a una nueva dimension"", apunta kolo toure.\n nadie contaba con ellos... pero el georgiano y el nigeriano estan a punto de guiar al napoles a su primer \'scudetto\' anos despues de maradona.""con \'kvara\' senti empatia desde el primer momento. es muy bueno, pero tambien es un buen chico. eso tambien importa"", senala \'super-mhen\'.\n osimhen () y kvaratskhelia () lideran, respectivamente, la carrera por los titulos de \'capocannonieri\' y maximo asistente de la serie a. entre ambos han producido ocho goles. seis han \'nacido\' de asistencias del georgiano y dos de pases del nigeriano.\n xabi alonso cuenta con la banda derecha mas \'electrica\' de europa. su ubicacion sobre la \'pizarra\' es curiosa. a menudo el carrilero/lateral (frimpong) ocupa posiciones medias mas adelantadas que el teorico mediapunta/extremo (diaby). el excanterano del psg tiene querencia a meterse hacia el medio y eso libera la banda para el neerlandes.\n tienen algo en comun. son dos de los jugadores mas rapidos de la bundesliga. ambos figuran en el \'top \'. diaby ocupa la tercera posicion con una velocidad punta de , km/h y frimpong es quinto, con km/h. su registro de asistencias esta, mas o menos, equilibrado: cinco de diaby a frimpong y tres en el sentido opuesto.\n una sociedad que no vive su mejor momento. y es que mourinho ha retirado a abraham su condicion de titular indiscutible. belotti le esta \'aranando\' minutos en las ultimas semanas al ex del chelsea.\n dybala, en cambio, sigue a su \'bola\'. la \'joya\' esta completando un temporadon: sus goles y ocho asistencias entre todas las competiciones han guiado a la roma a las semis de la europa league y a pelear por la champions \'via serie a\'. ambos, en cualquier caso, \'casan\' bien. dybala le ha dado tres goles a abraham y el ingles le ha \'servido tres tantos en bandeja\' al argentino.\n el argentino y el brasileno han reeditado esporadicamente en paris el gran entendimiento que exhibieron en barcelona. lo han hecho, eso si, a \'cuentagotas\', cuando las interminables lesiones de \'ney\' se lo han permitido. ""no hemos podido jugar juntos todos los partidos, pero creo que el vinculo que hemos ido creando es muy bueno, puesto que la relacion entre nosotros es maravillosa"", advertia neymar en la \'cnn\'.\n los ex del barcelona han forjado seis dianas conjuntamente esta temporada en ligue . messi le ha dado el doble de goles a neymar () que el brasileno al argentino (). veremos si vuelven a jugar juntos... en paris.\n buena parte del liderato del arsenal en premier se ha cimentado, en gran medida, sobre la produccion anotadora de sus extremos. especialmente en ausencia del lesionado gabriel jesus. ""es una pesadilla jugar contra martinelli. es una amenaza constante"", asegura mikel arteta. mas de lo mismo sucede con saka.\n la balanza de su relacion esta un tanto desequilibrada. cinco de los seis goles que han \'producido\' en comun han salido de las botas de saka. el arsenal necesitara la mejor version de ambos para poder pelearle la premier al city hasta el final.\n la \'simbiosis\' de \'el duo de la oscuridad\', como se apodan, esta fuera de toda duda. karim y vini han fabricado goles en comun desde que el brasileno recalo en el real madrid en .\n en laliga -, sin embargo, no han evidenciado ese entendimiento. apenas han conectado en cuatro goles, tres llevan la firma de benzema y uno de vinicius. fuera de laliga si que han mostrado su sinergia. entre champions, copa, mundial de clubes y supercopa de europa se han \'inventado\' goles. vini () es, generalmente, el que hace las veces de asistente. benzema le ha servido en bandeja tres dianas.\n el barcelona va lanzado a ganar laliga, pero ha echado mucho de menos al lesionado dembele en el tramo final de la temporada. lewandowski, por su parte, lidera la lucha por el \'pichichi\' con dianas sin haber completado un curso extraordinario. no le ha hecho falta tampoco.\n ""dembele es el jugador que mas me ha sorprendido del barca"", reconoce el polaco, que ha notado como sus cifras se resentian en ausencia del extremo frances y de pedri. en total comparten cuatro goles en comun en el marco de laliga. dembele ha asistido en dos tantos a lewandowski, los mismos que le ha dado \'lewy\' a ousmane.\n griezmann se ha erigido, especialmente tras el mundial, en el \'mvp\' del atletico y en uno de los mejores jugadores de laliga. el ex de la real sociedad y barcelona esta muy por encima, a nivel de rendimiento, del resto de sus companeros.\n si nos cenimos a las estadisticas, su mejor socio es alvaro morata. es con el que mas goles () ha producido en comun. tres dianas le ha dado griezmann a morata. en el sentido contrario solo ha llegado una. ""antoine es fundamental para nosotros dentro y fuera del campo"", admite alvaro.\n penaldu\n valverde y yabusele, los mas temibles\n lot\n muy buenos vinicius y benzema, y normal la avalancha de amor madridista en este diario, pero porque es tan dificil opinar con objetividad ?\n siguenos en'}\n ",jeremie frimpong,es,2023-04-30T05:23:36Z
"los tres objetivos son: \n juan foyth (villarreal), \n jeremie frimpong\xa(leverkusen) y \n diego dalot (manchester united)\n :sergio ramos negocia con el psg\n ya han empezado las negociaciones entre el \n psg y \n sergio ramos para la renovacion del contrato del ex defensa del real madrid\xaporque el club parisino si considera que ramos es una pieza clave en el\xaproyecto",jeremie frimpong,es,2023-05-07T06:33:25Z
"de hecho, pese a que el atletico cuenta con lateral de primer nivel por mucho tiempo, hasta concretamente, lo cierto es que el argentino seria por rendimiento (no hay once sin su presencia y solo griezmann y de paul han repartido mas goles), edad (a sus anos aun tiene toda una carrera por delante), posicion (apenas alexander-arnold o jeremie frimpong le hacen sombra en las cinco grandes ligas) y presente (ya es un fijo tambien con argentina, con quien colecciona un mundial, una copa america y una finalissima) el futbolista mas valioso en su escaparate",jeremie frimpong,es,2023-05-07T05:33:25Z
"los que mas han sonado o son muy caros (joao cancelo, juan foyth) o tienen el mismo condicionante deportivo que kounde (benjamin pavard) o son un recurso (diogo dalot) o\xason una apuesta (jeremie frimpong) que ultimamente no le ha acabado de salir al barca (sergino dest)",jeremie frimpong,es,2023-05-06T13:51:24Z
"jeremie frimpong, diaby y adli, los lideres del equipo de xabi alonso, nunca tuvieron opcion de explotar su velocidad ante un rival fuerte fisicamente y muy solido en defensa",jeremie frimpong,es,2023-05-05T20:41:35Z
"ya en quinto lugar, jeremie frimpong ( regates, % exito), del bayern leverkusen de xabi alonso",jeremie frimpong,es,2023-05-24T07:33:38Z
al cuarto de hora abrio el marcador el frances amine adli a pase de piero hincapie y cinco mas tarde amplio su ventaja con un cabezazo de kerem demirbay a un centro de jeremie frimpong,jeremie frimpong,es,2023-05-21T20:25:27Z
"\n tambien es cierto que el equipo aleman pudo haber logrado el empate en el tramo final del partido, cuando el defensa bryan cristante impidio con el pecho un gol de jeremie frimpong",jeremie frimpong,es,2023-05-12T10:04:11Z
"!puedes utilizar tu nombre de usuario y contrasena existente de formulatv!\n \n \n \n \n ?no tienes cuenta? registrate gratis o utiliza tu red social favorita\n ?contrasena olvidada? recuperala\n conectar con twitter\n conectar con facebook\n conectar con google\n critica\n critica de 'asterix y obelix: el reino medio', dirigida por guillaume canet, escrita por canet, julien herve y philippe mechelen. con canet, gilles lellouche, vincent cassel, marion cotillard y jonathan cohen.\n anos han pasado desde que la saga en imagen real de 'asterix y obelix' estuviese epor ultima vez en la gran pantalla con aquel infame titulo llamado 'asterix y obelix: al servicio de su majestad'. aunque la franquicia ha logrado tener mucho mas exito con sus reboots animados, tanto 'asterix: la residencia de los dioses' como 'asterix: el secreto de la pocion magica' fueron magnificas y demostraron que los galos aun tenian mucha guerra que dar en la animacion; los productores han optado por apostar por un reinicio en su vertiente live-action con 'asterix y obelix: el reino medio', con el que la saga busca su sitio en la taquilla actual.\n el resultado es que supera, con creces, a las dos ultimas entregas de la saga original, tanto 'al servicio de su majestad' como la olvidable 'asterix en los juegos olimpicos'. eso si, no llega al nivel que tuvo la notable 'asterix y obelix: mision cleopatra', considerada la mejor cinta en su vertiente live-action. de hecho, a 'el reino medio' se le ven las costuras en lo referente a tener como protagonistas a la princesa de la china imperial y a su leal guardaespaldas, con claras intenciones de ser uno de los titulos extranjeros en ser estrenados en salas comerciales del gigante asiatico.\n pero, mas alla de esto, lo cierto es que 'asterix y obelix: el reino medio' es un entretenimiento familiar ideal para tener un momento de desconexion en la gran pantalla, con escenas que logran sacar carcajadas en la sala, lo cual es meritorio. tiene la virtud de recuperar el espiritu aventurero de las dos primeras entregas de la franquicia, poniendo el foco en sus dos protagonistas. canet opta por hacer vivir a asterix una crisis existencialista, en clara sintonia con los problemas de la sociedad occidental actual, con un galo que busca comer de manera mas sana y ecologica.\n aunque quien luce mucho mejor en este reboot es obelix. el amigote gigante de asterix no lo tenia nada facil, pues gerard depardieu habia hecho suyo al personaje. gilles lellouche no ha renunciado a su cuerpo atletico (el actor cuida mucho su fisico, al tener varios proyectos de cintas de accion, que compagina con comedias y dramas), aunque eso no le impide sabe traer el espiritu carismatico y entranable del gordinflon galo. es mas, diriase que su evolucion en la cinta es mucho mas coherente y madura frente a la crisis existencialista de asterix. de hecho, a obelix le ponen un amor si correspondido.\n ahi es donde entran en escena las protagonistas femeninas. da gusto que la saga continue el espiritu de sus contrapartes animadas y le de mayor fuerza a sus personajes femeninos. la princesa fo yong, interpretada por julie chen, bien podria ser pupila de la valentia de mulan; con su fiel guardaespaldas wang tah, encarnada por leanna chea, personaje mucho mas interesante, al ser el interes amoroso de obelix, gracias a su habilidad con las artes marciales.\n eso si, quien logra robarse el show es el julio cesar de vincent cassel. el actor muestra su lado mas irreverente con un personaje que sabe cumplir con su papel de villano carismatico. cassel, ademas, cuenta con secundarios que son comicos de primer nivel, como jose garcia, bun hay mean o manu payet. los tres le dan ese toque de pimienta necesario a la cinta para crear momentos sardonicos.\n aunque el film se ha convertido en una de las producciones francesas mas caras de la historia (ha costado millones de euros), eso no quita en que tiene ciertos momentos en los que parece que, precisamente, los efectos visuales o el diseno de produccion no dejan de tener la sensacion de estar ante un producto low-cost (y eso que no lo es), algo que desluce el resultado final. eso sin contar que tiene ciertos momentos humoristicos algo trasnochados.\n a pesar de ello, 'asterix y obelix: el reino medio' resulta entretenida e ideal para vivir un momento de desconexion en la gran pantalla. eso si, se queda muy lejos de la mirada acida y satirica de sus contrapartes animadas, que gozaban de mayor complejidad. eso no quita que no pueda disfrutar de esos momentos en los que los galos hacen morder el polvo a los romanos. un regreso con visos de convertirse en una nueva saga.\n nota: \n lo mejor: ver a obelix brillar con un nuevo actor y una trama mayor respecto a la saga original.\n lo peor: tiene varios chistes trasnochados y su vestuario, diseno de produccion y efectos visuales ofrecen, en algunos momentos, la sensacion de ser una produccion low-cost (sus millones de euros en presupuesto afirman lo opuesto, asi que llama la atencion). lo desaprovechada que esta la cleopatra de marion cotillard.\n 'asterix: el secreto de la pocion magica': la importancia del saber\n 'asterix: la residencia de los dioses': a la conquista de los mas pequenos\n 'super... ?quien?': parodia superheroica\n 'dios mio, ?pero que nos has hecho?': reunion de consuegros\n trailer espanol 'asterix y obelix: el reino medio'\n :copyright: - ""}\n ",jonathan tah,es,2023-02-03T07:35:00Z
"corrian apenas ocho minutos del primer tiempo de un encuentro que no encontraba un dominador claro cuando, en una jugada en principio de muy poco peligro, el defensor jonathan tah eligio tocar hacia atras para su arquero, lukas hradecky, ante la presion del conjunto monegasco",jonathan tah,es,2023-02-16T20:45:18Z
"jugo como lateral izquierdo en la linea de cuatro conformada ademas por el aleman jonathan tah, el burkines edmond tapsoba y el neerlandes jeremie frimpong",jonathan tah,es,2023-02-16T22:09:36Z
